pub_date,snippet
2001-12-22 05:00:00+00:00,"Ben Cooper, editor, Small Companies Selector..BSS Group PLC, a plumbing-products distributor, has been around in one form or another since 1899, yet a year ago, its future seemed uncertain. Its net profit dropped by 53 percent in the year ending M..."
2001-12-22 05:00:00+00:00,Kawasaki Steel Corp to buy rival NKK Corp for 314 billion yen ($2.5 billion) in stock (S)1
2001-12-22 05:00:00+00:00,University of
2001-12-22 05:00:00+00:00,C Michael Armstrong's performance as AT&T chairman assessed in light of his plan to sell company's cable television business to Comcast and join what will be renamed AT&T Comcast as chairman; he has failed to realize original plan of creating vast...
2001-12-22 05:00:00+00:00,World Business Briefing
2001-12-22 05:00:00+00:00,"With 2002 just around the corner, Money Report correspondents asked some of their favorite analysts and portfolio managers for investing ideas for the coming year.. ASIA/PACIFIC. Steven Milunovich and Zhen-Hong Fan, Merrill Lynch & Co.. Technology..."
2001-12-22 05:00:00+00:00,"AFTER A YEAR like 2001, analysts, economists and professional investors are expressing apprehension about what the next one may bring for the financial markets..If there is a unifying theme to their forecasts, it is that stocks will do well, based..."
2001-12-22 05:00:00+00:00,Bush administration's intense effort to find possible link between Iraq and anthrax attacks continues even after scientists determine that lethal germ is American strain; scientists and government officials say largely secret work has found no evi...
2001-12-22 05:00:00+00:00,"ACLN Ltd, Belgian company that trades on New York Stock Exchange, says its financial statements are accurate and that it has been unfairly attacked by short sellers; NYSE lifts trading halt on company's shares (M)"
2001-12-22 05:00:00+00:00,"Charles Carlson, portfolio manager, Greenspring Fund..Mr. Carlson, who sticks with a deep-value strategy no matter what style is in fashion, had a good 2001: his fund is up 8.3 percent, while most major stock-market averages have fallen..His pench..."
2001-12-22 05:00:00+00:00,Analysis of economic outlook; holds Main Street does not share Wall Street's optimism about solid rebound next year; cites lurking problems that could slow recovery; notes consumers apparently have not felt full impact of some supposedly positive ...
2001-12-22 05:00:00+00:00,"Analysis of economic crisis in Argentina, country whose economy was comparable to that of United States at turn of last century; says country's unfulfilled promise is rooted deep in its history of civil wars, military and guerrilla uprisings, and ..."
2001-12-22 05:00:00+00:00,"Former Enron Corp chief executive Jeffrey K Skilling denies wrongdoing, interview; says he was stunned by Enron's collapse in wake of his Aug resignation and by disclosure that Andrew S Fastow, his former right-hand man, made over $30 million from..."
2001-12-23 05:00:00+00:00,"Carole Gould column profiles Gene W Henssler, manager of Henssler Equity fund; photo; chart (M)"
2001-12-23 05:00:00+00:00,Jonathan Fuerbringer column says it is possible that stock market rally anticipated for 2002 has already happened and that selloff in bond market is also at an end; notes that housing market was not affected by recession and therefore cannot fuel ...
2001-12-23 05:00:00+00:00,"A Bond Man's Eye View, From Behind the Camera  James A. Lebenthal spent 38 years in the family business, Lebenthal & Company, selling tax-free municipal bonds. Now that he has passed the boss's seat to his daughter, Alexandra, Mr. Lebenthal, 73, i..."
2001-12-23 05:00:00+00:00,Gretchen Morgenson article says Enron Corp's collapse has raised new concerns about billions of dollars of debt that has been shunted off the books of American corprations; says it is hard to determine extent of such debt; says financial service b...
2001-12-23 05:00:00+00:00,"Article on movies this season that are centered around loss of memory, including The Majestic starring Jim Carrey, Memento starring Guy Pearce, Mulholland Drive starring Laura Harring and Naomi Watts and Vanilla Sky starring Tom Cruise; photo (M)"
2001-12-23 05:00:00+00:00,Summary of week's market developments (S)
2001-12-23 05:00:00+00:00,"Advertising by financial institutions make home equity loans alluring and home equity lines of credit seem like ideal way to supply cash to homeowners, but borrowers should be aware of certain hazards; table of do's and don't's; photo (M)"
2001-12-23 05:00:00+00:00,"Margy Rochlin profiles Swiss-born film director Marc Forster, whose latest project, Monster's Ball, starring Billy Bob Thornton and Halle Berry, may gain him recognition as one of Hollywood's hottest new talents; photo (M)"
2001-12-23 05:00:00+00:00,Analysts comment on outlook for fuel cell industry and particular companies in it; shares of fuel cell companies soared to triple-digit gains in 2000 and plunged as much as 95 percent in 2001; chart (M)
2001-12-23 05:00:00+00:00,"Two of worst-performing Berger stock mutual funds, Berger New Generation and Berger Select fund, will be merged into other funds; Berger is subsidiary of Stilwell Financial (S)"
2001-12-23 05:00:00+00:00,"Merck and other pharmaceutical companies encounter resistance to practice of continually promoting new drugs, typically with higher prices, that are sometimes no better than older ones; resistance comes from consumers, who are bearing more of cost..."
2001-12-23 05:00:00+00:00,"Article traces history of pair of 18th-century saddle pistols, worn into battle in America by Marquis de Lafayette, who gave them to George Washington as reminders of their commitment to liberty; Washington bequeathed them to Andrew Jackson, who p..."
2001-12-23 05:00:00+00:00,"DIARY The Corporate Concerns Of Fund Managers  Mutual fund managers and other big investors are worried that corporate boards may not be acting in the best interests of shareholders, according to a survey conducted last week."
2001-12-23 05:00:00+00:00,"Gerson Lehrman Group, Leerink Swann & Co and Off the Record Research, boutique research firms, connect investors with industry specialists to provide information difficult to get elsewhere; many investment professionals do not trust depth, objecti..."
2001-12-23 05:00:00+00:00,"Inside NFL column considers possible replacement for George Young, former vice president of football operations for NFL who died on Dec 8; according to NFL officials, John Beake will most likely take over job; New York Jets defensive coordinator T..."
2001-12-23 05:00:00+00:00,"Gretchen Morgenson Market Watch column interviews James Paulsen, chief investment officer at Wells Capital Management, who fears that current optimism in stock market is unreal; he believes that recession will end and that earnings will improve bu..."
2001-12-23 05:00:00+00:00,"Dancer Michael Flatley reportedly wants to raise $145 million through public stock offering in his company, Unicorn Entertainment; photo (S)"
2001-12-23 05:00:00+00:00,Broadgate Consultants survey of mutual fund managers and large investors finds that 70 percent have concern that corporate boards may not be acting in best interests of shareholders; they are unhappy about potential diluting effect of rising numbe...
2001-12-23 05:00:00+00:00,Scene at Kirna Zabete shop on Greene Street in Manhattan described as 100 or so specially-invited men shop after regular hours during holiday party for items for women in their lives; photo (M)
2001-12-23 05:00:00+00:00,Experts suggest six ways people can improve their financial health in 2002 (M)
2001-12-24 05:00:00+00:00,"John Guedel, radio producer and television pioneer, dies at age 88; photo (M)"
2001-12-24 05:00:00+00:00,Rising tide of shoplifters adds to woes that erode retailers' profit margins; events of Sept 11 seem to escalate pilferers' compulsions for thievery (M)
2001-12-24 05:00:00+00:00,"Alain Levy, recently appointed chief executive of EMI Recorded Music, is busy trying to revive his EMI Group subsidiary and excise memory of ousted Ken Berry, under whose leadership subsidiary disintegrated and was fraught with strife; is making n..."
2001-12-24 05:00:00+00:00,"Bell Canada Enterprises' range of products includes conventional and wireless telephone operations, Internet provision services, broadcast, satellite and cable television and major newspaper; critics say BCE has become unwieldy amalgam of business..."
2001-12-24 05:00:00+00:00,Roberta Smith reviews Laura Claridge's Norman Rockwell: A Life; photo (M)
2001-12-24 05:00:00+00:00,"Hewlett-Packard sets its sights on 96 percent of printing industry volume still produced on traditional offset presses, hoping that hundreds of thousands of customized catalogs and other reports will be printed on its next-generation, high-speed d..."
2001-12-24 05:00:00+00:00,"Some stores, including Circuit City, Service Merchandise and Sears, Roebuck, allow people to shop online and then go to store locations to pick up merchandise they bought on store's Web site; customers save shopping hassles and hefty shipping char..."
2001-12-24 05:00:00+00:00,"Microsoft will pay $500 million for 3.2 percent ownership of Korea Telecom, giving it potential for selling wide range of services through South Korea's leading provider of broadband Internet connections; Korea has world's highest broadband penetr..."
2001-12-24 05:00:00+00:00,"THE MUTUAL FUND, one of the great democratic inventions of the 20th century, seems to have gone astray. A mutual fund is a portfolio of stockson average, about 100 — grouped around a theme. It gives two benefits to small investors: professional st"
2001-12-24 05:00:00+00:00,"As the dust begins to settle in Afghanistan, it is increasingly clear that the big winner in terms of post-Sept. 11 energy politics is Russia, which now rivals Saudi Arabia as the world's dominant energy producer..Since oil and politics tend to fl..."
2001-12-24 05:00:00+00:00,
2001-12-25 05:00:00+00:00,
2001-12-26 05:00:00+00:00,"Con Ed, which in past has aroused ire of New Yorkers with blackouts, accidents and some of highest electricity rates in country, wins new measure of respect in a tumultuous year; politicians and regular New Yorkers applaud utility for dispatching ..."
2001-12-26 05:00:00+00:00,"Brief profiles of some of victims of World Trade Center attack: Gavin Cushny, Thomas Butler, Steven Coakley, Patrick McGuire, Joseph Mathai, Sal Fiumefreddo, Joe Romagnolo, Ken White, Neil Leavy, Christopher Pickford, Madeline Amy Sweeney, Frederi..."
2001-12-27 05:00:00+00:00,
2001-12-27 05:00:00+00:00,"Air travel in Russia, where there are no desireable travel alternatives, has been relatively untouched by Sept 11 terrorist attacks on United States that spurred global collapse in air traffic; Russian air travel rose 12 percent from Sept through ..."
2001-12-27 05:00:00+00:00,"Editorial opposes three options offered by Pres Bush's commission on privatizing Social Security, noting they would all require drastic benefit cutbacks and large infusions of money from outside system; holds Congress is unlikely to act on Social ..."
2001-12-27 05:00:00+00:00,World Business Briefing
2001-12-28 05:00:00+00:00,Yen falls against dollar for 11th straight day as Japan systematically nudges currency lower; has lost nearly 7 percent of its value in Dec alone as Japan tries to fight its way out of recession by devaluing its currency; China and South Korea are...
2001-12-28 05:00:00+00:00,World Business Briefing
2001-12-28 05:00:00+00:00,Floyd Norris column on record $56.1 billion loss posted by JDS Uniphase and implications of new accounting rule that will force companies to quickly write off mergers that have gone bad; notes JDS Uniphase wrote off over $51 million in bad acquisi...
2001-12-28 05:00:00+00:00,"Walter B Hewlett, oldest son of Hewlett-Packard co-founder, makes preliminary proxy filing calling proposed $24 billion acquisition of Compaq Computer over-priced and unnecessarily risky; urges shareholders to vote against it (M)"
2001-12-28 05:00:00+00:00,"Barrick Gold of Toronto wades into takeover battle over Normandy Mining of Australia, with plans for closer cooperation with AngloGold of South Africa if AngloGold's bid for Normandy succeeds; AngloGold is vying with Newmont Mining for control of ..."
2001-12-28 16:40:00+00:00,"In this lesson, students reflect on the events, people and attitudes of 2001 and create posters focusing on political, economic and social topics of the past year. Students then look ahead to what they hope 2002 will bring."
2001-12-29 05:00:00+00:00,"Many investors will be happy to see the end of 2001. Unless you had your money in Mexico or Australia, or you were an extraordinarily good stock picker, you probably lost money on your equity investments, got scant returns on your deposit accounts..."
2001-12-29 05:00:00+00:00,"IN OCTOBER, the Money Report focused on Royal Dutch/Shell Group at a time when analysts and fund managers were lambasting the giant British-Dutch oil company after it had scaled back its production projections, apparently putting short-term saving..."
2001-12-29 05:00:00+00:00,Japan's government says it is considering pumping public money into nation's beleaguered banks for second time in three years (M)
2001-12-29 05:00:00+00:00,"EUROPE FRANCE: UNEMPLOYMENT RISES Unemployment in France rose 0.1 percentage point to 9 percent in November, the seventh consecutive monthly increase, the government said. The number of jobless people rose by 33,000 from October's levels to slight..."
2001-12-29 05:00:00+00:00,Portraits of Grief; brief sketches of victims of Sept 11 attacks on World Trade Center; photos (L)
2001-12-29 05:00:00+00:00,
2001-12-30 05:00:00+00:00,Fundamental changes in economy are likely to restrain recovery from current recession; economists say that today's more stable economy means less severe downturns than heretofore and less robust booms; photos; charts (M)
2001-12-30 05:00:00+00:00,"Many of world's richest people lost hundreds of millions, even billions, of dollars in investments during 2001; energy sector and telecommunications companies provided most of losses, some to famous investors whose pain and humiliation came under ..."
2001-12-30 05:00:00+00:00,Inï
2001-12-30 05:00:00+00:00,"DIARY S.E.C. Inspection Finds Amex Rules Lack Teeth  The American Stock Exchange has listed many companies that do not meet its requirements, and it has not adequately informed investors about these companies' problems, according to the Securities..."
2001-12-30 05:00:00+00:00,
2001-12-30 05:00:00+00:00,Advice on new tax breaks set to take effect in 2002; cites increased breaks for retirement and college savings (M)
2001-12-30 05:00:00+00:00,Maü
2001-12-30 05:00:00+00:00,"University of California, Berkeley, Journalism School Dean Orville Schell article on remarkable ability of radio talk show host Terry Gross of WHYY's Fresh Air to create rapport with those she is interviewing despite fact that she is rarely in the..."
2001-12-30 05:00:00+00:00,Social Security: Why Not Fix It? To the Editor:.
2001-12-30 05:00:00+00:00,"Gretchen Morgenson Market Watch column announces Augustus Melmotte Memorial Prizes, named after stock manipulator created by Anthony Trollope; winners include Enron Corp, Conseco, Cendant and Hewlett-Packard executives, Republican lawmakers who re..."
2001-12-30 05:00:00+00:00,"Outlook for investing in Japanese stocks discussed; many big companies are trading near 10-year lows, making Japan one of cheapest industrialized markets; index of all top-ranked companies on Tokyo exchange fell 19.6 percent in 2001; graph of long..."
2001-12-30 05:00:00+00:00,Merger specialists Martin Lipton and Steven Koch discuss current business mood and outlook for year to come; interview; photo (M)
2001-12-30 05:00:00+00:00,"Leading figures in Wall Street dealmaking discuss tough year now ended, and hopes for livelier 2002; photos; graphs (M)"
2001-12-30 05:00:00+00:00,Interview with Steve Galbraith (Morgan Stanley) on stock market outlook for 2002; photo (M)
2001-12-30 05:00:00+00:00,Stock market performance in week ended Dec 28 reviewed; graphs; tables (S)
2001-12-30 05:00:00+00:00,Looking Back column reviews year in sports; photo (M)
2001-12-30 05:00:00+00:00,"Article on possibility that, in wake of sharp drop in air travel since September 11 terrorist attacks in US, number of airlines in Europe will drop; European Union's market rules prohibit governments from subsidizing airlines; Europe's extensive n..."
2001-12-30 05:00:00+00:00,Letter from D Scott Malsin on why he opposes Social Security privatization plans that allow investment in stock market
2001-12-30 05:00:00+00:00,"In-Q-Tel, venture capital company set up and financed by CIA, is just one example of governments's new willingness -- particularly after Sept 11 -- to tap private sector for help in finding and quickly bringing to market technologies with national..."
2001-12-30 05:00:00+00:00,"Securities and Exchange Commission report shows American Stock Exchange has listed many companies that do not meet its requirements, and it has not adequately informed investors about these companies' problems; says about 10 percent of 704 compani..."
2001-12-30 05:00:00+00:00,"Micky Arison, determined chief executive of Carnival Corp, faces strong opposition in bid for control of P & O Princess Cruises, coveted brand that is one of last major acquisition candidates in cruise ship industry; photo; Arison has courted comp..."
2001-12-31 05:00:00+00:00,New View
2001-12-31 05:00:00+00:00,"JIM ROUMELL calls himself a ""deep-value investor"" .that is, he looks for significant bargains among unloved stocks. There is nothing new in that, but Mr. Roumell has a specific strategy that is both unusual and logical..Most value mavens con"
2001-12-31 05:00:00+00:00,Brief profiles of some of victims of World Trade Center terrorist attacks; photos (L)
2001-12-31 05:00:00+00:00,"Palm Inc faces major challenges in 2002; new chairman-chief executive Eric A Benhamou has vowed to correct missteps of 2001; Palm will push harder for growth in its platform division, which licenses Palm operating system to some of those competing..."
2001-12-31 05:00:00+00:00,
2001-12-31 05:00:00+00:00,"Under the tightest security procedures ever, New York City prepared today to mark the arrival of the New Year, using the occasion to again pay homage to the victims and heroes of Sept. 11."
2002-01-01 05:00:00+00:00,"Stock prices fall on final trading day of 2001; three major stock market averages have fallen for two consecutive years; Dow Jone industrial averages ends 2001 down 7.1 percent, after 6.2 percent drop in 2000; Standard & Poor's 500 stock index end..."
2002-01-01 05:00:00+00:00,"Last three months of 2001 are wonderful for foreign stocks--even with fallout from terrorist attacks and global recession; still, first positive quarter in last seven makes year only a little less painful; foreign equities, including stocks in eme..."
2002-01-01 05:00:00+00:00,"Wall Street bankers have tough time trying to do anywhere amount of business they did in 2000; business has dropped off about 15 percent; most lucrative business, advising companies on mergers and acquisitions, falls by slightly more than half, to..."
2002-01-01 05:00:00+00:00,
2002-01-01 05:00:00+00:00,
2002-01-02 05:00:00+00:00,"To get perspectives on what will happen in the markets this year, Gretchen Morgenson and Floyd Norris of The Times turned to two of Wall Street's most respected strategists, and to one man who started a hedge fund just a few days before the stock ..."
2002-01-02 05:00:00+00:00,Some individual investors are not giving up on stocks despite declines in prices for two consecutive years; Pittsburgh residents David J Sunseri and Kay Barry comment; photos (M)
2002-01-02 05:00:00+00:00,"With an economic recovery early this year looking more and more likely, the outlook for stocks appears solid, at least in the near term. Still, analysts warn investors not to get too giddy."
2002-01-02 05:00:00+00:00,"Analysts say default rates on junk bonds will probably rise to new highs in 2002 with economy weak and many companies carrying lot of debt; prospect has not deterred junk bond investors, who returned to market with some vigor in fall of 2001; grap..."
2002-01-02 05:00:00+00:00,"Scarred but largely unbowed, many investors say the stock market is still the place to be, even as they acknowledge that the record bull run of the 1990's was probably a once-in-a-lifetime phenomenon."
2002-01-02 05:00:00+00:00,Article on Dictionary of the Future by Faith Popcorn and Adam Hanft; dictionary examines future of jargon in English language; photo (M)
2002-01-02 05:00:00+00:00,Domestic bonds will have tougher time outperforming stocks in 2002; key variables for volatility and performance are shape of economy recovery that is in consensus forecast for spring and how long Federal Reserve policy makers wait before they dec...
2002-01-02 05:00:00+00:00,
2002-01-02 05:00:00+00:00,Clamor for new offerings has faded with Nasdaq composite index hovering at levels less than half its high during March 2000; economic downturn has also meant that many companies faced delisting for not meeting financial requirements of stock marke...
2002-01-02 05:00:00+00:00,Clamor for new offerings has faded with Nasdaq composite index hovering at levels less than half its high during March 2000; economic downturn has also meant that many companies faced delisting for not meeting financial requirements of stock marke...
2002-01-02 05:00:00+00:00,2001 was the second straight year that domestic bonds have been a better bet than stocks. The question for 2002 is: Can this outperformance continue?
2002-01-02 05:00:00+00:00,Strong US dollar eroded global investments in 2001 and investors cannot expect much help for their foreign investments from dollar in 2002; 5.5 percent decline in euro against dollar turned 19.8 percent fall in Germany's benchmark DAX stock index ...
2002-01-02 05:00:00+00:00,Some individual investors are not giving up on stocks despite declines in prices for two consecutive years; Pittsburgh residents David J Sunseri and Kay Barry comment; photos (M)
2002-01-02 05:00:00+00:00,Domestic bonds will have tougher time outperforming stocks in 2002; key variables for volatility and performance are shape of economy recovery that is in consensus forecast for spring and how long Federal Reserve policy makers wait before they dec...
2002-01-02 05:00:00+00:00,Strong US dollar eroded global investments in 2001 and investors cannot expect much help for their foreign investments from dollar in 2002; 5.5 percent decline in euro against dollar turned 19.8 percent fall in Germany's benchmark DAX stock index ...
2002-01-02 05:00:00+00:00,"Analysts expect stocks to rise only moderately in 2002; Standard & Poor's 500-stock index ended 2001 down 13 percent, second straight year index fell more than 10 percent; Nasdaq composite index performed even more poorly, giving up 21.1 percent a..."
2002-01-02 05:00:00+00:00,"Excerpts of interviews with Abby Joseph Cohen of Goldman, Byron R Wien of Morgan Stanley Dean Witter and Charles I Clough Jr of Clough Capital Partners on direction of economy and stock markets in 2002; say recovery in profits and stocks is coming..."
2002-01-02 05:00:00+00:00,Article on Dictionary of the Future by Faith Popcorn and Adam Hanft; dictionary examines future of jargon in English language; photo (M)
2002-01-02 05:00:00+00:00,"After a year filled with failures in the high-yield debt market, junk bonds are expected to live up to their name again in 2002."
2002-01-02 05:00:00+00:00,"Excerpts of interviews with Abby Joseph Cohen of Goldman, Byron R Wien of Morgan Stanley Dean Witter and Charles I Clough Jr of Clough Capital Partners on direction of economy and stock markets in 2002; say recovery in profits and stocks is coming..."
2002-01-02 05:00:00+00:00,"It is difficult to tell what is in store for the currency market this year because the dollar has had a habit, recently, of defying normal conventions."
2002-01-02 05:00:00+00:00,"Analysts expect stocks to rise only moderately in 2002; Standard & Poor's 500-stock index ended 2001 down 13 percent, second straight year index fell more than 10 percent; Nasdaq composite index performed even more poorly, giving up 21.1 percent a..."
2002-01-02 05:00:00+00:00,"Analysts say default rates on junk bonds will probably rise to new highs in 2002 with economy weak and many companies carrying lot of debt; prospect has not deterred junk bond investors, who returned to market with some vigor in fall of 2001; grap..."
2002-01-03 05:00:00+00:00,"Argentina's decade-long defense of fixed parity between its peso and US dollar appears to collapse, as country's new president, Eduardo Duhalde, signals that Argentina will soon officially devalue peso and as central bank stops requiring nation's ..."
2002-01-03 05:00:00+00:00,"Technology stocks made strong gains today, with the Nasdaq composite index rising more than 3 percent, as hopes for a quick recovery in corporate profits grew despite mixed reports on the economy."
2002-01-03 05:00:00+00:00,"Residents of Redmond, Wash, Microsoft Corp's hometown, are more optimistic than others in region still mired in economic problems; workers at company and other high-tech companies that could gain from Microsoft's prosperity comment; photo (M)"
2002-01-03 05:00:00+00:00,"Computer chip business is source of economic hope in South Korea; Hynix Semiconductor say it has raised prices about 30 percent, its third increase in month; there are also indications Hynix, deep in debt and struggling to revamp, is making progre..."
