pub_date,snippet
2001-01-25 05:00:00+00:00,Special report on crisis threatening genetically modified food industry; notes Monsanto Co's political clout gave industry astonishing control over its regulatory destiny; notes genetically modified ingredients may be in over half of America's gro...
2001-01-25 05:00:00+00:00,EUROPE LONDON EXCHANGE CONFIRMS LEADER The London Stock Exchange confirmed the appointment of Clara Furse as its chief executive and said it was giving greater weight to independent directors by reaching out to a broader pool of business executive...
2001-01-25 05:00:00+00:00,"The following is the text of Federal Reserve Board Chairman Alan Greenspan's prepared remarks to the Senate Budget Committee on January 25, 2001."
2001-01-25 05:00:00+00:00,"California gets host of long-term offers from electricity generators to sell power to state in what many officials call key step toward resolving energy crisis; offers average $69 a megawatt hour, higher than $50-$55 range state sought; Gov Gray D..."
2001-01-25 05:00:00+00:00,"Jack J Mack resigns as president of Morgan Stanley Dean Witter & Co, a move that signals continued hostilities within firm formed in 1997 by merger of Morgan Stanley investment bank and Dean Witter brokerage firm; is replaced by Robert Scott, vete..."
2001-01-25 05:00:00+00:00,"Compaq Corp. expects sales growth in its Europe division to reach double digits this year, outstripping a worldwide rate of 5 percent to 8 percent, Rob Walker, Compaq's European president, told Reuters after the company's fourth-quarter results we..."
2001-01-25 05:00:00+00:00,"Exxon Mobil, Chevron Corp and Texaco Inc say earnings soared in fourth quarter; Exxon Mobil says net income more than doubled, to $5.2 billion from $2.3 billion in year-earlier quarter; revenue rose more than 17 percent, to $64.1 billion; company ..."
2001-01-26 05:00:00+00:00,"Mayor Rudolph W Giuliani proposes $39.32 billion budget plan for New York City; $12.19 billion is earmarked for school system, including pension and debt costs; budget proposal includes $405 million in tax cuts, which, when proposed in past years,..."
2001-01-26 05:00:00+00:00,"Buenos Aires stock market has begun year by soaring 26 percent, easily beating every other stock exchanges in world; impressive rise has led some investors to say that Argentina might be poised to return to days of early 1990's when, with governme..."
2001-01-26 05:00:00+00:00,"WorldCom Inc. is expected to announce plans to lay off more than 10,000 employees, or 13 percent of its worldwide work force of 77,000, as the company seeks to cut costs at some of its slow-growing businesses, people close to the company said toda..."
2001-01-26 05:00:00+00:00,"January 26, 2001"
2001-01-26 05:00:00+00:00,Museum of Modern Art and Whitney Museum of American Art will coordinate complementary exhibitions examing work of architect Ludwig Mies van der Rohe; sales of old master drawings at Christie's and Sotheby's bring record prices and much museum inte...
2001-01-26 05:00:00+00:00,"New International Accounting Standards Board is appointed, with mission of producing coordinated acounting standards within few years; board will be led by Sir David Tweedie, who formerly directed Accounting Standards Board in Britain; Sir David e..."
2001-01-26 05:00:00+00:00,"Wall Street investment banks with big financial stakes in success of energy deregulation are playing important behind-the-scenes roles as officials in California struggle to fix state's troubled electric power system; Goldman, Sachs, which has ene..."
2001-01-26 05:00:00+00:00,"Federal Reserve chmn Alan Greenspan gives his blessing to substantial tax cut, but warns that it should not be so big that it would plunge government back into deficit if federal budget surplus fails to materialize as projected, Senate Budget Comm..."
2001-01-26 05:00:00+00:00,"Op-Ed article by Bruce Tulgan, management consultant, says recent spate of layoff announcements do not mean that US is headed for recession, noting that downsizings have occurred consistently during the last decade, even when the economy was boomi..."
2001-01-26 05:00:00+00:00,"Survey by Douglas Elliman and Miller Samuel real estate companies indicates that Manhattan apartment prices dropped significantly in 2000 as Nasdaq stock index began its plunge, then rebounded substantially in third quarter before slipping again s..."
2001-01-26 05:00:00+00:00,"Mired in a large restructuring effort after several years of disappearing profits, the Gillette Company, a maker of shaving razors and assorted toiletries, reported a $85 million fourth-quarter loss today, but it said that excluding the restructur..."
2001-01-26 05:00:00+00:00,SOFTWARE
2001-01-26 05:00:00+00:00,
2001-01-26 05:00:00+00:00,SOFTWARE
2001-01-26 05:00:00+00:00,
2001-01-26 05:00:00+00:00,"Dow Jones industrial average rises 82.55 points, or 0.8 percent, to 10,729.52; Nasdaq composite index falls 104.87 points, or 3.7 percent, to 2,754.28; Standard & Poor's 500-stock index falls 6.79 points, or 0.5 percent, to 1,357.51; graph; chart ..."
2001-01-27 05:00:00+00:00,The New York Times: Technology-Text Version
2001-01-27 05:00:00+00:00,As supplies keep shrinking to the point where even the staunchest optimists are no longer able to deny the obvious: The temperature rises ever higher in the art market..At Sotheby's sale of Old Master drawings on Tuesday and at Christie's on Wedne...
2001-01-27 05:00:00+00:00,"Despite a loss related to factory closings and employee layoffs, the Gillette Company posted a 3 percent increase in its operating net income for the fourth quarter yesterday, largely on the strength of its razor blade business."
2001-01-27 05:00:00+00:00,
2001-01-27 05:00:00+00:00,
2001-01-27 05:00:00+00:00,"WHEN A BRITISH company reports poor earnings or a loss, reading about it can hurt the eyes, and not just in the figurative sense. Companies on the London Stock Exchange are given great flexibility in how they report financial results, and so the r..."
2001-01-27 05:00:00+00:00,"January 27, 2001"
2001-01-27 05:00:00+00:00,"IN THE EMERGING and converging economies of post-Communist Eastern Europe, annual reports and regular financial data are a bit of a novelty. The best numbers about a company are often reserved for managers who may be its largest shareholders, whil..."
2001-01-27 05:00:00+00:00,Effects on investor behavior of technology market turned sour are tangible; advocates of diversification are no longer dismissed as losers who do not get the new economy; champions of technology stocks are taking back seat as high-tech shares coll...
2001-01-27 05:00:00+00:00,"EVERYTHING-BUT-Bad-Stuff releases: Lynn Turner, chief accountant of the U.S. Securities and Exchange Commission, used that phrase in a speech last fall to describe ""earnings releases published that convey an incomplete or inaccurate picture to inv..."
2001-01-27 05:00:00+00:00,"U.S. INVESTORS may now be shoveling through a blizzard of earnings reports as data rolls in from the fourth quarter of 2000. But in France and Italy, where tradition often obstructs shareholder communications and where disclosure laws are less str..."
2001-01-27 05:00:00+00:00,"Amid skepticism about the success of an auction intended to purchase long-term energy supplies, California legislators debated a bill yesterday that would help the state's biggest utilities recover billions they have lost buying electricity at pri..."
2001-01-27 05:00:00+00:00,"WorldCom Inc. is expected to announce plans soon to lay off more than 10,000 employees, or 13 percent of its worldwide work force of 77,000, in an effort to cut costs at some of its slow-growing businesses, people close to the company said yesterd..."
2001-01-27 05:00:00+00:00,"Comdirect.co.uk , the British arm of a European online broker owned by Commerzbank AG, is offering commission-free purchases on Britain's first exchange-traded fund that invests in Europe's largest companies, the iFTSE ExUK. In addition, Comdirect..."
2001-01-28 05:00:00+00:00,James Schembari Midstream column on selling stock holdings in order to put money away for children's college educations; drawing (M)
2001-01-28 05:00:00+00:00,
2001-01-28 05:00:00+00:00,"J William Rowley, chairman of American Bar Association's Global Forum for Competition Policy, seeks to simplify competition laws internationally and to create consensus among regulators to make antitrust scrutiny of international mergers more cohe..."
2001-01-28 05:00:00+00:00,Comment on Coca-Cola's brainstorming to develop new and varied beverages to give company 'bigger share of stomach' (S)
2001-01-28 05:00:00+00:00,"January 28, 2001"
2001-01-28 05:00:00+00:00,"Interview with Jim McCann, chairman and chief executive of 1-800-Flower.com; McCann notes that while company's name has changed, it is not strictly a dot-com company; company has released stronger-than-expected second-quarter results, reflecting h..."
2001-01-28 05:00:00+00:00,Nancy Newlin letter responds to Jan 14 article about older persons remaining in workforce
2001-01-28 05:00:00+00:00,"Sales of homes listed for more than $1 million jumped 31 percent during 2000 in Westchester and Putnam, NY, counties; photo; map (M) (In the Region/Westchester and Putnam)"
2001-01-28 05:00:00+00:00,
2001-01-28 05:00:00+00:00,"Indexes of 'new markets' established by Europe's traditional stock exchanges to fund new technology companies have fallen further than Nasdaq's, and markets are scrambling both to survive and to establish themselves as pan-European markets; questi..."
2001-01-28 05:00:00+00:00,"Markets end tepid week; Standard & Poor's 500-stock index ended at 1,354.95, up 12.40. or 0.9 percent; Dow industrials also rose, up 73.29, or 0.7 percent, to 10,659.98; Nasdaq climbed to 2,781.30, up 10.92, or 0.4 percent; modest rally in stocks ..."
2001-01-28 05:00:00+00:00,"Kenneth N Gilpin Market Insight column interviews Conrad Herrmann, manager of Franklin Templeton California Growth fund, concerning power crisis and California stocks; photo (M)"
2001-01-28 05:00:00+00:00,"Article profiles Covad Communications, wholesale provider of high-speed Internet connections whose survival of threatened by uncollected bills, a battered stock price, reliance on its competitors to deliver its product and a severe market downturn..."
2001-01-28 05:00:00+00:00,"Big fund companies sometimes increased the returns of their younger funds in 1999 and early 2000 by loading them up with initial public offerings by technology companies; practice, which could mislead investors, has stopped now that technology sto..."
2001-01-28 05:00:00+00:00,"Earthquake Strikes India, Killing Thousands"
2001-01-28 05:00:00+00:00,"Katie Hamill essay on exhorbitant rents in Brooklyn's Park Slope neighborhood, from where she is being forced to move because her landlord has decided to raise her rent for studio apartment $400, to $1,200 a month; photo (M)"
2001-01-28 05:00:00+00:00,"Gretchen Morgenson Market Watch column says that individual stock investors have shown remarkable staying power despite decline of stock prices since March 2000, but that much of their faith may be due to fact that they still retain much of unreal..."
2001-01-28 05:00:00+00:00,"Profile of Westport Small Cap fund and its managers, Edmund H Nicklin Jr and Andrew J Knuth; photo; chart (M)"
2001-01-29 05:00:00+00:00,Anthony Tommasini Critic's Notebook article on New York Philharmonic's search for music director to succeed Kurt Masur; questions decision to consider Lorin Maazel when orchestra needs a young dynamo; photos (M)
2001-01-29 05:00:00+00:00,United States has fallen behind Europe and parts of Asia in wireless technology amid questions about whether companies offering wide range of Internet services via cellular telephone can actually make money; American companies have avoided costly ...
2001-01-29 05:00:00+00:00,"Clash at Time Warner's book-publishing division over how to market literary works published by its Little, Brown & Co imprint lead to resignation of Little, Brown publisher, Sarah Crichton; sales of popular books are booming, making it harder and ..."
2001-01-29 05:00:00+00:00,The New York Times: Technology-Text Version
2001-01-29 05:00:00+00:00,"The chief executive of STMicroelectronics, Pasquale Pistorio, tools around Geneva, where Europe's biggest chipmaker is based, in a hybrid electric-gasoline vehicle. It is a conspicuous sign of his commitment to environmental issues..But the blend ..."
2001-01-29 05:00:00+00:00,"SAN FRANCISCO, Jan. 29 — Validating anecdotal evidence and increasingly conventional wisdom, an analysis released today shows that investing by venture capital firms plummeted in the fourth quarter of last year, with investors shying away from sta..."
2001-01-29 05:00:00+00:00,The AT&T Corporation reported a $1.7 billion fourth-quarter net loss today and said growth this year would come from only its wireless and broadband divisions as the business unit's revenues flatten and the consumer unit's sales decline.
2001-01-29 05:00:00+00:00,"Estimated 5,000 people begin making way on horseback toward Alamo City from Comfort, Tex, in 47-year-old tradition of trail riding that will culminate at opening of 52d annual San Antonio Stock Show and Rodeo; map; photo (M)"
2001-01-29 05:00:00+00:00,News analysis of initiatives by California Gov Gray Davis to solve state's energy crisis; his comprehensive rescue plan could force state officials to think more like business managers than public policy officials and lock them in mind-set for man...
2001-01-29 05:00:00+00:00,"Stilwell Financial, parent of Janus Capital mutual fund family, names Lord Robert Skidelsky to board (S)"
2001-01-29 05:00:00+00:00,"When it comes to finance and information technology, Japan has had little to brag about vis à vis its Western peers..Because of regulatory restraints, the financial industry here has lagged in the innovation and application of new technology. Onli"
2001-01-29 05:00:00+00:00,"LONDON, Jan. 29 - Unilever, the British-Dutch consumer goods giant that bought Bestfoods in the United States last year, said today that it had agreed to sell some of its European sauces and packet-soup businesses to the Campbell Soup Company for ..."
2001-01-29 05:00:00+00:00,Merrill Lynch & Co advertising drive will focus on households with $1 million or more to invest; move is departure from previous campaigns that positioned Merrill as brokerage firm for masses; photo (M)
2001-01-29 05:00:00+00:00,"January 29, 2001"
2001-01-29 05:00:00+00:00,"AUBURN HILLS, Mich., Jan. 29 — The Chrysler division of DaimlerChrysler A.G. announced today that it would reduce its work force by 26,000 people, or 20 percent, over the next three years, mainly by not hiring replacements for retirees but also by..."
2001-01-29 05:00:00+00:00,"The protesters in the streets here might have been railing against globalization and international organizations, but it was clear at the World Economic Forum that many corporate executives feel they are the ones on the front line..Several chief e..."
2001-01-30 05:00:00+00:00,"New Bush administration must appoint thousands of people to jobs, and protracted way in which election was decided adds more uncertainty and delay to job-hunting process; description of job hunting in Washington (M)"
2001-01-30 05:00:00+00:00,"Richard W Bank walked away from successful medical practice 15 years ago to start First-Tier Biotechnology Partners, hedge fund that invests in biotech companies; Bank uses his experience as doctor to analyze drugs before making investment decisio..."
2001-01-30 05:00:00+00:00,"Airbus Industrie reported a record year for aircraft sales on Monday, saying it was getting close to its target of capturing half the world market for airliners of more than 100-seat capacity..Noel Forgeard, Airbus's chief executive officer, said ..."
2001-01-30 05:00:00+00:00,"A new era in the technology revolution is emerging from the rubble of the meltdown last year, according to some of the world's technology industry leaders gathered here. . But it is a period devoid of the giddiness and euphoria of the first phase ..."
2001-01-30 05:00:00+00:00,
2001-01-30 05:00:00+00:00,Goldman Sachs Group agrees to buy Benjamin Jacobson & Sons LLC for about $250 million in cash and stock to expand its floor-trading operation on New York Stock Exchange (S)
2001-01-30 05:00:00+00:00,"The Dow Jones industrial average posted a strong gain today, but most of the stock market remained stagnant as investors awaited the Federal Reserve's next move to cut in interest rates in an effort to revive the slowing economy."
2001-01-30 05:00:00+00:00,DaimlerChrysler said Monday it would cut a fifth of the work force at its unprofitable Chrysler operations and idle or close six manufacturing plants in a three-year restructuring meant to salvage the American carmaker. . The measures come far soo...
2001-01-30 05:00:00+00:00,"Companies are searching urgently for new ways to foster old-fashioned loyalty and commitment among employees, most of whom have little institutional loyalty left after years of downsizings, outsourcings and restructurings; several influential corp..."
2001-01-30 05:00:00+00:00,"Article on accomplishments of departing Securities and Exchange Commission chairman, Arthur Levitt Jr; photos (M)"
2001-01-30 05:00:00+00:00,"Chrysler division of DaimlerChrysler will reduce its work force by 26,000, or 20 percent, over next three years, mainly by not hiring replacements for retired workers but also by laying off thousands of employees; Chrysler's chief executive-presid..."
2001-01-30 05:00:00+00:00,Walt Disney Co decides to abandon Go.com Internet portal site that was once centerpiece of its plan to conquer World Wide Web; Disney says that with spending on Internet advertising slowing down it is not worth trying to compete with leading playe...
2001-01-30 05:00:00+00:00,"Philanthropists are being asked to support an estimated $3 billion in art complex rehabilitation projects in New York City, including Lincoln Center's $1.5 billion redevelopment, Carnegie Hall's $50 million rehabilitation, Museum of Modern Art's $..."
2001-01-30 05:00:00+00:00,"January 30, 2001"
2001-01-31 05:00:00+00:00,"WASHINGTON, Jan. 31 — The Federal Reserve today cut its benchmark interest rate by half a percentage point for the second time this month, making clear that it intends to wage an aggressive battle against the growing possibility of a recession."
2001-01-31 05:00:00+00:00,"Amazon.com, faced with sharp downturn in its sales growth, will close two operations centers and lay off 1,300 people, or 15 percent, of its work force; lost $545 million in fourth quarter, compared with loss of $323 million for writing down value..."
2001-01-31 05:00:00+00:00,"Economic growth in the last three months dropped to its slowest pace since 1995 as companies curtailed investments in new equipment and software, the Commerce Department said today."
2001-01-31 05:00:00+00:00,"Is there a digital divide, or is the economic divide merely going digital?.The gap between people with access to the information economy and those without will continue to worsen without dramatic new efforts by governments and companies. That was ..."
2001-01-31 05:00:00+00:00,"Confronted by withering consumer confidence in the U.S. economy, the Federal Reserve Board is widely expected to reduce interest rates by half a percentage point when its two-day meeting ends Wednesday, a cure likely to revive American growth but ..."
2001-01-31 05:00:00+00:00,"Faced with more signs of a weakening economy, the stock market retreated today after the Federal Reserve cut short-term interest rates by a widely expected half a percentage point in an effort to revive growth."
2001-01-31 05:00:00+00:00,"EUROPE NESTLÉ AND COKE EXPAND PARTNERSHIP Nestlé S.A. plans to expand its joint venture for ready-to- drink beverages with the Coca-Cola Company to enter new markets and segments. Nestlé and Coca-Cola plan to rename their partnership, which has ex..."
2001-01-31 05:00:00+00:00,"European and American banks have raised interest rate premium they charge their Japanese counterparts on short-term loans in recent weeks, small but worrisome sign that financial health of struggling Japanese banking industry may be deteriorating ..."
2001-01-31 05:00:00+00:00,"Pediatricians are debating whether to prescribe MedImmune Inc's drug Synagis, which fights respiratory syncytial virus in babies at cost of about $5,000 for five monthly injections; MedImmune's advertising campaign for drug has parents asking for ..."
2001-01-31 05:00:00+00:00,"Conference Board reports that consumer confidence has taken its biggest single-month plunge since late 1990, when last recession was under way; Americans remain relatively upbeat about current business and employment conditions, but their expectat..."
2001-01-31 05:00:00+00:00,"It seems that the bear every new president must wrestle to the ground is the economy, and George W. Bush is no exception."
2001-01-31 05:00:00+00:00,"Procter & Gamble says sales fell 4 percent in last quarter and that, to counter declines in market share, it is partially abandoning its attempts to raise prices; global sales for quarter ended Dec 31, company's fiscal second quarter, were $10.2 b..."
2001-01-31 05:00:00+00:00,"Charles Schwab Corp tells about half of its employees not to show up for work on three Fridays in next five weeks; stretching out weekends will bolster Schwab's reported earnings for quarter, even though firm expects most of eligible employees to ..."
2001-01-31 05:00:00+00:00,"President Gloria Macapagal Arroyo of the Philippines, addressing a national television audience after 11 days in office, warned Tuesday that ""enemies of the state"" were out to destabilize her government and vowed to ""crush"" them..Mr"
2001-01-31 05:00:00+00:00,"First of three travel articles by R W Apple Jr on Hawaiian islands focuses on Hawaiians' love of fish; notes that Hawaiians consume prodigious quantities of prime seafood; reports Hawaiians, per person, eat twice as much fish as mainland Americans..."
2001-01-31 05:00:00+00:00,
2001-01-31 05:00:00+00:00,"First of eight columns by Charlie Trotter, chef and owner of Charlie Trotter's in Chicago; he describes making mushroom soup with pears and cumin oil; photo; recipe (M)"
2001-01-31 05:00:00+00:00,
2001-01-31 05:00:00+00:00,
2001-01-31 05:00:00+00:00,"Aetna Inc, nation's largest health insurer, posts 65 decline in fourth-quarter earnings and says it will shed 1.9 million more customers this year as it struggles to catch up with more profitable competitors; earnings plunged to $28.7 million comp..."
2001-01-31 05:00:00+00:00,"British American Tobacco PLC will buy back from investors 40.5 percent of its Australian unit, British American Tobacco Australasia Ltd, it does not already own for $1.11 billion Australian dollars ($605 million) in cash, premium of 28 percent on ..."
2001-01-31 05:00:00+00:00,"HONG KONG, Jan. 31 — Taiwan's political stalemate hardened today, as the country's legislature voted to reverse a decision by President Chen Shui-bian to scrap a partially-built nuclear power plant."
2001-01-31 05:00:00+00:00,"January 31, 2001"
2001-01-31 05:00:00+00:00,
2001-02-01 05:00:00+00:00,Text of Federal Reserve statement on interest rate cuts7
2001-02-01 05:00:00+00:00,
2001-02-01 05:00:00+00:00,EUROPE
2001-02-01 05:00:00+00:00,INTERNET
2001-02-01 05:00:00+00:00,"Taiwan's legislature votes to reverse decision by Pres Chen Shui-bian to scrap partly built nuclear plant; plant is proxy for much broader battle between Chen and Nationalist Party, which he swept out of power last March after 55 years of rule; le..."
2001-02-01 05:00:00+00:00,"The U.S. central bank cut short-term interest rates Wednesday, saying that eroding confidence among consumers and businesses had prompted a ""rapid and forceful response."". The Federal Reserve Board said that it was cutting its target on federal"
2001-02-01 05:00:00+00:00,"Article discusses outlook for XFL's debut season, which begins this weekend; formed by Vince McMahon of World Wrestling Federation, new league promises more violence than NFL; photo (M)"
2001-02-01 05:00:00+00:00,"February 1, 2001"
2001-02-01 05:00:00+00:00,"Gross domestic product grows at annual rate of 1.4 percent in fourth quarter of 2000, slowest rate in more than five years; businesses abruptly cut their spending on new equipment during quarter, but spending by American consumers and government, ..."
2001-02-01 05:00:00+00:00,"Federal Reserve cuts its benchmark interest rate by half percentage point for second time this month, showing its intention to wage aggressive battle against growing possibility of recession; federal funds target rate on overnight loans among bank..."
2001-02-01 05:00:00+00:00,anthem is expec
2001-02-01 05:00:00+00:00,Jonathan Fuerbringer Market Place column on implications for stock and bond prices of swift Federal Reserve interest rates cuts engineered by Chmn Alan Greenspan in effort to prevent recession; sees Greenspan responding aggressively to virtual col...
2001-02-01 05:00:00+00:00,"Dow Jones industrial average rises 6.16 points, to 10,887.36; Standard & Poor's 500-stock index falls 7.72 points, to 1,366.01; Nasdaq composite index falls 65.2 points, to 2,772.73; graph; table (M)"
2001-02-01 05:00:00+00:00,"American manufacturers cut production sharply in January, sending an index of their activity to a level not reached since the recession of a decade ago, a trade group reported today."
2001-02-01 05:00:00+00:00,"Coca-Cola Co reports fourth-quarter operating earnings rose sharply to $839 million, while net incomer rose to $242 million, compared with $45 million loss in 1999 period; photo (M)"
2001-02-01 05:00:00+00:00,Singapore Telecommunications reportedly leads ir
