pub_date,snippet
2001-11-11 05:00:00+00:00,"Each of world's largest economies appears to be in recession or heading toward one, for first time in more than 10 years; unemployment is rising, factory orders are falling; both consumers and corporate managers are reluctant to spend money becaus..."
2001-11-11 05:00:00+00:00,"Impact of Sept 11 terrorist attacks is being measured and counted in various ways, from sales of television sets, airline industry layoffs, crime to soaring number of prescriptions for antidepressant and antianxiety drugs; photos; chart (L)"
2001-11-11 05:00:00+00:00,"Shoppers and investors alike have been turning toward discount stores and wholesale clubs since Sept 11; many analysts think customers increasingly want low prices, easy parking and broad assortment of goods that discounters such as Wal-Mart Store..."
2001-11-11 05:00:00+00:00,Second home market in Eastern vacation corridor is reviving after lull following terrorist attacks; brokers say sellers can expect their homes to move provided they are fairly priced; buyers will find more inventory from which to choose than in re...
2001-11-11 05:00:00+00:00,Few office buildings in Manhattan are changing hands or are even for sale despite slowing economy and aftereffects of Sept 11; executives say outlook for rental rates is unclear; terrorist attack removed 13.5 million square feet of space from mark...
2001-11-11 05:00:00+00:00,
2001-11-11 05:00:00+00:00,"Market Watch column on financial problems of Homestore.com, provider of real estate information and services on Web; company's stock fell to $2.28 per share as of Nov 1 from high of $122.25 in January 2000; graph (M)"
2001-11-12 05:00:00+00:00,
2001-11-12 05:00:00+00:00,"Product tie-in wars for toys based on new motion pictures are already heating up for holiday season; Harry Potter does not appear in theaters until Nov 16, but boy wizard can already be found in stores, facing off with characters from Monsters Inc..."
2001-11-12 05:00:00+00:00,"IN THE STOCK MARKET (as in much of life), the beginning of wisdom is admitting your ignorance. One of the many things you cannot know about stocks is exactly when they will up or go down. Over the long term, stocks generally rise at a nice pace. H..."
2001-11-12 05:00:00+00:00,"CNBC, business-news channel that became most-watched information source on cable television during heady 1990's, is in rough seas; its buzz has faded, its ratings are falling, and it is having to rethink its direction as ground shifts beneath it; ..."
2001-11-12 05:00:00+00:00,
2001-11-12 05:00:00+00:00,"Laurence Desvilettes, the IHT's financial statistics editor, is always after some hard-to-find book or other, and she has found that the Internet is a good resource. She recommends the following sites as quick, efficient — and clean! — alterna"
2001-11-12 05:00:00+00:00,
2001-11-12 05:00:00+00:00,"Nation's charities face toughest times and toughest choices in decades; shock of Sept 11 terrorist attacks, flood of money pouring into relief efforts, sudden contraction of nation's economy, slump on Wall Street and recent disruptions in mail hav..."
2001-11-12 05:00:00+00:00,Dynegy Inc has positioned itself to become most important player in volatile but potentially lucrative business of energy trading by agreeing to buy rival Enron Corp for more than $9 billion in stock; but hastily arranged deal carries big risks fo...
2001-11-12 05:00:00+00:00,"Consortium of breast cancer groups that sponsor Breast Cancer Awareness Month ponder whether to go on with planned activities, including Race for the Cure, in wake of Sept 11 terrorist attacks; races are canceled in some cities and held in others;..."
2001-11-12 05:00:00+00:00,"Foundations react with uncharacteristic speed in aftermath of Sept 11 terrorist attacks, pledging millions for disaster relief; Council on Foundations estimates that by mid-October, its 2,000-plus members put up more than $278 million for disaster..."
2001-11-13 05:00:00+00:00,"Floyd Norris Market Place column on Dynegy's planned takeover of Enron Corp says one sweet provision for Dynegy is that it is getting right to acquire Enron's Northern Natural Gas for $1.5 billion, less than it is probably worth, even if overall $..."
2001-11-13 05:00:00+00:00,"Stocks tumble in wake of American Airlines crash near Kennedy International Airport but rebound when it appears that crash might be accident rather than result of new terrorist attack; Nasdaq composite index, which was down as much as 2.5 percent,..."
2001-11-13 05:00:00+00:00,"Wall Street finds nothing but good news in Dynegy's $9 billion takeover of Enron Corp; Dynegy executives go to New York to assure investors that deal will sharply increase their company's profits; Dynegy stock closes at $44.31, up $5.55, or 14.3 p..."
2001-11-13 05:00:00+00:00,"The crash of an American Airlines jet shortly after its takeoff from John F. Kennedy International Airport on Monday rattled the nerves of traders on Wall Street, but the stock market recovered as it appeared that the cause was a mechanical defect..."
2001-11-13 05:00:00+00:00,
2001-11-13 05:00:00+00:00,
2001-11-13 05:00:00+00:00,"Investment Company Institute says about 52 percent of nation's households owned funds as of May, up from 49 percent in period year earlier; 93.3 million individuals owned mutual funds as of May, up from 89.7 million in May 2000 (M)"
2001-11-13 05:00:00+00:00,
2001-11-14 05:00:00+00:00,"America West Airlines applies for federally guaranteed loan of $400 million, becoming first airline to seek some of $10 billion in guarantees approved by Congress in September as part of emergency rescue package (M)"
2001-11-14 05:00:00+00:00,"For weeks, economists have contended that the pieces were falling into place for a global rebound next year. But investors just didn't seemed convinced. .Now with fortunes turning swiftly and decisively in favor of the U.S.-backed Northern Allianc..."
2001-11-14 05:00:00+00:00,R W Apple Jr article on dried corn that John Cope's Food Products has been processing and selling for 101 years; recipe for creamed corn; photos (M)
2001-11-14 05:00:00+00:00,"Christie's conducts auction of post World War II art, featuring contemporary German artists; sale totals $25.1 million, far below estimates of $31.6 million to $44.2 million; 17 of 56 works go unsold; photo (M)"
2001-11-14 05:00:00+00:00,
2001-11-14 05:00:00+00:00,Article discusses how those who lived through Hitler's Nazi regime and Vietnam War era view current terrorist situation and war in Afghanistan; photo (M)
2001-11-14 05:00:00+00:00,Floyd Norris and Christine Bockelmann comment on New York Times' coverage of business and financial news through the years; photos (Special section marking New York Times' 150th anniversary) (L)
2001-11-14 05:00:00+00:00,"Enron Corp chairman and chief executive, Kenneth L Lay, gives up severage package worth $60.6 million in effort to appease employees outraged that he stands to profit from merger with Dynegy Inc; value of employees' stock options and their 401(k) ..."
2001-11-14 05:00:00+00:00,Robert D McFadden article on how The Times has redefined and reinvented itself over its 150 history; photos; drawings; timeline (L)
2001-11-14 05:00:00+00:00,
2001-11-14 05:00:00+00:00,"Ronald L Zarrella, architect of General Motors strategy to offer interest-free financing after Sept 11 terrorist attacks, resigns as president of its North American operations to take top job at his former employer, Bausch & Lomb; Robert A Lutz, r..."
2001-11-14 05:00:00+00:00,"Morgan Stanley Dean Witter & Co says it will close its only retail brokerage outlet in Japan because there is little chance venture will turn profit; about 100 workers of unit, Morgan Stanley Nippon Securities, which opened in January, will be lai..."
2001-11-14 05:00:00+00:00,"Amanda Hesser article on hard cider as Thanksgiving alternative to wine; discusses ciders sparking and still, dry and sweet, French and American; photo (M)"
2001-11-14 05:00:00+00:00,"Frank Rich article says terrorist attacks of Sept 11 made people appreciate again the resources, judgment and standards of news organizations like The Times; photos (L)"
2001-11-15 05:00:00+00:00,"Henry Blodget, stock analyst who became symbol of Internet mania that enriched some investors but ultimately cost many others dearly, says he is giving up business of publicly rating stocks; says he accepted buyout offer that Merrill Lynch extende..."
2001-11-15 05:00:00+00:00,"Article on airport security focuses on International Total Services Inc, which has been teetering on precipice of economic disaster; illustrates how difficult it will be to reinvent system; traces history of passenger screening, which carriers saw..."
2001-11-15 05:00:00+00:00,"As Nassau County's top officials prepare to meet to try to patch together budget that could avoid state takeover, they face major hurdle: county's biggest revenue source is its sales tax, and no one is sure how badly it has eroded or when it might..."
2001-11-15 05:00:00+00:00,"Market Place column on steps being taken by Terry Semel, Yahoo chief executive, to reverse company's sharp decline in revenues and find steady path to growth in harsh Internet environment; analysts praise initiatives but wonder whether they are en..."
2001-11-15 05:00:00+00:00,"The Philip Morris Companies, the owner of one of the world's best-known corporate names, plans to change that name next year to Altria Group Inc., the company said today."
2001-11-15 05:00:00+00:00,"Hewlett-Packard Co reports fiscal fourth-quarter earnings dropped 89 percent, to $97 million; revenue fell 18 percent, to $10.9 billion; executives and some analysts point to figures, which exceed Wall Street's lowered expectations, as positive si..."
2001-11-15 05:00:00+00:00,"New York State budget officials say that state spending will grow by more than twice rate of inflation this fiscal year, at time when government already faces a shortfall of at least $1.6 billion after Sept 11 attacks (M)"
2001-11-15 05:00:00+00:00,
2001-11-15 05:00:00+00:00,"Newmont Mining unveils two-pronged plan to become world's biggest gold company, with agreements to take over Normandy Mining, Australia's leading producer, and Franco-Nevada Mining of Toronto for total of about $4.4 billion in stock and cash; will..."
2001-11-15 05:00:00+00:00,Some of Europe's biggest corporations provide new evidence that Europe is near recession; Siemens reports that it lost nearly $1 billion in most recent quarter; Lufthansa says air travel has been down about 22 percent since Sept 11 and it might we...
2001-11-15 05:00:00+00:00,"The terrorist attacks on the United States worsened a financing ""drought"" for emerging markets that has halved their funding on the international capital markets, according to a study released Wednesday by the International Monetary Fund. .Em"
2001-11-15 05:00:00+00:00,"The Philip Morris Companies, the owner of one of the world's best-known corporate names, plans to change that name next year to Altria Group Inc., the company said today."
2001-11-15 05:00:00+00:00,Eastman Kodak Co is realigning its businesses along product lines rather than geographic ones (M)
2001-11-15 05:00:00+00:00,Scalio
2001-11-15 05:00:00+00:00,"Enron Corp plans to sell assets, with total book value of more than $8 billion, that executives say have produced dismal returns; analysts say sales of businesses are likely to raise far less than what Enron paid for them (M)"
2001-11-15 05:00:00+00:00,"Apser family's reach is becoming noticeable across Canada through rapid growth of CanWest Global Communications Corp, which has become Canada's largest media company; in last two years, spree of acqusitions has transformed what was once smalest of..."
2001-11-15 16:57:00+00:00,"In this lesson, students evaluate how newspapers are constructed and evaluate the extent to which newspapers serve their readers’ interests."
2001-11-16 05:00:00+00:00,
2001-11-16 05:00:00+00:00,"If everything had gone according to plan, right about now Psion PLC would be unveiling the product that would make it a household name across the world: a phone-cum-personal-organizer jointly developed with Motorola Inc.. Psion also would be calcu..."
2001-11-16 05:00:00+00:00,
2001-11-16 05:00:00+00:00,"Shai Agassi is chief executive of SAP Portals Inc., a Silicon Valley-based subsidiary of the German business-software giant SAP AG. The company, started in April when SAP spent $400 million to buy TopTier Software Inc., an Israeli company that Mr...."
2001-11-16 05:00:00+00:00,
2001-11-16 05:00:00+00:00,"Companies that offer in-car information services, like On-Star system from General Motors, are starting to duplicate some of Web's most useful offerings: driving directions, stock quotes, customized news and weather reports; some of companies behi..."
2001-11-17 05:00:00+00:00,"Alcoa's talks to acquire WMC Ltd, nickel miner, reportedly are snagged over price and other issues (M)"
2001-11-17 05:00:00+00:00,"THE TRAVEL INDUSTRY was one of the biggest corporate casualties of the terrorist attacks on Sept. 11, and it is still in the midst of reorganizing its priorities to deal with a highly volatile situation..The unlucky shareholders in these companies..."
2001-11-17 05:00:00+00:00,"Interest rates on Treasury securities, both long term and short, rise sharply in week to near or above Sept 10 levels; surge frustrates Federal Reserve, which has aggressively tried to push rates lower to spur economy, and Bush administration; 10-..."
2001-11-17 05:00:00+00:00,"AFTER THE WORLD Trade Center fell, so did the stocks of insurance companies. The market reasoned, correctly, that the catastrophe would result in immense damage claims..But the shares recovered almost immediately, if only partially, as investors c..."
2001-11-17 05:00:00+00:00,"Try to invest in some of the hottest hedge funds and you will get a curt, ""No, thank you."".Tim Bell, who is in charge of hedge funds at UBS Warburg private banking, notes that many so-called multistrategy arbitrage funds, which have posted re"
2001-11-17 05:00:00+00:00,THE AVIATION INDUSTRY is facing its deepest financial crisis ever following the Sept. 11 terrorist attacks and the crash this week of a jetliner in New York. The magnitude of the losses is such that a restructuring of the industry is all but inevi...
2001-11-17 05:00:00+00:00,"MIDDLE EAST TURKEY: I.M.F. SIGNALS NEW LOAN The head of the International Monetary Fund said that he would recommend a new loan for Turkey to bridge a $10 billion financing gap, leaving the nation close to an unprecedented third I.M.F. rescue in a..."
2001-11-17 05:00:00+00:00,"Bausch & Lomb's new chief executive, Ronald L Zarrella, must grapple with rising competition, falling sales and late-to-the-party products in most of company's eye care markets; company's problems seem to have taken management by surprise (M)"
2001-11-17 05:00:00+00:00,"As stock prices tanked, the pension fund for a million Dutch government and education workers needed a nice, safe place to park some money. It chose hedge funds..Teachers in Utrecht might be surprised to learn that money earmarked for their retire..."
2001-11-17 05:00:00+00:00,"When ABN AMRO Asset Management (Asia) Ltd. started its Behavioural Finance Japan Fund in February, it expected to pull in $40 million to $50 million. The Hong Kong-based fund — along with Star Behavioural Finance Fund Japan, a feeder vehicle that ..."
2001-11-18 05:00:00+00:00,"Dana Telsey, specialty goods retailing analyst at Bear Stearns, answers questions on outlook for purveyors of luxury goods; photo (M)"
2001-11-18 05:00:00+00:00,"Abby Ellin column reports that old-fashioned job-searching are required in post-dot-com, post-Sept 11 job world; experts offer some advice; drawing (M)"
2001-11-18 05:00:00+00:00,Summary of week's stock and bond markets; charts; table of rates and yields (S)
2001-11-18 05:00:00+00:00,"Gretchen Morgenson Market Watch column questions investors' enthusiasm for FalconStor Softwre Inc, whose share price has risen 35 percent for week; notes that company has only 44 million outstanding shares and that 28 million of them held by insid..."
2001-11-18 05:00:00+00:00,"Some landlords are opting out of Section 8 program, under which federal government subsidizes rent of low-income tenants; seek higher profits outside program as neighborhoods improve, and they also want to avoid program's bureaucratic morass, whic..."
2001-11-18 05:00:00+00:00,"Carole Gould column profiles $142 million UAM FPA Crescent Portfolio, hybrid mutual fund, and Steven Romick, who runs it; photo; chart (M)"
2001-11-18 05:00:00+00:00,"Jack Benjamin Grubman, telecommunications industry analyst at Salomon Smith Barney, has led more people into investments in nascent and risky telecom companies than perhaps any other individual, and his cheerleading epitomizes conflict-of-interest..."
2001-11-18 05:00:00+00:00,"Mark Hulbert Strategies column notes that 'January effect,' tendency of small-capitalization stocks to outperform broader market in first month of each year, persists despite predictions of its demise; chart (M)"
2001-11-18 05:00:00+00:00,Some Wall Street analysts remain upbeat about long-term prospects for energy stocks despite recent plunge in prices of crude oil and natural gas and in shares of big companies that provide these resources; photo; graph (M)
2001-11-19 05:00:00+00:00,"Article discusses bleak holiday sales outlook for book publishers; with terrorism, war and threat of recession dominating consumers' attention this fall, major publishers are having decreases in their sales of as much as 15 percent from last year'..."
2001-11-19 05:00:00+00:00,Australian discount air carrier Virgin Blue says that it is seeking an investor to buy as much as 49 percent of airline with remainder to be sold at public stock offering (S)
2001-11-19 05:00:00+00:00,"WARREN BUFFETT, probably the greatest investor of the 20th century, is fond of quoting the salacious actress Mae West as saying, ""Too much of a good thing can be wonderful."" . In the market, such a motto would lead you to avoid diversification a"
2001-11-19 05:00:00+00:00,New Economy column discusses argument over whether key links in fiber optic networks can be reported operating at or near capacity even if nation's fiber optic networks are 95% empty (M)
2001-11-19 05:00:00+00:00,"Renaissance that began in Lower Manhattan in late 1990's is in reverse; six office towers totaling 13.45 million square feet were destroyed in September 11 World Trade Center terrorist attack, and buildings that remain have not filled up with tena..."
2001-11-19 05:00:00+00:00,
2001-11-20 05:00:00+00:00,
2001-11-20 05:00:00+00:00,Nasdaq's Message Of Global Thanks.
2001-11-20 05:00:00+00:00,
2001-11-20 05:00:00+00:00,"StarMedia Network, once the bright light of Latin America's Internet industry, appears to be in serious trouble; company says it plans to restate its financial results for first half of this year and all of last year after internal investigation u..."
2001-11-20 05:00:00+00:00,"Robert Milton, chief executive of Air Canada, finds that airline's 80 percent market share in Canada is more of hindrance than help; for one thing, it makes airline easy target of passenger complaints, which do not help airline win government fina..."
2001-11-20 05:00:00+00:00,New York Times computer analysis reveals that schedule reductions by major airlines cut passenger capacity at major airports by as much as one third and increased largest carriers' dominance at those airports; their agenda is to preserve service i...
2001-11-20 05:00:00+00:00,"Andrew Ross Sorkin analysis of proposed merger of Conoco and Phillips Petroleum concludes that it may come about as close as deal can get to being truly merger of equals, if concept of 'merger of equals' can ever be believed (M)"
2001-11-20 05:00:00+00:00,"Two leading cruise lines announced a deal to combine as the world's biggest cruise ship company with a fleet of 41 ships and 75,000 berths under joint management."
2001-11-20 05:00:00+00:00,indexes gain as prospects look rosier for 2002 rebound**(*
2001-11-20 05:00:00+00:00,"Gretchen Morgenson Market Place column says recent gains in stock market may not prove sustainable; suggests that rally is not based on any data signaling economic recovery, but rather on investors' rush to be on board for next bull run (M)"
2001-11-20 05:00:00+00:00,"Exelixis says that it will acquire Genomica, maker of software for genetic analysis, for about $110 million in stock in sign of further consolidiation in genomics business (S)"
2001-11-20 05:00:00+00:00,Investors bid up shares of Conoco in apparent expectation that suitor may emerge to make a bid for company that will put higher value on it than under proposed merger deal with Phillips Petroleum; map; chart (M)
2001-11-20 05:00:00+00:00,Nasdaq sponsors 60-second TV commercial to express appreciation of Americans for outpouring of sympathy and concern around world after terrorist attacks in September (S)
2001-11-20 05:00:00+00:00,
2001-11-21 05:00:00+00:00,
2001-11-21 05:00:00+00:00,"European Court of Justice in Luxembourg, Europe's highest court, backs Levi Strauss & Company in long-running legal battle to keep cut-price versions of its blue jeans from being sold by Tesco, Britain's biggest supermarket chain; ruling sets prec..."
2001-11-21 05:00:00+00:00,Technology Briefing
2001-11-21 05:00:00+00:00,
2001-11-21 05:00:00+00:00,"William H. Neukom, general counsel of the Microsoft Corporation, will retire next summer, the software company announced today."
2001-11-21 05:00:00+00:00,"P&O Princess Cruises of Britain and Miami-based Royal Caribbean Cruises announce $2.89 billion deal to combine, becoming world's largest cruise ship company; cruise lines term deal 'merger of equals'; Royal Caribbean chairman-chief executive Richa..."
2001-11-21 05:00:00+00:00,"Turkey that most people will eat on Thanksgiving is, after 50 years of overengineering, morphed into ungainly beast that can no longer run, fly or even lay eggs--all in name of progress; what it can do is supply copious quantities of white breast ..."
2001-11-21 05:00:00+00:00,"National Bank of Greece, country's leading bank, announces plans to buy Alpha Bank for about 4.1 million euros ($3.6 billion) in stock; acquisition will make National big enough to move into new markets (S)"
2001-11-21 05:00:00+00:00,US trade deficit shrinks in September in wake of economic disruptions resulting from terrorist attacks; gap in goods and services trade narrows to $18.7 billion from $27.1 billion in August; Commerce Department statistics show deficit was narrowes...
2001-11-21 05:00:00+00:00,"ServiceMaster, which was founded in 1947 by evangelical Baptist and has long declared its primary mission is to honor God, hired its first outsider in January, Jonathan P Ward, former R R Donnelley & Sons executive, to run company in light slumpin..."
2001-11-21 05:00:00+00:00,Enron shares plunge 23 percent as expectations grow that Dynegy will either back out of deal to rescue company or seek to renegotiate terms; analysts say neither company was aware until last few days that recent credit downgrading means Enron will...
2001-11-21 05:00:00+00:00,"Editorial on recent stock market recovery; cites encouraging economic signs, but notes outlook remains unclear"
2001-11-21 05:00:00+00:00,"With the collapse of the Taliban regime in Afghanistan, stock market investors from New York to Frankfurt are driving prices well beyond their Sept. 11 level in anticipation of a global economic rebound next year. .The breakthrough in the war in A..."
2001-11-21 05:00:00+00:00,"EUROPESWITZERLAND: SWISSAIR EMPLOYEES PROTEST Employees of the Swissair Group halted several flights at Geneva's airport, protesting a possible cut in pay and loss of benefits as the airline's operations wind down. They were demonstrating against ..."
2001-11-22 05:00:00+00:00,Dynegy officials weigh whether to seek to renegotiate terms of company's agreement to acquire Enron Corp while Enron and its bankers seek to shore up its finances; discussions come as stock and energy markets continue to register doubts about fina...
2001-11-22 05:00:00+00:00,"US economy remains weak but recent reports suggest it is no longer becoming any worse, giving weight to increasingly popular view that recovery is only few months away; University of Michigan's index of consumer confidence rose to 83.9, from 82.7 ..."
2001-11-22 05:00:00+00:00,"*Australian mining company WMC Ltd rejects $5.8 billion takeover proposal from Alcoa, partner since 1960's, calling offer inadequate; WMC instead plans to split company into two, spinning off its 40 percent stake in alumina venture with Alcoa; ven..."
2001-11-22 05:00:00+00:00,
2001-11-22 05:00:00+00:00,"Brief profiles and photos of some of those who died in terrorist attack on World Trade Center: Robert Wayne Hobson, Efrain Franco Romero, Carol Flyzik, Kevin Bracken, Ronny Kloepfer, Dajuan Hodges, Michael D'Esposito, Michael E Tinley, Arthur Simo..."
2001-11-22 05:00:00+00:00,
2001-11-23 05:00:00+00:00,"Foreign demand is unexpectedly strong for initial public offering of Thailand's oil and gas company, PTT; government sells about one-third of PTT, raising about $725 million (M)"
2001-11-23 05:00:00+00:00,"Pharming Group, creator of cows genetically engineered to produce pharmaceuticals in their milk, runs out of money and files for bankruptcy protection; companies in this industry face uncertainty of Food and Drug Administration approval, falling p..."
2001-11-23 05:00:00+00:00,"UFJ Holdings, umbrella company for three Japanese banks, reports losing 67 billion yen ($544 million) in six months ended Sept 30; plans to write off two trillion yen ($16.2 billion) in bad loans for fiscal year ending in Mar and sell assets; Sumi..."
