pub_date,snippet
2000-11-16 05:00:00+00:00,"The International Herald Tribune is considering changing the way we present our stock listings and other market statistics. As we consider these decisions, we would like to enlist your help.. If the IHT were to print fewer statistics, which of the..."
2000-11-16 05:00:00+00:00,"Federal Reserve, citing evidence that economy has shifted into lower gear, votes to hold interest rates steady; stresses that it still sees risk of heightened inflationary pressures stemming from low jobless rate and rise in oil prices (M)"
2000-11-16 05:00:00+00:00,"Leapfrog Group, comprised of 60 of country's largest companies, announces plans to push hospitals to reduce medical errors that are to blame for deaths of tens of thousands of patients each year; members of Leapfrog Group say they will encourage t..."
2000-11-16 05:00:00+00:00,
2000-11-16 05:00:00+00:00,"Credit Suisse Group posts 66 percent year-over-year rise in profit for its third quarter, but results are lower than first two quarters as cost of taking over Donaldson, Lufkin & Jenrette Inc cut back profit; for first nine months, Credit Suisse r..."
2000-11-16 05:00:00+00:00,"Stock gave up most of their early gains Wednesday after U.S. central bankers maintained their tough anti-inflation stance.. The Federal Open Market Committee, the panel that sets monetary policy for the Federal Reserve Board, kept its target for o..."
2000-11-16 05:00:00+00:00,Campbell Soup Co reports that its fiscal first-quarter profit fell 13 percent; net income fell to $204 million from year-earlier $235 million (S)6
2000-11-16 05:00:00+00:00,"The International Monetary Fund warned Wednesday of the consequences of South Korea's failure to shore up financial institutions burdened with bad loans, saying that it expected economic growth to slow sharply as a result..Accusing ""zombie"" c"
2000-11-16 05:00:00+00:00,New York Stock Exchange halts trading in
2000-11-16 05:00:00+00:00,Securities and Exchange Commission approves rule requiring brokerage firms to release composite statistics on where they send customer trades and how well these orders are filled; SEC also ends months of sometimes bitter debate over ways to make s...
2000-11-16 05:00:00+00:00,"Many companies, faced with unforgiving stock market and harsh business environment, are also experiencing lack of management depth; as chief executives are pushed out by disappointed investors and impatient boards, companies are finding that there..."
2000-11-16 05:00:00+00:00,Sampling software programs and Web sites that can make working and managing information on the road less of chore; photos (M)
2000-11-16 05:00:00+00:00,Online Shopper column describes doing holiday shopping on Web; drawings (M)
2000-11-17 05:00:00+00:00,"Worldcom Inc founder, Bernard J Ebbers, is scrambling to raise cash; in last three months, he has raised $70.6 million by selling stock, and has persuaded Worldcom to lend him $61.5 million; Worldcom stock is down 75 percent from peak it reached i..."
2000-11-17 05:00:00+00:00,"Stock resume their slide; Nasdaq composite index loses 133.61 points, closing at 3,031.88; Standard & Poor's 500-stock index falls 17.49 points, to 1,372.32; Dow Jones industrial average falls 51.57 points, to 10,656.03 (M)"
2000-11-17 05:00:00+00:00,Hekimian agrees to sell itself to Spirent PLC for $1.6 billion (S)
2000-11-17 05:00:00+00:00,DaimlerChrysler's slumping stock price and increasingly gloomy profit outlook at Chrysler subsidiary have prompted several board members to begin discussing privately possibility of selling off at least part of Chrysler; informal discussions come ...
2000-11-17 05:00:00+00:00,"TheStreet.com, online financial news service whose once-soaring stock helped to symbolize Internet craze, will lay off 40 of its 219 employees in a broad-ranging effort to conserve remaining cash as it strives to make its first profit; will close ..."
2000-11-17 05:00:00+00:00,"AMF Bowling, troubled bowling alley operator controlled by Goldman Sachs Group, will seek to transfer its stock to over-the-counter bulletin board; New York Stock Exchange stopped trading in shares before market opened on Nov 15 and moved to delis..."
2000-11-17 05:00:00+00:00,Bayer obtains exclusive worldwide marketing and distribution rights to a gene therapy treatment for hemophilia B being developed by Avigen Inc (S)
2000-11-18 05:00:00+00:00,"American Express chief executive Harvey Golub says he will step down at end of year, four months sooner than planned; Kenneth I Chenault, his successor, will become first black chief executive of one of 30 blue-chip companies whose stocks make up ..."
2000-11-18 05:00:00+00:00,"Garry Kasparov hold he is still world's best chess player, despite recent loss to Vladimir Kramnik, interview; vows to recapture world championship; photo (M)"
2000-11-18 05:00:00+00:00,"William S Woodside, prominent business and civil leader who used his position as a platform to promote social change in New York area and nationwide, dies at age 78; photo (M)"
2000-11-18 05:00:00+00:00,"MENTION Cisco Systems Inc. to a group of strategists and investors, and you are sure to get opinions—lots of them..Four of the roundtable's five participants were at no loss to express their views on the dominant supplier of equipment to the Inte"
2000-11-18 05:00:00+00:00,"Analysts at Salomon Smith Barney Inc. who specialize in the emerging markets of Europe and the Middle East are recommending seven companies trading at low valuations, despite what the analysts believe are strong earnings prospects. Even if the pre..."
2000-11-18 05:00:00+00:00,Stocks end slightly lower after rallying briefly on hopes that presidential election would be decided soon and then falling as investors worry about slowing economic growth and the effect that would have on corporate earnings; Dow Jones industrial...
2000-11-18 05:00:00+00:00,"THE MONEY Report's fourth annual investment roundtable was scheduled for Nov. 9, two days after the U.S. presidential election, with the idea that participants might want to take into account the result in giving their views of the financial marke..."
2000-11-18 05:00:00+00:00,"JEAN-MARIE EVEILLARD speaks flawless English, with a French accent. When he is in a room full of portfolio managers and strategists, however, you might have trouble following the conversation:. Mr. Eveillard said: ""If I had the means to buy a fore..."
2000-11-19 05:00:00+00:00,Article discusses New York Giants offensive linemen bonding after games at tailgate party set up in players-only parking area; entire team and families join in; photo (M)
2000-11-19 05:00:00+00:00,"Howard G Goldberg comments on verjus bottled by Wolffer Estates in Sagaponack, LI (S)"
2000-11-19 05:00:00+00:00,"Catherine Texier article on Vendee region along Atlantic coast of France, visiting places where her great-grandmother Victorine lived; photos; map; suggestions for stay based in Niort (special section, The Sophisticated Traveler) (part 2 of 2-part..."
2000-11-19 05:00:00+00:00,"Bond market observers believe many American companies will not be able to manage the debt lent to them at the height of New Economy euphoria and that investors will begin to shy away from corporate bonds as a result, depriving the economy of the m..."
2000-11-19 05:00:00+00:00,"The Coca-Cola Company is in serious talks to acquire the Quaker Oats Company, the maker of Gatorade, in an effort to expand its position in the lucrative noncarbonated drink business, executives close to the negotiations said today."
2000-11-19 05:00:00+00:00,"Profile of George David, president of United Technologies, who maintained his usual calm and control as General Electric snatched Honeywell International from his grasp; notes instances in his career in which David has managed to turn an apparent ..."
2000-11-19 05:00:00+00:00,"Rob Walker reviews book One Market Under God: Extreme Capitalism, Market Populism, and the End of Economic Democracy by Thomas Frank (M)"
2000-11-19 05:00:00+00:00,Richard Bernstein of Merrill Lynch & Co answers questions about his specialty: quantitative stock market analysis; photo (M)
2000-11-19 05:00:00+00:00,"Anne Bernays article on pleasures of traveling from Boston to Flagstaff by train; photos (special section, The Sophisticated Traveler) (M)"
2000-11-19 05:00:00+00:00,"Mark Hulbert column says new SEC rule prohibiting companies from divulging important information only to favored analysts and investors will likely increase the number of earnings surprises, contrary to what proponents hope, but will have little o..."
2000-11-19 05:00:00+00:00,"Leah Modigliani of Morgan Stanley Dean Witter says investing $500 billion of Social Security trust fund in stocks would have repercussions in bond market that would prevent stocks from benefiting fully from the new money; says in fact, on the marg..."
2000-11-19 05:00:00+00:00,"Standard & Poor's Supercap Speciality-Apparel index has fallen about 24 percent this year after a strong gain in 1999, the victim of fast-shifting fashion trends among the young; graph; photo (M)"
2000-11-19 05:00:00+00:00,"American college and university endowments have grown sharply in recent years on their investments, and a good part of those gains has been realized on investments that entail risk, including venture capital; now, however, even some of the biggest..."
2000-11-19 05:00:00+00:00,"Profile of Katherine Schapiro and Stacey Ho, co-managers of $240 million Wells Fargo International Equity fund (M)"
2000-11-19 05:00:00+00:00,"Sampling of take-home dinners and groceries that can be bought at Grand Central Terminal, Pennsylvania Station and Port Authority before train or bus pulls in photo (M)"
2000-11-19 05:00:00+00:00,Food stores in Grand Central Terminal Market serve commuters bound home from New York City; photos (M)
2000-11-19 05:00:00+00:00,Tables of economic and financial data for the last week; graphs
2000-11-19 05:00:00+00:00,"Stuart Klawans article on World War I as first war to be fought before motion picture cameras and its legacy on filmmaking itself; says amid the rubble, French film retreated, Hollywood advanced and cinematic shock techniques continued wartime per..."
2000-11-19 05:00:00+00:00,New York State Exchange's annual holiday reception for the press will conflict with a coctail party being given by rival Nasdaq (S)
2000-11-20 05:00:00+00:00,"Philanthropy, which last year threatened to overtake Palm V as Silicon Valley fashion statement, is continuing there despite sharp downturn in high-tech stock market; photo of Catherine Gowen, who counsels Cisco employees on giving money (special ..."
2000-11-20 05:00:00+00:00,"NO ONE needs reminding that technology stocks have been crushed this year. In the United States, the Nasdaq has fallen 40 percent from its spring high. Computer stocks in Europe, as tracked by Dow Jones, have dropped by 31 percent since the start ..."
2000-11-20 05:00:00+00:00,Internet and catalog companies in some retailing areas are building stores to compete directly with mall-based brands; analysts say it is easier for such companies to open stores than for bricks-and-mortar merchants to sell directly to consumers o...
2000-11-20 05:00:00+00:00,Invensys PLC reportedly plans to spin off its fast-growing power systems division as way to boost its stock price (M)0
2000-11-20 05:00:00+00:00,Coca-Cola Co reportedly is in talks to acquire Quaker Oats (M)
2000-11-20 05:00:00+00:00,at&T faces hard choices over i
2000-11-20 05:00:00+00:00,"Nonprofit sector is turning to business world for leadership and financial expertise, and finding talent in ranks of executives who have made fortunes and are looking for rewarding new challenges; photos of Lawrence M Small at Smithsonian and Miri..."
2000-11-20 05:00:00+00:00,ING Group confirms it ING Barings unit weighs sale of its United States investment banking operations; says it will fold London arm of unit into its European commercial banking division; reports ING Barings profits jumped 44.4 percent for first ni...
2000-11-20 05:00:00+00:00,"Article on new college graduates who are delaying their entry into business world in order to work in nonprofit sector, through volunteer organizations and public interest programs like AmeriCorps; Lee Davenport, Monica M Martinez, Andrew Zuckerma..."
2000-11-21 05:00:00+00:00,"The Philippine Senate has set a tentative date of Dec. 1 for the start of President Joseph Estrada's trial on charges of corruption and abuse of power, following his impeachment by the House of Representatives last week. Many Filipinos appear to h..."
2000-11-21 05:00:00+00:00,"John Tierney comment on findings of report The Federal Budget and the States, report started by outgoing Sen Daniel P Moynihan and now computed by researchers at Kennedy School of Government; report finds that of states with largest per capita tax..."
2000-11-21 05:00:00+00:00,"Banco Santander Central Hispano wins auction for Banco do Estado de Sao Paulo, state-run enterpise, with bid of $3.57 billion, largest amount ever paid for government bank in South America; bid reflects Santander's history of aggressive expansion ..."
2000-11-21 05:00:00+00:00,quaker oats battle comes down to getting gatorade*
2000-11-21 05:00:00+00:00,"Signed, sealed and delivered: Shares in Germany's national post office began trading Monday, marking a radical metamorphosis for a once-sleepy government monopoly..To be sure, customers can still find grumpy clerks, long lines and expensive stamps..."
2000-11-21 05:00:00+00:00,"Auto sales have slowed since beginning of month, prompting carmakers to increase their already deep discounts and to consider additional temporary closings of factories; General Motors and Chrysler unit of DaimlerChrysler are closing some factorie..."
2000-11-21 05:00:00+00:00,"The International Herald Tribune's Web site, www.iht.com, has a new look.. The redesigned IHT.com contains more articles and has advanced features that let readers easily choose what they want to see and how they want to see it. The home page of t..."
2000-11-21 05:00:00+00:00,"Treasury bond prices rise as three major stock indexes decline; price of 30-year Treasury bond rises 8/32, to 107 (S)"
2000-11-21 05:00:00+00:00,
2000-11-21 05:00:00+00:00,Market Place column on new group of Internet companies trying to lure online shoppers with promise of mutual fund shares; some consumer advocates see service as gimmick (M)
2000-11-21 05:00:00+00:00,National Assn of Securities Dealers accuses Morgan Stanley Dean Witter & Co's brokerage unit of misleading thousands of investors into buying mutual funds that resulted in losses of $65 million; fraud complaint states that Dean Witter told its bro...
2000-11-21 05:00:00+00:00,"Stock prices fall on worries about fourth-quarter earnings; technology stocks are particularly weak, and Nasdaq composite index loses 151.55 points, or 5 percent, to close at 2,875.64, its lowest close in more than year; Dow Jones industrial avera..."
2000-11-21 05:00:00+00:00,"Holiday season is critical for many online merchants, who must compete with many traditional merchants that have developed more comprehensive e-tailing operations; last year, Web merchants saturated television screens with their ads, sold goods at..."
2000-11-21 05:00:00+00:00,"Sony Corp says it will offer tracking stock to investors to highlight corporate value of its wholly owned Internet service provider, Sony Communication Network Corp (M)"
2000-11-22 05:00:00+00:00,"Matalan, British retailer that most resembles American discount chains, is thriving while profits are shrinking at other British retailers; John Hargreaves started warehouse-type store in Preston in 1985 after being impressed by supercenters he ob..."
2000-11-22 05:00:00+00:00,"Lucent Technologies will revise financial results already reported for fourth quarter by cutting revenue by about $125 million; says this could cut 2 cents a share from earnings for the quarter and the year; shares plunge 16 percent, to $17.56, de..."
2000-11-22 05:00:00+00:00,"Board of Coca-Cola Co abandons effort to acquire Quaker Oats, diversified food company whose lead product is Gatorade; executives close to talks say board was divided over price and whether Coke could successfully absorb Quaker Oats and also had c..."
2000-11-22 05:00:00+00:00,"Jeffrey Lee is not your burly longshoreman of old. Singapore's port may claim to be the busiest in the world, but Mr. Lee no longer spends much time in the cabin of the crane he operates there. .Instead, he sits in an air-conditioned office. Using..."
2000-11-22 05:00:00+00:00,"Public Lives column; Michael Jackson sings Happy Birthday with other guests at party for Rabbi Shmuley Boteach, author of book Kosher Sex; movie Jackson Pollock, an American Saga is screened at Guggenheim Museum; director-star Ed Harris and co-sta..."
2000-11-22 05:00:00+00:00,"SEC charges that Jeffrey Leach and his brother, Hubert, cheated investors in tender offers for the shares of Fleming Companies, Fruit of the Loom and Mattel Inc in 1999; civil complaint alleges that in each instance the brothers offered to pay an ..."
2000-11-22 05:00:00+00:00,
2000-11-22 05:00:00+00:00,"Floyd Norris column on allegations by New York State Common Retirement Fund that McKesson Corp was aware of accounting irregularities at HBO & Co when it bought the software concern in 1999; notes that McKesson, now McKesson HBOC, has until now be..."
2000-11-22 05:00:00+00:00,"Trouble deepened Tuesday for Lucent Technologies Inc., the once high-flying maker of telecommunications equipment that has fallen on hard times amid a global downturn in the appetite for telecommunications-related stocks..Lucent said it had discov..."
2000-11-23 05:00:00+00:00,"Collapse of Coca-Cola Co's $16 billion bid to acquire Quaker Oats prompts rival bidders to re-evaluate their acquisition strategies and raises discussion about implications for Coke's chairman-chief executive, Douglas N Daft; Danone of France issu..."
2000-11-23 05:00:00+00:00,"Shares of Telefonica Moviles SA of Spain end first day of trading where they began, at 11 euros (S)"
2000-11-23 05:00:00+00:00,Jeff Madrick's 'Economic Scene' column on economic problems facing next US President and some hard choices he will have to make; graph (M)
2000-11-23 05:00:00+00:00,Finance Min Zsigmond Jarai says Hungary may let its currency trade more freely and open up its domestic gas market next year if inflation slows; Hungary had capped domestic gas prices to slow inflation and keep forint from weakening (S)
2000-11-23 05:00:00+00:00,"Nasdaq composite index falls 116.11 points, or 4 percent, to 2,755.34; Dow Jones industrial average falls 95.18 points, to 10,399.32; Standard & Poor's 500-stock index drops 24.99 points, to 1,322.36; graph; tables; photo (M)"
2000-11-23 05:00:00+00:00,"American investors packed up for the Thanksgiving holiday in a dour mood on Wednesday, pushing stock prices lower as concerns about earnings and the economy combined with distaste for the drawn-out process of selecting a president.. Technology sto..."
2000-11-23 05:00:00+00:00,"Squeezed by rising debt, flat earnings and a tumbling stock price, Deutsche Telekom AG this week signaled a rare willingness to scale back its global ambitions by dropping out of the running for a coveted license to provide new wireless services i..."
2000-11-23 05:00:00+00:00,
2000-11-23 05:00:00+00:00,"Luxury-goods companies like Tiffany & Co, Neiman Marcus Group and LVMH-Moet Hennessy Louis Vuitton are enjoying another good holiday buying season; most luxury-goods companies can expect another banner financial year; graph; photos (M)"
2000-11-24 05:00:00+00:00,Prices for houses in the Hamptons (NY) continue to rise (M)
2000-11-24 05:00:00+00:00,European stocks rise (M)o
2000-11-24 05:00:00+00:00,"Public Lives column profiles Rev James F Fitzpatrick, director of vocations for Diocese of Brooklyn; he is responsible for recruiting new priests for parishes in New York; photo (M)"
2000-11-24 05:00:00+00:00,"Old master and modern paintings and drawings from Franz Koenigs collection, widely considered one of greatest art collections of 20th century, to be sold by Sotheby's; Dallas Museum of Art to launch major retrospective of sculptor Henry Moore; Bar..."
2000-11-24 05:00:00+00:00,"Unified Energy System, Russia's monopoly electric company, is pressing for deregulation to raise foreign capital to modernize; wants to separate power generation from distribution companies that deliver power to and collect bills from end consumer..."
2000-11-24 05:00:00+00:00,Gain Collins Op-Ed column on the prospect for continued air traffic delays and long waits in airports and on runways (M)
2000-11-24 05:00:00+00:00,"Floyd Norris column on Ronald O Perelman's plan for M & F Worldwide, company in which he has 35 percent stake, to buy his controlling stake in Panavision at his cost, which far exceeds current market value, plus premium; notes deal will not benefi..."
2000-11-24 05:00:00+00:00,"Profile of Reed Beauregard (Beau) Turner, son of billionaire Ted Turner, who manages Turner properties; he is chairman of Turner Endangered Species Fund and trustee for Turner Foundation which awards grants to environmental groups and projects; ph..."
2000-11-24 05:00:00+00:00,Summaries of previously published reviews of 12 Manhattan restaurants that feature truffles; map (M)
2000-11-24 05:00:00+00:00,
2000-11-24 05:00:00+00:00,Article on revitalization of Newark and array of attractions New Jersey's largest city now has to offer; maps; photos (M)
2000-11-25 05:00:00+00:00,"AT&T halts purchases of equipment that enables its cable television systems to carry local phone service, sending shares of equipment suppliers Antec Corp, CommScope Inc, C-Cor.net, Harmonic and Scientific-Atlanta down sharply; Antec issues earnin..."
2000-11-25 05:00:00+00:00,Barnes & Noble is in talks with Gemstar-TV Guide International Inc on business deals ranging from partnership to spur Gemstar's technology for reading electronic books to possible acquisition of Barnes & Noble (M)
2000-11-25 05:00:00+00:00,"Nasdaq composite index rises 149.04 points, to 2,904.38, 5.4 percent gain; Dow Jones industrial average rises 70.91 points, to 10,470.23; Standard & Poor's 500-stock index rises 19.41 points, to 1,341.77; 10-year Treasury note is unchanged at 100 ..."
2000-11-25 05:00:00+00:00,"TOM McMANUS is the chief portfolio strategist at Banc of America Securities LLC, but he also has a technological background, having begun his professional life with a degree in operations research from Columbia University's School of Engineering a..."
2000-11-25 05:00:00+00:00,"Shares of United Engineers Malaysia Bhd., one of Malaysia's largest construction companies, plummeted Friday after the announcement of a complicated deal that analysts say amounts to a bailout of the country's most indebted industrial group..The d..."
2000-11-25 05:00:00+00:00,"JAMES STACK, editor of the advisory newsletter InvesTech Market Analyst, is a confirmed bear who does not like many stocks. One that he has just recommended to his subscribers was featured in The Money Report this month when the subject of researc..."
2000-11-25 05:00:00+00:00,"The proliferation of Chrysler's retro-look PT Cruisers on the road, and anticipation of profit improvements after news this month that DaimlerChrysler AG's German management had replaced its U.S. team, may make DaimlerChrysler stock seem like a te..."
2000-11-25 05:00:00+00:00,"Sema Group cuts profit forecast, sending its stock into swoon that cuts its market value by 45 percent; says 2001 revenue will rise 12 percent (M)"
2000-11-25 05:00:00+00:00,
2000-11-25 05:00:00+00:00,IMAGINE building a home with materials composed of recombinant spider silk extracted from goats' milk. Or perhaps riding a train home from work and having your field of vision filled with images beamed from a computer chip inside your contact lens...
2000-11-25 05:00:00+00:00,"Asian nations took tentative steps toward greater unity Friday in a series of moves that may lead to the emergence of a more powerful role for the region in world affairs..On one front, Southeast Asian countries agreed to consider the idea of form..."
2000-11-25 05:00:00+00:00,"Holiday shopping season begins; analysts are divided about outlook for sales growth, with forecasts ranging from weak 2.5 percent to strong 8 percent; shoppers crowd stores, lured by early steep price cuts; Internet sales are expected to take bigg..."
2000-11-26 05:00:00+00:00,"Lloyd Ternes, Berkshire Hathaway shareholder in Salem, Mass, convinces company chairman, Warren Buffett, to insure that Danvers High School will wear new uniforms during their performance at Tournament of Roses Parade on New Year's Day; photo (M)"
2000-11-26 05:00:00+00:00,"Analysts of retail trade industry are pessimistic or cautious in their predictions for coming holiday shopping season; this year's growth in sales is expected to be approximately 2.5 percent, down from 4 to 5 percent year-over-year since mid 1990'..."
2000-11-26 05:00:00+00:00,
2000-11-26 05:00:00+00:00,"Stephen Holden article on movies as mirrors of cultural mood comments on nihilistic comedy Meet the Parents, which mined vein of outrage to beome this fall's runaway hit, and softly nostalgic Almost Famous, which flopped at box office (M)"
2000-11-26 05:00:00+00:00,"Mary Civiello, former television reporter and news anchor, has started Civiello Communications Group in Bronxville, NY, where she trains corporate executives on how to deal with media; Civiello comments; photos (M)"
2000-11-26 05:00:00+00:00,"Bruce Porter article on the awesome power of the .50-caliber sniper rifle and the armor-piercing ammo it fires, both of which are easy to obtain; antigun activists are trying to get the weapon recognized as a threat to national security and banned..."
