pub_date,snippet
2000-10-15 05:00:00+00:00,"Investor sentiment changes to include realization that rising oil prices could pose inflation problem, causing both bond and stock indices to turn down as reflection of their fears; graph (M)"
2000-10-15 05:00:00+00:00,"October 15, 2000"
2000-10-15 05:00:00+00:00,"Bernard Stamler Investing With column describes Artisan Mid-Cap Fund, managed by Andrew C Stephens; photo; chart (M)"
2000-10-15 05:00:00+00:00,Jonathan Fuerebringer column on the relative strenth of small-cap stocks in market's current turmoil; graph (M)
2000-10-15 05:00:00+00:00,"Presidential race again turns to Mideast, with Vice Pres Al Gore and Gov George W Bush talking of hopes and prayers for peace and their aides battling over charges that Bush camp exploits turmoil for political gain; Gore, campaigning in Detroit, i..."
2000-10-15 05:00:00+00:00,Latin American Internet stocks are battered even more than similar issues elsewhere (M)
2000-10-15 05:00:00+00:00,Jeff Turrentine article on small but significant group of young and successful individuals who are investing in stocks and deferring spending on luxury items with early retirement in mind; photo (M)
2000-10-15 05:00:00+00:00,"David Brooks article rejects myth that Greatest Generation, those who grew up during Depression, are reacting differently from anybody else in today's economic good times; Bureau of Labor Statistics figures show that supposedly thrifty generation ..."
2000-10-15 05:00:00+00:00,Review of week's activities in financial markets; graphs (S)
2000-10-15 05:00:00+00:00,Article reviews performance of stock market under Democratic and Republican administrations from 1927 through 1998 (M)
2000-10-15 05:00:00+00:00,Investors continue to show faith in technology and other stocks despite market turbulence and ebbing of get-rich-quick hysteria; confidence is striking considering that prices have not regained ground lost since technology-heavy Nasdaq composite i...
2000-10-15 05:00:00+00:00,"Kenneth N Gilpin interview with Thomas F Marisco concerning technology, change and growth as they impact investments; photo (M)"
2000-10-15 05:00:00+00:00,"Seven prominent stock market experts discuss recent sell-off and likely future scenarios; they are John C Bogle, Barton M Biggs, David Tice, William H Miller 3d, David Alger, Terrance Odean and Charles Hill; photos (M)"
2000-10-15 05:00:00+00:00,"Ecomomists and retail analysts discuss how as retail space grows and consumer spending wanes, many stores will begin to feel financial pinch; recent closure of Warner Brothers store on Fifth Avenue in midtown Manhattan discussed; photo (M)"
2000-10-15 05:00:00+00:00,"Chris Rea, Scotman who runs the Internet chat room Trading-places.net, has beguiled hundreds of paying chat-room members with his electronically broadcast claims of stock-picking prowess; but documents supplied by customers and other knowledgeable..."
2000-10-15 05:00:00+00:00,"Article on redevelopment efforts in blighted industrial sections of Perth Amboy, including $600 million mixed-use Landings at Harborside; photo; maps (In the Region/New Jersey) (M)"
2000-10-15 05:00:00+00:00,"Glenn H Thrush article on UPromise, company created last year by Boston marketing executive Michael Bronner through which variety of companies would offer consumers small rebates for purchasing goods and services with credit cards, which would the..."
2000-10-15 05:00:00+00:00,Charles River Ventures funds its own multi-million dollar program to provide the high-tech start-ups it finances with an ambitious set of business development services to ease rocky passage from idea to profitable concern; photos (M)
2000-10-15 05:00:00+00:00,"Article on Libra Foundation, Maine-based philanthropic organization whose latest office building acquisition is 1 Canal Plaza in Portland, which it bought from KeyCorp for $16.5 million; Libra, in last two years, has purchased four prominant Class..."
2000-10-15 05:00:00+00:00,"Article on new 78-unit community with mix of town houses and rental apartments that is replacing 44 substandard houses on blighted Smith Avenue in Bay Shore, Long Island; drawing; maps (In the Region/Long Island) (M)"
2000-10-15 05:00:00+00:00,"Gretchen Morgenson Market Watch column offers predictions on future of technology and telecommunications stocks given by Fred Hickey, editor of High Tech Strategist Newsletter, and James Paulsen, chief investment officer of Wells Capital Managemen..."
2000-10-15 05:00:00+00:00,"Nina Munk article describes how she went from setting out to build a Web site for owners of urban dogs to developing and becoming obsessed with Internet start-up company, urbanhound; photo (M)"
2000-10-16 05:00:00+00:00,"With violence raging in the Middle East and lofty oil prices drawing harsh criticism of petroleum companies, it might seem an inopportune time for Chevron and Texaco to announce a merger that opens them to the scrutiny of the federal government an..."
2000-10-16 05:00:00+00:00,"The Chevron Corporation announced today that it will acquire Texaco Inc. for about $36 billion in stock, creating the world's fourth-largest oil concern."
2000-10-16 05:00:00+00:00,
2000-10-16 05:00:00+00:00,"When President Bill Clinton and other leaders meet in Egypt on Monday, the urgent issue is to end the bloodshed between Israelis and Palestinians. But besides the high human and political stakes, the success or failure of the negotiations could ha..."
2000-10-16 05:00:00+00:00,
2000-10-16 05:00:00+00:00,"October 15, 2000"
2000-10-16 05:00:00+00:00,
2000-10-16 05:00:00+00:00,
2000-10-16 05:00:00+00:00,
2000-10-16 05:00:00+00:00,
2000-10-16 05:00:00+00:00,"The Chevron Corporation agreed yesterday to acquire Texaco Inc. for about $36 billion in stock, creating the world's fourth-largest oil concern."
2000-10-17 05:00:00+00:00,RESEARCH
2000-10-17 05:00:00+00:00,Sen Joseph Lieberman joins 12 other senators in pushing for delay in new accounting rules on acquisitions that could hurt businesses' bottom line; Financial Accounting Standards Board is considering elimination of popular accounting technique that...
2000-10-17 05:00:00+00:00,"Nasdaq compsite index falls 26.49 points, or 0.8 percent, to 3,290.28; Dow Jones industrial average rises 46.62 points, or 0.5 percent, to 10,238.80; Standard & Poor's 500-stock index edges up 0.45 point, or 0.03 percent, to 1,374.62; graph; chart..."
2000-10-17 05:00:00+00:00,"Shortfall of home heating fuel in Northeast may not be as dire as feared; large number of homeowners and businesses, worried that oil prices would continue to increase, appear to have stocked up earlier than in past years; many utilities and busin..."
2000-10-17 05:00:00+00:00,"Merger of Chevron Corp and Texaco Inc will bring together a company with a reputation for aggressive innovation, Chevron, with one whose production and share price have fallen through a mix of bad management and bad luck; some observers say mergin..."
2000-10-17 05:00:00+00:00,"October 17, 2000"
2000-10-17 05:00:00+00:00,"With oil prices at nearly $35 a barrel, and Wall Street back in love with energy stocks, you might imagine that the executives who gathered in Venice last weekend for an industry summit would be patting themselves on the back..Instead they spent t..."
2000-10-17 05:00:00+00:00,Corixa Corp agrees to buy Coulter Pharmaceutical for stock worth about $900 million; acquisition is one of largest ever between two biotechnology companies (M)
2000-10-17 05:00:00+00:00,"Briggs & Stratton Corp reports loss of $6.3 million in fiscal first-quarter ended Sept 30 compared to net income of $25.7 million a year ago; sales fell 40 percent, to $180.8 million, from $298.9 million (S)"
2000-10-17 05:00:00+00:00,"THOUSAND OAKS, Calif., Oct. 16 — Amgen Inc., the world's largest biotechnology company, said today that it had agreed to acquire Kinetix Pharmaceuticals Inc. for $170 million in stock to aid its discovery and development of new oral drugs."
2000-10-17 05:00:00+00:00,"NEW YORK — The New York Stock Exchange presented a veritable bedlam to-day [Oct. 16] under the heaviest day's trading in twenty-four years, with prices in dozens of stocks surging upward under an avalanche of buying orders from all parts of the co..."
2000-10-17 05:00:00+00:00,Indonesian government is rebuffing criticism from international donors even as it approaches them for $4.8 billion in assistance; meeting with Consultative Group on Indonesia comes against backdrop of further decline in Indonesian political stabil...
2000-10-17 05:00:00+00:00,The New York Times: Technology-Text Version
2000-10-17 05:00:00+00:00,
2000-10-18 05:00:00+00:00,"Intel Corp reports third-quarter numbers that beat analysts' lowered forecasts; company gives investors some reasons for concern, reporting stagnant chip sales and projecting relatively soft holiday season; Intel executives say they are not seeing..."
2000-10-18 05:00:00+00:00,"DEALS MARVELL BUYING ISRAELI CHIP MAKER A communications chip maker, the Marvell Technology Group , said yesterday that it had agreed to acquire Galileo Technology Ltd., an Israel-based maker of network routing and switching equipment, for about $..."
2000-10-18 05:00:00+00:00,"Mood is unusally subdued at Agenda, computer industry conference in Scottdale, Ariz, reflecting steep declines in Internet and e-commerce stocks since last year's conference; among computer industry and Internet executives, venture capitalists and..."
2000-10-18 05:00:00+00:00,"IBM says it earned $2 billion in third quarter, up 16 percent from $1.8 billion a year earlier; third-quarter 2000 revenues grew 3 percent, to $21.78 billion, falling short of expectations (M)"
2000-10-18 05:00:00+00:00,"Stuart Elliott column on highlights, lowlights and sidelights of 2000 annual conference of Association of National Advertisers in Dana Point, Calif (M)"
2000-10-18 05:00:00+00:00,"Nasdaq composite index falls 76.32 points, or 2.32 percent, to 3,213.96; Dow Jones industrial average drops 149.09 points, or 1.46 percent, to 10,089.71; Standard & Poor's 500-stock index loses 24.65 points, or 1.79 percent, to 1,349.97; graph; ch..."
2000-10-18 05:00:00+00:00,
2000-10-18 05:00:00+00:00,"Spain's Grupo Endesa acquires domestic rival, Iberdrola, for stock and cash worth about $12.7 billion, creating one of world's biggest power companies; companies say they will call their combination Endesa-Iberdrola (M)"
2000-10-18 05:00:00+00:00,"Citigroup's profit in third quarter, excluding special charges, beat analysts' estimates, rising 27 percent, to $3.1 billion from $2.4 billion in period a year ago; Merrill Lynch & Co's profits rose 53 percent, to $885 million from $579 million a ..."
2000-10-19 05:00:00+00:00,ASIA
2000-10-19 05:00:00+00:00,"Dow Jones industrial average drops 114.69 points, or 1.14 percent, to 9,975.02, lowest close since March; Nasdaq composite index is down 42.40 points, or 1.32 percent, to 3,171.56; Standard & Poor's 500-stock index drops 7.84 points, or 0.58 perce..."
2000-10-19 05:00:00+00:00,"Euro drops to new low against dollar two days after European Central Bank president, Wim Duisenberg, provoked furor by publicly suggesting that central banks will not intervene soon to strengthen struggling currency; chart (M)"
2000-10-19 05:00:00+00:00,Worldcom Inc intends to issue new stock to track its consumer and wholesale long-distance units; new stock would track unit that generally sells long-distance service to consumers under MCI and Telecom USA brands and has annual revenue of about $1...
2000-10-19 05:00:00+00:00,"America Online earned $345 million in third quarter, up from $181 million a year earlier, increase of 91 percent; its revenue grew 34 percent, to $2 billion; Time Warner earned $85 million, down 76 percent from year earlier; revenue was $6.9 billi..."
2000-10-19 05:00:00+00:00,"Article notes Subway Series between New York Yankees and New York Mets has meant, in past anyway, that stock market will most likely have subpar year; even worse, when Mets make it to World Series, it is usually good time to get out of stock marke..."
2000-10-19 05:00:00+00:00,"Microsoft Corp reports income before accounting change of $2.58 billion for fiscal first quarter ended Sept 30, compared with $2.19 billion in quarter last year; revenue for quarter reached $5.8 billion, up from $5.38 billion a year ago; company's..."
2000-10-19 05:00:00+00:00,Bureau of Labor Statistics says Consumer Price Index rose 0.5 percent in September and is now growing at annual rate of 3.8 percent (M)
2000-10-19 05:00:00+00:00,"The recent slide in global stock markets nearly turned into a rout Wednesday as several disappointing earnings announcements and a rise in U.S. inflation combined to send stock prices tumbling. . The day began weak in Asia and Europe, where major ..."
2000-10-19 05:00:00+00:00,"Calls for ouster of Pres Joseph Estrada are heard in streets of Manila, where 15,000 demonstrators mass to demand his resignation, and in Parliament, where opposition legislators file resolution to impeach him on charges of taking bribes from gamb..."
2000-10-19 05:00:00+00:00,Vice Pres Al Gore's advisers say they want to buy 90 minutes of time on cable television channels in various swing states to rebroadcast entire last debate; Gore aides sense that Gore's debate performance was unusually strong and provided him ammu...
2000-10-19 05:00:00+00:00,"Xerox Corp, which only days ago was fending off rumors of its impending bankruptcy, is talking to venture capitalists about selling its Palo Alto Research Center, which in 1970's pioneered much of technology for personal computer industry; is stru..."
2000-10-19 05:00:00+00:00,"NEW YORK -- Al Gore boasted that ""America has put its house in order"" and urged voters to stay the economic course, while George W. Bush challengedany attempt by Gore to take credit for the nation's prosperity. Gore focused on the economy in a spe..."
2000-10-19 05:00:00+00:00,"Television advertising marketplace is cooling; some network executives dispute some earlier reports of weakening in ad marketplace, but News Corp chairman, Rupert Murdoch, predicts at shareholders meeting in Australia that advertising sales for hi..."
2000-10-19 05:00:00+00:00,Wild gyrations on American stock markets reflect one of most confused and divided markets in memory; hopes that market is about to rise again are balanced by worries that weakness in technology stocks may presage bear market and sharp slowing in e...
2000-10-19 05:00:00+00:00,Fariborz Ghadar letter comments on October 16 article on acquisition of Texaco by Chevron
2000-10-19 05:00:00+00:00,"Sun Microsystems announces record earnings and revenue in fiscal first quarter ended Oct 1; earnings rose 85 percent, to $510 million from $276 million in year-earlier quarter; revenue was $5.05 billion, increase of 63 percent over $3.15 billion a..."
2000-10-19 05:00:00+00:00,Singapore Exchange is continuing investigation into 30 percent last-minute surge in Singapore Telecommunications share price on Oct 13 after establishing that it was not result of error trade; Singapore Telecommunications jumped 80 Singapore cents...
2000-10-20 05:00:00+00:00,"Whitbread PLC will sell its 3,000 pubs; company's stock rises 8.7 percent; graph (S)"
2000-10-20 05:00:00+00:00,"Commerce Department reports nation's trade deficit narrowed in August to six-month low; $29.4 billion trade gap in goods and services comes after record deficit of $31.7 billion in July; while imports rose 0.8 percent, to $122.5 billion, highest e..."
2000-10-20 05:00:00+00:00,"Warren E. Buffett, a board member, personally asks for--and receives--resignation of Gillette Co's chief executive, Michael C Hawley, on the day that company announces yet another disappointing quarter of earnings; Gillette's stock, which has fall..."
2000-10-20 05:00:00+00:00,"Gov George W Bush, campaigning in Michigan, strikes back at Democrats' new commercials attacking his Social Security plan; contends that Vice Pres Al Gore is pitting 'grandparents against grandchildren' for political gain; photo (M)"
2000-10-20 05:00:00+00:00,Herbert Muschamp reviews Guggenheim Museum retrospective of fashion designer Giorgio Armani; photos (M)
2000-10-20 05:00:00+00:00,"Medtronic Inc, leading manufacturer of pacemakers, acquires PercuSurge Inc for $225 million (S)"
2000-10-20 05:00:00+00:00,BIOTECHNOLOGY
2000-10-20 05:00:00+00:00,"Nasdaq composite index gains 247.04 points, or 7.79 percent, to close at 3,418.60 and narrowing its loss this year to 16 percent; Standard & Poor's 500-stock index advances 46.63 points, or 3.5 percent, to 1,388.76; Dow Jones industrial average ga..."
2000-10-20 05:00:00+00:00,"October 20, 2000"
2000-10-20 05:00:00+00:00,Rod Schrock resigns as chief executive of AltaVista; photo (M)
2000-10-20 05:00:00+00:00,"Institute on Taxation and Economic Policy reports that Goodyear, Texaco, Colgate-Palmolive, MCI WorldCom and eight other large corporations earned more than $12.2 billion in profits in 1996 through 1998, but that none of them ended up owing corpor..."
2000-10-20 05:00:00+00:00,"Black & Decker Corp will increase its stock buyback program to five million shares, which are worth $162 million at current market prices (S)"
2000-10-20 05:00:00+00:00,"Japan's Economic Planning Agency says gross domestic product will rise 1.5 percent in current fiscal year, which ends March 31; it had previously anticipated growth of 1 percent; government cuts estimates for nominal growth, or growth that takes i..."
2000-10-20 05:00:00+00:00,"United Technologies Corp, one of the last old-style conglomerates, is expected to buy Honeywell International Inc for about $40.3 billion in stock; acquisition would create industrial behemoth, bringing together United Technologies' Otis Elevators..."
2000-10-20 05:00:00+00:00,"Volkswagen AG, which owns Rolls-Royce and Bentley Motor Cars of Britain, and BMW plan to vie for sales to wealthy in Britain; Volkswagen is working on prototype of so-called mid-range Bentley that will reach market just when Volkswagen and BMW div..."
2000-10-20 05:00:00+00:00,"EBay reports $15.2 million in earnings for third quarter on revenue of $102.8 million from gross merchandise sales of $1.4 billion, topping Walll Street expectations (M)"
2000-10-20 05:00:00+00:00,"Current budget surplus of $81 billion could have been equally large deficit were it not for lucky confluence of circumstances; taxes thrown off by soaring stock market contributed handsomely, as did higher tax rates on the rich, enacted just befor..."
2000-10-20 05:00:00+00:00,"Coca-Cola Co institutes sweeping salary increases for first time in at least two decades; raises, ranging from less than $1,000 to as much as $15,000, comes after company determines that many of its workers are paid less than their counterparts at..."
2000-10-20 05:00:00+00:00,"United Parcel Service Inc says third-quarter earnings rose 22 percent; net income rose to $702 million compared with $577 million in 1999 quarter; sales climbed 9.7 percent, to $7.37 billion from $6.72 billion; company's board authorizes buyback o..."
2000-10-20 05:00:00+00:00,"SEC rule taking effect Oct 23 will require American corporations to divulge important information about their performance to everyone at same time, taking away an advantage now enjoyed by analysts, their customers and big institutional investors; ..."
2000-10-20 05:00:00+00:00,"Television ads for Island, an online network of more than 400 broker-dealers, show an eerie future in which tradional stock exchanges will not be necessary; agency is Bozell New York (M)"
2000-10-20 05:00:00+00:00,"Floyd Norris comment on speculation that steep declines in stock prices around the world presage a world recession; says this international bear market has prompted no action by Federal Reserve, which eased credit in 1998 when crumbling markets in..."
2000-10-21 05:00:00+00:00,"Sometime before the end of the year, a milestone in American capitalism will pass. Wal-Mart Stores' annual sales are on track to exceed those of General Motors, the largest American company for much of the last half-century."
2000-10-21 05:00:00+00:00,"SMALLER COMPANIES have been getting bigger, but just about everything else has been getting smaller bonds, other stocks, the euro. The result was a dismal third quarter for most mutual funds..Aside from equity funds targeting smaller companies and..."
2000-10-21 05:00:00+00:00,ASIA
2000-10-21 05:00:00+00:00,"The Vietnam Frontier fund, one of the few viable vehicles for investors interested in Vietnam, has altered its strategy, due to the debut of the local stock market in July and the trade-normalization pact that Vietnam signed this year with the Uni..."
2000-10-21 05:00:00+00:00,cost of manhattan apartments
2000-10-21 05:00:00+00:00,"While not saving as much as in past years, Spanish households are increasingly turning to the stock market as a savings instrument. . According to a survey of 1999 data from the Bank of Spain by La Caja de Ahorros & Pensiones de Barcelona, the sav..."
2000-10-21 05:00:00+00:00,"Hainan Kaili Development and Construction Co files suit against Chinese securities regulatory authorities, who are attempting to foil its efforts to be listed on a mainland stock exchange (S)"
2000-10-21 05:00:00+00:00,"EQUITY FUNDS that invest in developing nations turned in a disappointing performance in the third quarter, roiled by rising oil prices and the steep dives and sharp rises on the Nasdaq in the United States, whose volatility outdid more than a few ..."
2000-10-21 05:00:00+00:00,"Jon S Corzine and Rep Bob Franks, in televised debate, avoid dramatic confrontation Franks hoped could alter course of their United States Senate race in New Jersey; focus on how to spend billions in new federal money for various programs without ..."
2000-10-21 05:00:00+00:00,"Dow Jones stock average rises 83.61 to 10,226.59; Standard & Poor's 500 index gains 8.17, closing at 1,396.93; Nasdaq composite reaches 3,483.14, gaining 64.54 points; 10-year Treasury rises 5/32 to 100 29/32, and 30-year is up 13/32, finishing at..."
2000-10-22 05:00:00+00:00,"Article on Mrs Green's Natural Market in Scarsdale, NY, health food store opened by Harold Hochberger in 1990; store eschews 'hippie' counterculture ambience of 1960's; photo (M)"
2000-10-22 05:00:00+00:00,Fred Andrews reviews of Peter L Bernstein's book The Power of Gold; photo (M)
2000-10-22 05:00:00+00:00,"Jennifer Moses travel article on trip to Half Moon Golf, Tennis and Beach Club resort near Montego Bay, Jamaica; photos (M)"
2000-10-22 05:00:00+00:00,"Webster, NY, restaurant manager Michael Papapanu will trade anything on the menu for a share of Xerox common stock (S)"
2000-10-22 05:00:00+00:00,Mark Hulbert Strategies column describes changes being made to composition and weighting within Morgan Stanley's EAFE global stock index; discusses strategic implications to mutual fund investors; chart (M)
2000-10-22 05:00:00+00:00,"Article describes scene at Boo Girls, retail store in Katonah, NY, that caters to pre-teen girls; photos (M)"
2000-10-22 05:00:00+00:00,
2000-10-22 05:00:00+00:00,Article describes two methods of minimizing capital gains taxes derived from realized mutual fund profits (S)
2000-10-22 05:00:00+00:00,Paul Krugman Op-Ed column regrets that Al Gore's unfortunate misstatements make it impossible for him to get credit he actually deserves for recognizing Internet's potential at early stage; adds that neither Gore nor George W Bush know how to mana...
2000-10-22 05:00:00+00:00,"Profile of Katherine Heaviside, founder and president of Epoch 5 Marketing whose specialty is providing individuals or companies with damage control in face of potentially damaging publicity; photo (M)"
2000-10-22 05:00:00+00:00,Article on array of private and government programs that offer assistance to new homeowners and small landlords in New York City and suburbs; services range from foreclosure-prevention programs to teaching people how to use tools and make repairs;...
2000-10-22 05:00:00+00:00,"Insignia Financial Group's Internet venture, EdificeRex, battles for market share among portals or service providers of Internet and Intranet connections and services to office buildings and other commercial properties; photo (M)"
2000-10-22 05:00:00+00:00,
2000-10-22 05:00:00+00:00,Article describes how Paul A Blaustein manages $173.7 million Whitehall Growth Fund; photo; chart (M)
2000-10-22 05:00:00+00:00,"James Surowiecki reviews book The Fortune Tellers: Inside Wall Street's Game of Money, Media and Manipulation by Howard Kurtz (M)"
2000-10-22 05:00:00+00:00,"Wal-Mart Stores, whose annual sales are on track to exceed those of General Motors sometime before the end of 2000, is transforming whole industries, from consumer manufacturing to retailing and food processing and sales, and has become a major fo..."
2000-10-22 05:00:00+00:00,"Jamie Malanowski reviews movie George Washington, written and directed by David Gordon Green and starring Candace Evanofski and Donald Holden; photo (M)"
2000-10-22 05:00:00+00:00,Vanguard Group gets into business of selling exchange-traded funds; article describes these mutual funds and how they meld with Vanguard's operation (M)
2000-10-22 05:00:00+00:00,"Article explores effects of overseas corporate postings of personnel, concludes that they are just as likely to be career hindrances as boosts up the corporate executive ladder; photos (M)"
2000-10-22 05:00:00+00:00,Article explores effects of recent Middle East violence on stocks and mutual funds; traces effects to markets' worries regarding oil supplies and prices (M)
2000-10-22 05:00:00+00:00,Kenneth N Gilpin Market Insight column contains interview with Pacific Investment Management Company managing director William H Gross regarding risk in corporate bond investing; photo (M)
