pub_date,snippet
2001-09-25 05:00:00+00:00,"SBC Communications offers to acquire 58 percent stake it does not already own in Prodigy Communications for $384 million, or $5.45 a share; Carlos Slim Helo and companies he controls are Prodigy's largest shareholders; size of premium, 54 percent ..."
2001-09-25 05:00:00+00:00,Major airlines in US have been reluctant to lower fares in wake of terrorist attacks despite plunge of as much as 50 percent in passenger traffic; executives say fares were already discounted heavily before attacks to try to counter industry slowd...
2001-09-25 05:00:00+00:00,"Southwest Airlines is only airline with chance to post profit this year after terrorist attacks; carrier is reaping benefits of strategy that favors use of smaller airports; it has not announced layoffs or schedule cutbacks, though flights will be..."
2001-09-25 05:00:00+00:00,"David Alger, whose analysis-based approach to stock investing propelled Fred Alger Management mutual funds to top during 90's bull market, died in Sept 11 collapse of World Trade Center, at age 57; photo; none of 35 employees in firm's 93rd-floor ..."
2001-09-25 05:00:00+00:00,"Instinet Group, Reuters Group's automated stock trading network, says third-quarter profit will fall because of lost revenue after terrorist attacks closed stock markets in US for four days (S)"
2001-09-25 05:00:00+00:00,"Stocks rebounded Monday in Europe and on Wall Street as the weekend passed without U.S. retaliation for the terrorist attacks this month, and investors concluded that stocks had fallen too far, too fast. .The Dow Jones industrial average, which fe..."
2001-09-25 05:00:00+00:00,"Oil and natural gas prices plunge on fears that sharp worldwide recession would reduce energy demand; but stocks worldwide soar on optimism that recession would be brief and that American economy, world's leader, would eventually shrug off terrori..."
2001-09-25 05:00:00+00:00,Stock prices rebounded Monday in Europe and on Wall Street amid optimism that retaliation for the terrorist attacks on the World Trade Center and the Pentagon would be focused initially only on Afghanistan..Fears of a broader war in the Middle Eas...
2001-09-25 05:00:00+00:00,"New York City Police Dept reports that crime fell 18 percent in week ending Sept 22, second week after terrorist attack in New York, with drops in every category; crime falloff emerges as oddity in that it comes when Police Dept is forced to cut b..."
2001-09-25 05:00:00+00:00,"Terrorist attacks in US have redoubled pullback from stocks and stock mutual funds that began when market first faltered early last year; even when investors buy stock funds now, they tend to pick funds that practice value investing, bargain-hunti..."
2001-09-26 05:00:00+00:00,"U.S. consumers were deeply concerned about the state of their economy even before the Sept. 11 terrorist attacks against New York and Washington, a survey released on Tuesday showed.. The Conference Board, a private-sector research organization, s..."
2001-09-26 05:00:00+00:00,"LG Telecom Ltd., citing unfavorable market conditions, said it would delay a sale of 540 billion won ($413 million) of new shares to companies interested in owning part of its license for high-speed wireless Web access. The offer had been schedule..."
2001-09-26 05:00:00+00:00,"Dow Jones industrial average rises 56.11 points, or 0.7 percent, to close at 8,659.97; Nasdaq composite index edges up 2.24 points, or 0.2 percent, to 1,501.65, while Standard & Poor's 500-stock index gains 8.82 points, or 0.9 percent, to 1,012.27..."
2001-09-26 05:00:00+00:00,
2001-09-26 05:00:00+00:00,Stocks fell today as investors found little reason to believe that the economy might recover from its downturn anytime soon.
2001-09-26 05:00:00+00:00,"Investors dump stock of Daiei, Japan's largest supermarket chain, fearful that Daiei may be sliding same way that claimed a major rival, Mycal Corp; not even emergency news conference called by company's chief executive to reassure investors that ..."
2001-09-26 05:00:00+00:00,"Labor Department reports some 75,000 people who worked in New York City are likely to apply for unemployment insurance benefits because of World Trade Center attacks; says added 37,500 will get special disaster unemployment aid for people not elig..."
2001-09-26 05:00:00+00:00,Wells Fargo & Co plans to buy back as much as $1.3 billion of its shares over time for uses that include acquisitions and employee benefit plans (S)
2001-09-26 05:00:00+00:00,"Conference Board reports consumer confidence index fell to 97.6 in September from 114 in August, largest single drop since October 1990, suggesting that nation was moving quickly toward recession before terrorist attacks; new reports of falling re..."
2001-09-26 05:00:00+00:00,Stocks wandered lower today as investors found little reason to believe that the economy might recover from its downturn anytime soon.
2001-09-26 05:00:00+00:00,Financial watchdogs and industry regulators in Britain quietly urge insurers to stop lending shares in effort to reduce practice of short-selling; move is intended to help stabilize stock market (S)
2001-09-26 05:00:00+00:00,"Wal-Mart, Kmart and Target are pressing on with their World Wide Web sites, having learned much about what to do -- and what not to do -- online; analysts say Web sites could help companies become more profitable; graphs (M)"
2001-09-26 05:00:00+00:00,World Business Briefing
2001-09-26 05:00:00+00:00,"Canadian Pacific Ltd shareholders are set to meet in Calgary to vote on restructuring plan, vote that could be beginning of end of one of North America's most storied conglomerates; company will be broken into five companies if plan is approved; u..."
2001-09-26 05:00:00+00:00,"New York City, New York State and federal agencies are working together to aid bereaved relatives and surviving workers of World Trade Center disaster at Family Assistance Center on Manhattan pier; are eager to cut through rules and red tape to sp..."
2001-09-26 05:00:00+00:00,
2001-09-26 05:00:00+00:00,"Battered by the tech wreck and on the brink of recession, Asia still has a thing or two to teach the rest of the world about telecommunications..While Europe and North America can only wonder about their still uncertain mobile phone futures, Japan..."
2001-09-26 05:00:00+00:00,"Peer-to-peer computing, technology that allows users to share music files over Internet, is also being used by institutional investors to move huge blocks of stock without tipping their hand to market makers, brokers, hedge funds, day traders and ..."
2001-09-26 05:00:00+00:00,"Analysts and recruiters say another round of cost-cutting and layoffs on Wall Street is inevitable, but most firms are reluctant to make cuts immediately for fear of seeming heartless; some big investment banks insist that they will not dismiss pe..."
2001-09-27 05:00:00+00:00,"Deutsche Bank shelves plan to sell part of its 12 percent stake in DaimlerChrysler; shares of Daimler have dropped 27 percent since terror attacks in US, largely on concern that American consumers may stop buying cars (M)"
2001-09-27 05:00:00+00:00,"Jeffrey M Peek, who ran asset management division at Merrill Lynch and who was passed over for firm's presidency in July, is leaving; Robert C Doll replaces Peek (M)"
2001-09-27 05:00:00+00:00,"Dow Jones industrial average falls 92.58 points, or 1.1 percent, to 8,567.39; Nasdaq composite index falls 37.60 points, or 2.5 percent, to 1,464.04; Standard & Poor's 500-stock index falls 5.23 points, or 0.5 percent, to 1,007.04; US bond prices ..."
2001-09-27 05:00:00+00:00,
2001-09-27 05:00:00+00:00,William Safire Op-Ed column dismisses idea that American life will never be the same after Sept 11 and that our future will ever be tinged with dread (M)
2001-09-27 05:00:00+00:00,Bush administration and Congress have variety of policy choices available if they decide that flagging economy needs additional kick in aftermath of terrorist attacks; debate over specific options is unfolding against backdrop of broader question ...
2001-09-27 05:00:00+00:00,"Market Place column on downward trend of stocks of media companies following terrorist attacks on US; says they are more exposed than other companies to new economic uncertainties, especially with regard to tourism and US advertising markets; perf..."
2001-09-27 05:00:00+00:00,"Experts tell Senate Banking Committee that disrupting finances of Osama bin Laden's terrorist network and others will require global crackdown, including end to laws in tax haven countries that allow secret bank accounts; say countries that refuse..."
2001-09-28 05:00:00+00:00,"Craig O McCaw, who made fortune in telecommunications industry, is selling homes, jets, yacht, ranch and other personal assets, almost certainly as result of severe downturn in industry; entrepreneurs of 1990's spent freely in apparent belief that..."
2001-09-28 05:00:00+00:00,"Dow Jones industrial average rises 114.03 points, or 1.33 percent, to close at 8,681.42; Standard & Poor's 500-stock index gains 11.57 points, or 1.15 percent, to 1,081.61; Nasdaq composite index slips 3.33 points, or 0.23 percent, to 1,460.71; yi..."
2001-09-28 05:00:00+00:00,John Tierney The Big City column discusses efforts by Mayor Rudolph Giuliani to stay in office after his term expires to help rebuild city from Sept 11 terrorist attack; urges Giuliani to step down when his term is completed (M)
2001-09-28 05:00:00+00:00,
2001-09-28 05:00:00+00:00,"Securities and Exchange Commission's offices at 7 World Trade Center were destroyed during terrorist attack, as were files containing depositions, trading records and other documents for several hundred cases; informal notes from interviews and jo..."
2001-09-28 05:00:00+00:00,"Stocks rose sharply today, ending a dreary third quarter, as investors displayed some confidence in the long-term health of the United States economy."
2001-09-28 05:00:00+00:00,"Yale University's endowment grows 6 percent, to $10.7 billion from $10.1 billion, in year ended June 30; photo (S)"
2001-09-28 05:00:00+00:00,"Floyd Norris comment on huge debt American companies amassed during economic boom, buying back stock with borrowed money; says huge borrowings left many companies weak; says those that go broke will blame recession for their problems, but their co..."
2001-09-28 05:00:00+00:00,Financial regulators find no evidence that people with advance knowledge of terrorist attacks on America used that information to profit in international securities market (M)
2001-09-28 05:00:00+00:00,Investment Co Institute says investors pulled more than $5 billion from equity funds in August (S)
2001-09-28 05:00:00+00:00,
2001-09-28 05:00:00+00:00,Metro Briefing
2001-09-28 05:00:00+00:00,"Editorial notes that leaders in Congress and White House are looking for ways to stimulate economy of nation cast into recession by terrorist attacks of Sept 11; notes Alan Greenspan, chairman of Federal Reserve, says best remedies would be tempor..."
2001-09-28 05:00:00+00:00,Technology Briefing
2001-09-28 05:00:00+00:00,"Shares of Sonus Networks plunge $3.52, or 55 percent, after company warns that it will post loss in current quarter; graph (S)"
2001-09-28 05:00:00+00:00,"Merrill Lynch & Co regains momentum in underwriting American stocks and bonds less than three weeks afer attack on World Trade Center disrupted much of their business; Merrill, which as been leading underwriter, is competing for top spot with Salo..."
2001-09-29 05:00:00+00:00,"After plunging in the wake of the terrorist attacks in the United States, stock markets around the world appear to be clawing their way back as investors resist giving in to debilitating pessimism. .The pace of the rebound has gathered this week, ..."
2001-09-29 05:00:00+00:00,"Bank of New York says Sept 11 terrorist attacks will cost it $125 million in third quarter, although it expects to get most of that back from insurance policies; other major financial companies with offices in Lower Manhattan have also had losses,..."
2001-09-29 05:00:00+00:00,
2001-09-29 05:00:00+00:00,"Clyde Haberman NYC column contends that Mayor Rudolph Giuliani's proposal to extend his term by three months because of terrorist attack is not only unjustified but also raises some sticky questions about what other office might be affected, city ..."
2001-09-29 05:00:00+00:00,"THE LARGEST EUROPEAN market for listed bonds is the Luxembourg Stock Exchange, with only a handful of domestic issues. The thousands of others are Eurobonds from around the world, denominated in anything from dollars to euros to South African rand..."
2001-09-29 05:00:00+00:00,"IF INVESTORS FORSAKE equities for the relative safety of bonds in these unsettled times, they will find corporate issues listed on many of the same stock exchanges they intend to flee..The largest and busiest bond exchanges correspond closely with..."
2001-09-29 05:00:00+00:00,"Dow Jones industrial average rises 166.14 points, or 1.9 percent, ending week of recovery in which index gains 7.4 percent for its best week since 1984; all other major indexes rise as well; Nasdaq gains 38.09 points, or 2.6 percent, to 1,498.80, ..."
2001-09-29 05:00:00+00:00,
2001-09-29 05:00:00+00:00,"TWO LATIN American companies with listed bonds and relatively high ratings for their region are Cemex SA, the Mexican cement company, and Telefonica de Argentina SA.. Cemex teeters on the brink of investment grade, with a Ba1 rating, the highest s..."
2001-09-29 05:00:00+00:00,"THE MARKET for convertible bonds in Japan has been on the wane. Once one of the most common ways for corporate Japan to raise funds, the total market value topped ¥20 trillion in 1996. That market has since shrunk to ¥11.5 trillion ($97.34 billi"
2001-09-29 05:00:00+00:00,World Business Briefing
2001-09-29 05:00:00+00:00,"Fred Alger, founder of Fred Alger Management, says he will return from semi-retirement to manage firm following death of his brother, David Alger, in World Trade Center attack; one of his most urgent tasks is to rebuild his devastated staff; firm ..."
2001-09-29 05:00:00+00:00,"Japan's banks are recording major losses on their books as first half of Japan's fiscal year ends; Heizo Takenaka, Japanese finance minister, says losses show banks are finally coming to grips with their problems; gives no sign that government is ..."
2001-09-29 05:00:00+00:00,"Although there are many variations, a bond is essentially a receipt for a loan. In a conventional deal, money is borrowed when the bond is issued and paid back when it matures, anywhere from a few months to 100 years later.. Most bonds pay interes..."
2001-09-29 05:00:00+00:00,"World stock markets posted solid gains Friday, continuing a mini-rally that has lifted share prices sharply from the lows they recorded amid the general gloom following the terrorist attacks on the United States..The rebound has persisted througho..."
2001-09-29 05:00:00+00:00,London Stock Exchange says it has approached London International Financial Futures and Options Exchange about merger in effort to cement its position as leading venue for share and derivatives trading in Europe; photo (S)
2001-09-29 05:00:00+00:00,"FROM THE bond market's perspective, Lucent Technologies Inc. and International Business Machines Corp. are the odd couple of technology..While they share space in the New York Stock Exchange's bond listings, their securities are as different as ni..."
2001-09-30 05:00:00+00:00,"DIARY A Quick Rebound In Bullish Sentiment  As the stock market lurched back from one of its worst weeks ever, investor sentiment was improving, according to an online survey of members of the American Association of Individual Investors."
2001-09-30 05:00:00+00:00,"Dollar stores, discounters of household staples, appear well positioned to weather current difficult retailing economy; analysts comment on major publicly traded companies in sector, including Family Dollar Stores, Dollar General, Dollar Tree Stor..."
2001-09-30 05:00:00+00:00,"Mark Hulbert Strategies column says stock investors should take heart from Value Line's median appreciation potential, index whose current reading is 100 percent; says it provides solid evidence that stock should have average annual returns of abo..."
2001-09-30 05:00:00+00:00,Online survey of members of American Association of Individual Investors registers strongest bullish market sentiment since late May (S)
2001-09-30 05:00:00+00:00,Roundup of week's financial markets; charts; table of rates and yields (S)
2001-09-30 05:00:00+00:00,
2001-09-30 05:00:00+00:00,"Paul Krugman cover story article weighs impact of Sept 11 terrorist attacks on United States economy; contends that economic repercussions from World Trade Center disaster, unnerving as they are, would soon fade out if economy had been strong to b..."
2001-09-30 05:00:00+00:00,Scene at Westchester County Airport described as it operates under level four security regulations mandated by Federal Aviation Administration after terrorist attacks; photos (M)
2001-09-30 05:00:00+00:00,John D Connell letter supports Mark Hulbert's September 2 article concluding that current bear market is not yet over
2001-09-30 05:00:00+00:00,"Carole Gould profile of Harold J Levy and David L Cohen, managers of First Eagle Fund of America, who are now scrambling to make sense of market severely disrupted by terrorist attacks on US; photo; chart (M)"
2001-09-30 05:00:00+00:00,"Article on fragile state of New Jersey's economy in wake of World Trade Center attacks; state, already showing signs of weakness before attacks, could see loss of business activity, consumer confidence and jobs even more than US as whole; photo (M..."
2001-09-30 05:00:00+00:00,
2001-09-30 05:00:00+00:00,Near Ground
2001-09-30 05:00:00+00:00,"Op-ed article by Robert E Rubin, secretary of treasury from 1995 to 1999, assesses outlook for United States economy in aftermath of terrorist attacks; holds likelihood now that economic difficulty will last for considerable period is increased, b..."
2001-09-30 05:00:00+00:00,
2001-09-30 05:00:00+00:00,"Argentina's economy is near collapse, decade after country became darling of financial world when it privatized bureaucracies, cut red tape and pegged value of peso to dollar; many international financiers have left over last three years of deepen..."
2001-09-30 05:00:00+00:00,Gretchen Morgenson column says behavior of different stock markets around the world after Sept 11 attacks makes case for diversification as crucial investment strategy for periods of extreme stress as well as for calmer times; graph (M)
2001-09-30 05:00:00+00:00,"Car dealers around Westchester County, NY, report sharp drop in sales since September 11 terrorist attacks; photo (S)"
2001-09-30 05:00:00+00:00,Missing the Lessons Of Crisis Management To the Editor:.
2001-09-30 05:00:00+00:00,"Kenneth N Gilpin interviews Jonathan C Raleigh, utilities industry analyst at Goldman Sachs, on effect of World Trade Center tragedy on stocks in that sector; photo (M)"
2001-09-30 05:00:00+00:00,Brief portraits of some people killed in Sept 11 terrorist attack on World Trade Center; photo (M)
2001-09-30 05:00:00+00:00,"Economists, stock market strategists and money managers struggle to revise their forecasts in wake of Sept 11 attacks; their current forecasts are even fuzzier than usual, ranging from quick return of robust economy and stock market growth to fund..."
2001-09-30 05:00:00+00:00,"WHEN our Connecticut friends used to ask me where our beach house was, I would answer, ''Long Island'' and hope they would let it go at that. If they pursued the matter and asked, ''Where on Long Island?'' I would mumble ''Amagansett,'' hoping the..."
2001-09-30 05:00:00+00:00,"Article on chill felt in Flushing, Queens, where many of city's 20,000 Afghans live and work, in wake of World Trade Center attacks; photo (M)"
2001-10-01 05:00:00+00:00,"Mets General Manager Steve Phillips emphatically defended closer Armando Benitez on Monday, saying he had no intention of trading him despite recent troubles."
2001-10-01 05:00:00+00:00,"Stocks fell moderately today as investors, still nervous about the scope of American military reaction to the terrorist attacks, were discouraged by more weak economic data and a fresh wave of corporate earnings warnings."
2001-10-01 05:00:00+00:00,"Profile of customer relations management software industry, which has enabled computer suppliers, insurers and financial services providers to determine and meet needs of customers directly affected by terrorist attacks on World Trade Center and P..."
2001-10-01 05:00:00+00:00,"Auto sales, which virtually halted in wake of terrorist attacks on World Trade Cener and Pentagon, are beginning to resume as passage of time and new incentives bring some customers back to showrooms; most analysts sharply scale back sales estimat..."
2001-10-01 05:00:00+00:00,"Editorial, commenting on fiscal problems facing Empire Blue Cross and Blue Shield, which has been trying since 1996 to guarantee its future by shedding its not-for-profit status, urges New York State to clear political hurdles that would enable it..."
2001-10-01 05:00:00+00:00,"NTT DoCoMo will introduce world's first third-generation cellular phone network; new service, at first available only in Tokyo area, promises Internet connections up to 40 times faster than current phones so users can download audio and video file..."
2001-10-01 05:00:00+00:00,"Analysts inside and outside federal overnment say large budget surpluses of recent years are likely to give way to deficit in fiscal year beginning October 1, in swift turnabout brought on by weakening economy and cost of campaign against terroris..."
2001-10-01 05:00:00+00:00,"The attacks on the World Trade Center and the Pentagon have brought Americans and much of the rest of the world back to basics: to religion, to patriotism, to compassion, to family life. This is a time for investors to go back to basics, too. Now,..."
2001-10-01 05:00:00+00:00,Market Place column on outlook for stock prices as fourth quarter opens; notes investors are putting far greater stress on federal efforts to spur economy and bar further slide in stock prices (M)
2001-10-01 05:00:00+00:00,Some Web retailers have seen subsequent sales surge after falloff in online purchases week of Sept 11 terrorist attacks; surge may suggest people would rather shop online than venture out to shopping malls; some analysts warn drop in consumer spen...
2001-10-02 05:00:00+00:00,"The Federal Reserve once again cut interest rates today by an expected half a percentage point, to their lowest level since 1962."
2001-10-02 05:00:00+00:00,"Dispute between federal officials racing to protect nation from possible used by terrorists of weapons of mass destruction and experts who hold more mundane instruments pose more credible threats is throwing light on threat assessment; discipline,..."
2001-10-02 05:00:00+00:00,"Treasury Sec Paul H O'Neill, who developed reputation for speaking his mind and straying beyond Bush administration's line on numerous issues, has found himself playing less central role in economic policy making than his recent predecessors; has ..."
2001-10-02 05:00:00+00:00,"Compaq Computer Corp says it has missed its third-quarter sales goals by as much as 12 percent and will post operating loss, largely because of virtual halt to its business after Sept 11 (M)"
2001-10-02 05:00:00+00:00,On Pro Football column holds New York Jets are already running out of time as offense fades and defense against run is nonexistent in loss to San Francisco 49ers; photo (M)
2001-10-02 05:00:00+00:00,Stocks rose modestly today as investors made few moves ahead of a possible interest rate cut by the Federal Reserve.
2001-10-02 05:00:00+00:00,"Salon, Web magazine facing sharply lower advertising revenues and increased costs for gathering news, decides to make its news and political coverage available only to paying subscribers, having circulation revenue cover half of next year's $7.5 m..."
2001-10-02 05:00:00+00:00,The stock market closed higher today after the Federal Reserve cut interest rates by half a percentage point.
2001-10-02 05:00:00+00:00,"Havas Advertising is expected to warn investors that profits will not meet expectations; two industry analysts, Laura Rich Fine and Michael J Russell Jr, make further reductions in their estimates of ad spending this year and next; CMR says nation..."
2001-10-02 05:00:00+00:00,"Dow Jones industrial average loses 10.73 points, to 8,836.83; Nasdaq composite index falls 18.34 points, to 1,480.46; Standard & Poor's 500-stock index drops 2.39 points, to 1,038.55; graph; chart (M)"
2001-10-02 05:00:00+00:00,
2001-10-02 05:00:00+00:00,"Analysis of Federal Reserve interest rate policy at time when Alan Greenspan, chairman, is counseling Congress and Bush administration not to rush ahead with economic stimulus plan in wake of terrorist attacks; says Greenspan, in moving quickly an..."
2001-10-02 05:00:00+00:00,"Sept. 11 has spawned much theorizing about Islam and modernity. The theorizing may add to Muslim paranoia..One notion now doing the rounds is that there is a clear connection between Islam and lack of economic development. This is then ""proved&quo"
2001-10-02 05:00:00+00:00,"United Airlines parent, UAL Corp, stirs ire in Washington and within its work force by proceeding with plan to spend millions of dollars over next five years acquiring luxury business jets and selling shares in them to corporations and wealthy ind..."
2001-10-02 05:00:00+00:00,"The Federal Reserve once again cut interest rates today by an expected half a percentage point, to their lowest level since 1962."
