pub_date,snippet
2002-01-30 05:00:00+00:00,"Japanese Prime Minister Junichiro Koizumi fires Foreign Minister Makiko Tanaka, ending tumultuous nine-month alliance in which two of Japan's most popular politicians tried to balance their reformist tactics in same government; photo (M)"
2002-01-30 05:00:00+00:00,"Faced with popular president rallying nation for long struggle against terrorism in State of the Union address, Democrats seek to stand united with Pres Bush in war effort and to showcase their own competing domestic agendas without appearing part..."
2002-01-30 05:00:00+00:00,"Bharti Tele-Ventures, leading company in India's booming telecommunications market, begins country's first significant initial public offering in two years; gets off to good start by collecting bids for about 60 percent of shares to be offered; am..."
2002-01-30 05:00:00+00:00,"Nissho Iwai, one of Japan's Big Six general trading companies that built country's postwar prosperity, will embark on three-year program of deep job cuts and sweeping asset sales to reduce debt and try to make itself profitable again; Nissho Iwai ..."
2002-01-30 05:00:00+00:00,Joel Azerrad letter on Jan 29 article holds Enron scandal should discourage stock market-based system for Social Security
2002-01-30 05:00:00+00:00,"Thomas W. Barritt, senior vice president at Ketchum, New York, a unit of the Omnicom Group, was named as the global director a new issues and crisis management network."
2002-01-30 05:00:00+00:00,"Williams Companies says it is delaying release of its fourth-quarter results to complete assessment of financial health of Williams Communications Group, telecommunications company Williams spun off as independent business in April; at issue is to..."
2002-01-30 05:00:00+00:00,Looking abroad for a way to diversify your stock portfolio? You may want to hold off and stick closer to home.
2002-01-30 05:00:00+00:00,"IF ONE word were to sum up the state of the U.S. markets as the year begins, it would be uncertainty with a capital ""U."" As more mutual fund managers scurry behind the u-word in their outlooks for 2002 and beef up their cash positions, the usual"
2002-01-30 05:00:00+00:00,"Japan's reformist prime minister, Junichiro Koizumi, faced a major crisis today as voters frowned on his firing of the popular foreign minister, Makiko Tanaka."
2002-01-31 05:00:00+00:00,"Video prepared by University of Virginia Profs Robert F Bruner and Samuel E Bodily shows Enron Corp was still flying high in April 2000; Jeffrey K Skilling, president and chief operating officer at time, faced video camera and spoke enthusiastical..."
2002-01-31 05:00:00+00:00,Viacom board members tell chairman-chief executive Sumner M Redstone and president-chief operating officer Mel Karmazin to end personal conflict between them that has emerged into public view; group of outside directors makes plea in unusual separ...
2002-01-31 05:00:00+00:00,"Investment Company Institute says investors added $3.04 billion to stock funds in December, pushing total for year to $32.3 billion; in 2000, investors added record $309.4 billion to equity funds; stock funds held $3.41 trillion at end of 2001, 14..."
2002-01-31 05:00:00+00:00,"Carnival Corp drops almost all strings attached to its offer for P&O Princess Cruises, in hopes of garnering shareholder support before scheduled vote on rival plan to merge P&O Princess with Royal Caribbean Cruises; Carnival says only remaining c..."
2002-01-31 05:00:00+00:00,"New York State's pension fund loses $63 million on stock of Global Crossing, which comes on top of $58 million loss in Enron's collapse; Comptroller H Carl McCall's management of fund has been seized on as issue by Andrew M Cuomo, his rival for De..."
2002-01-31 05:00:00+00:00,Securities and Exchange Commission creates series of Web sites to warn people about rushing into investments on Internet without fully investigating offers; other government agencies and law enforcement organizations will assist SEC with similar s...
2002-01-31 05:00:00+00:00,World Business Briefing
2002-01-31 05:00:00+00:00,"House explodes in Smithtown, LI, apparently killing Alfred Maus, eccentric inventor who lived there; police investigate whether explosion was set off by aceylene tank found in basement, where it was apparently was used by Maus for welding; photo (..."
2002-01-31 05:00:00+00:00,"Dow Jones industrial average climbs 144.62 points, or 1.5 percent, to 9,762.86; Nasdaq composite index advances 20.45 points, or 1.1 percent, to 1,913.44; Standard & Poor's 500-stock index gains 12.93 points, or 1.2 percent, to 1,113.57; graph; ch..."
2002-01-31 05:00:00+00:00,Technology Briefing
2002-01-31 05:00:00+00:00,The world is watching the unfolding of the Enron bankruptcy and its aftershocks through local lenses of sometimes surprising hues.
2002-01-31 05:00:00+00:00,"Despite predictions of another contraction, the U.S. economy eked out growth in the fourth quarter, the government reported Wednesday, as the Federal Reserve kept interest rates unchanged..The economy grew at an annual rate of 0.2 percent in the l..."
2002-01-31 05:00:00+00:00,Media analysts are split as to whether alleged conflicts between Viacom Inc chairman-chief executive Sumner M Redstone and president-chief operating officer Mel Karmazin are real or silly sideshow; Merrill Lynch media analyst Jessica Reif Cohen sa...
2002-01-31 05:00:00+00:00,"General Accounting Office says it will sue White House to try to force Vice Pres Dick Cheney to release documents detailing contacts between corporate executives and administration's energy task force, which was chaired by Cheney; David M Walker, ..."
2002-01-31 05:00:00+00:00,"AT&T Corp says revenue at its consumer unit fell by 18.3 percent in fourth quarter, to $3.47 billion from about $4.25 billion year earlier; reports overall revenue of $12.59 billion, down about 9.5 percent from $13.91 billion year earlier; chief e..."
2002-01-31 05:00:00+00:00,Metro Briefing
2002-01-31 05:00:00+00:00,"Architects take variety of approaches to displaying huge flat-screen televisions; some put them on poles, hang them like art or make them disappear into ceiling or custom credenza when not in use; photos (M)"
2002-01-31 05:00:00+00:00,
2002-02-01 05:00:00+00:00,"The nation's economy continued to lose jobs in January, but at a slower pace, the government reported today."
2002-02-01 05:00:00+00:00,"Op-Ed column by Paul Krugman on why he suspects there will be more 'Enrons' in the future; says pyramid scheme requires means, motive and opportunity, and lately all three have been there in abundance; says it has been easy for companies to create..."
2002-02-01 05:00:00+00:00,"Prime Min Junichiro Koizumi of Japan moves to contain growing political and economic crisis, chosing Yoriko Kawaguchi as his new foreign minister; Koizumi was blindsided by wave of popular anger over his firing of Makiko Tanaka, who appeared night..."
2002-02-01 05:00:00+00:00,"The crisis in Argentina has been contained there so far. Many other developing countries, including South Korea, Taiwan, Russia, and even Argentina's neighbor and trading partner, Brazil, have shown economic resilience and strongly rising stock ma..."
2002-02-01 05:00:00+00:00,"Four of five biggest accounting firms say they will reject industry practices that prompted extensive criticism of Arthur Andersen, which audited financial statements of and provided consulting services to Enron Corp; PricewaterhouseCoopers and An..."
2002-02-01 05:00:00+00:00,
2002-02-02 05:00:00+00:00,EUROPE TRADE: W.T.O. RESOLVES DISPUTE Member countries of the World Trade Organization resolved a dispute on how to structure negotiations on a new round of talks aimed at opening global markets. The 144-member group agreed that the body's directo...
2002-02-02 05:00:00+00:00,"Ira Waldbaum, who dropped out of college to help run his family's six small grocery stores in Brooklyn and ended up building what was at one time nation's 12th-largest supermarket chain, dies at 74; photo (M)"
2002-02-02 05:00:00+00:00,"WHEN Sony Communication Network Co. made its June debut on the Tokyo Stock Exchange, falling 11 percent from its offering price on the first day it traded, shareholders received an apology from Teruhisa Tokunaka, the company's chief financial offi..."
2002-02-02 05:00:00+00:00,"THE WAY TO make money in Asia's treacherous and often disappointing stock markets, Hugh Young of Aberdeen Asset Management PLC has found, is to remain skeptical and avoid being a fashion victim..Mr. Young, who heads the fund management firm's Sing..."
2002-02-02 05:00:00+00:00,"The U.S. economy is clearly on the road to recovery, but its growth in 2002 will not be strong enough to pull along a lackluster European Union and a deeply troubled Japan, said business leaders, bankers and economists attending the annual meeting..."
2002-02-02 05:00:00+00:00,"News analysis of abrupt shift in Japanese public opinion against Prime Min Junichiro Koizumi following his ouster of foreign minister Makiko Tanaka, country's most popular politician (M)"
2002-02-02 05:00:00+00:00,"Commercial product tie-ins to Sept 11 terrorist attacks, such as Steve Madden's 'Bravest' sneaker line, blur line between charity and profit; photos; none of Madden profits have reached families of dead firefighters, and companyonly last month ple..."
2002-02-02 05:00:00+00:00,"Bankruptcy filing by Wheeling-Pittsburgh Steel and LTV's shutdown stir fear in Ohio Valley, where hometown industry has brought middle-class prosperity for decades; photos; workers and management have long blamed each other for industry's woes, bu..."
2002-02-02 05:00:00+00:00,"Bernard J Ebbers, man who build WorldCom into giant company, now owes at least $92 million more than his stock in company is worth, but there appears to be no immediate danger that his stock will come onto market (M)"
2002-02-02 05:00:00+00:00,"Editorial says Enron scandal is shaping up to be business world's equivalent of Watergate, trigger for raft of reformo proposals to restore Americans' trust in its institutions; cites Pres Bush's proposal to bolster pension-plan safeguards and acc..."
2002-02-02 05:00:00+00:00,"Frank Rich Op-Ed column on 'tragic news' that Pres Bush's mother-in-law lost $8,000 on her Enron stock, followed by Kenneth Lay's wife sobbing on television about their financial woes, implying that they are bigger victims than employees who compl..."
2002-02-02 05:00:00+00:00,"Enron, desperate for cash, hopes to raise $1.4 billion by selling Portland General Electric, its electric utility in Salem, Oregon, in deal that utility's biggest industrial clients say enriches executives at expense of customers big and small; co..."
2002-02-02 05:00:00+00:00,"Mirant Corp. is having a tough time: It said this week that earnings per share in 2002 would be $1.60 to $1.70, down from a $1.90-to-$2.00 range it predicted in December. It cited reduced profitability and sales in North America, where a warm wint..."
2002-02-03 05:00:00+00:00,DIARY Ford's Bet on Metals Prompts a Lawsuit.
2002-02-03 05:00:00+00:00,"Foreign economists and executives in New York for World Economic Forum are much less optimistic than American counterparts aboutoutlook for US economy; dwell on dwindling profits, debt and constant shrinking of corporate operations, while American..."
2002-02-03 05:00:00+00:00,Jonathan Reynolds article gives recipes using pork cheeks and beef cheeks; photo (M)
2002-02-03 05:00:00+00:00,Louis Uchitelle column on indications that Americans may have to stay on the job until their late 60's or early 70's if they want to live as well in retirement as their parents did who retired at 65; graph (M)
2002-02-03 05:00:00+00:00,Office vacancy rates in FairB
2002-02-03 05:00:00+00:00,"Mark Hulbert column on poor recent performance of earnings momentum strategies, which call for immediate purchase of stock after strong earnings report; notes several hypotheses offered for bad year and suggests another: that so many advisers and ..."
2002-02-03 05:00:00+00:00,"Chief executives, prime ministers and economists gathered at World Economic Forum shift their focus from economy to security dangers in world; talk is of keeping corporate headquarters secure, keeping chemical and biological materials out of wrong..."
2002-02-03 05:00:00+00:00,Financial market performance of the week reviewed; graphs and charts (M)
2002-02-03 05:00:00+00:00,"Companies that improve quality and reliability of electric power attract investor interest as more and more companies adopt digital manufacturing technology, whose operation can be brought to destructive halt by power problems; analysts comment on..."
2002-02-03 05:00:00+00:00,"Specialty summer camps, once restricted to sports and arts, now allow children from grade school to high school pursue all sorts of interests; photos (M)"
2002-02-03 05:00:00+00:00,"American companies are increasingly making large loans to executives at very favorable terms, raising concerns about shareholder watchdogs; biggest concern is disclosure -- or nondisclosure -- of stock-for-loans swaps that hundreds of executives m..."
2002-02-03 05:00:00+00:00,Major developments of past week related to collapse of Enron Corp reviewed (M)
2002-02-03 05:00:00+00:00,"American corporations with venture capital arms suffered heavy losses in 2001, and many have either closed them down or sold them off; corporations have history of jumping into venture business when market is up and fleeing just as quickly when ma..."
2002-02-03 05:00:00+00:00,"Profile of ViroPharma Inc, small company based in Exton, Pa, which has developed drug that it says can reduce length and severity of common cold by attacking rhinovirus; drug, called plecoaril, trademarked as Picovir, also reduces so-called viral ..."
2002-02-03 05:00:00+00:00,"Initial batch of annual proxy statements indicate that top executives at American companies got more stock options as part of their pay in 2001; trend disturbs compensation experts, since it would seem to make mockery of concept of pay for perform..."
2002-02-03 05:00:00+00:00,"Adam Quinton, head of global telecommunications research at Merrill Lynch, discusses outlook for telecommunications industry, which is still reeling from excess investment and capacity; photo (M)"
2002-02-03 05:00:00+00:00,Focus on possible role played by Enron's former chairman Arthur Lay in company's collapse; formerly powerful executive to whom lawmakers were deferential during appearance before Congress in 1996 will face panel eager to pulverize him in upcoming ...
2002-02-03 05:00:00+00:00,"Alex Bereson column questions changes in disclosure requirements for public companies being proposed by Harvey L Pitt, SEC chairman, and senior Bush administration officials, who want companies to produce much more information about their projecti..."
2002-02-03 05:00:00+00:00,"Fred Brock column says too many companies fail to consider elderly consumer and are missing out on huge market as a result; praises Borders bookstores and Cracker Barrell restaurant chain as senior-friendly businesses; cites Gary Onks, author of S..."
2002-02-03 05:00:00+00:00,"Analysts believe that Russia's stock market is becoming hospitable for investors, not just speculators, as in its first seven years; stocks are still relatively cheap despite 80 percent jump in value of Russian market in 2001, partly because marke..."
2002-02-03 05:00:00+00:00,"Enron Corp's collapse does not diminish merits of business model it pioneered: online exchange where financial bets, not assets, back trading in energy and natural gas; drawing (M)"
2002-02-03 05:00:00+00:00,"Profile of Alfred J Roach, 86, who founded American Biogenetic Sciences of Copiague, NY, nearly two decades ago; Nasdaq halted trading of company stock after company announced, at peak of public concern over anthrax and bioterrorism, that company ..."
2002-02-03 05:00:00+00:00,Excerpts from report of special investigating committee of board of Enron Corp relating to company's collapse (L)
2002-02-03 05:00:00+00:00,"Carole Gould profile of $200 million Bramwell Growth fund and its manager, Elizabeth R Bramwell, who is now emphasizing growth in retailing (M)"
2002-02-03 05:00:00+00:00,The world is watching the unfolding of the Enron bankruptcy and its aftershocks through local lenses of sometimes surprising hues.
2002-02-03 05:00:00+00:00,"Janus Capital, whose mutual funds have performed poorly since end of Internet boom, lays off 222 more employees, 15 percent of its work force (S)"
2002-02-03 05:00:00+00:00,"Article profiles William R McLucas, who will oversee SEC's investigation of possible wrongdoing that may have led to collapse of Enron Corp; photo (M)"
2002-02-04 05:00:00+00:00,"In the week after the terror attacks on New York and Washington, stocks fell sharply. But, as investors began to realize that Sept. 11 did not really constitute the end of economic life as we knew it, most of the market quickly rebounded.. Look at..."
2002-02-04 05:00:00+00:00,
2002-02-04 05:00:00+00:00,"Market Place column on outlook for WebMD, leading health care consumer Internet portal, whose stock plunged when Internet bubble burst in 2000; company is making recovery of sorts after 15 months of turnaround therapy under leadership of Martin J ..."
2002-02-04 05:00:00+00:00,"Motley Fool, financial investment Web site, to begin charging subscription fee for access to its discussion areas; photo (M)"
2002-02-04 05:00:00+00:00,"Stocks took a broad-based dive today as investors, worried about possible corporate mismanagement, punished companies with murky accounting procedures."
2002-02-04 05:00:00+00:00,"Cray Inc, supercomputer maker, to announce three-year deal to resell smaller computers by Dell that can be linked into clusters of processors that solve complex problems; deal is latest move in effort by Cray chief executive Michael P Haydock to f..."
2002-02-04 05:00:00+00:00,"Viacom chief operating officer Mel Karmazin makes rare joint appearance with Sumner M Redstone at dinner for institutional investors, calming some of investor concerns about reported friction between them; pledges he will stay on through end of hi..."
2002-02-04 05:00:00+00:00,"List of Congressinal hearings scheduled this week on collapse of Enron Corp, and expected witnesses at each"
2002-02-04 05:00:00+00:00,"Matt Richtel New Economy column sees initial public offering of Paypal, which provides payment system for goods and services bought over Internet, testing investor appetite for Internet ventures; notes company, like many hot Internet stocks of pas..."
2002-02-05 05:00:00+00:00,Excerpts from statement by William C Powers Jr and testimony by Chmn Harvey L Pitt before House commitee probing Enron collapse (M)
2002-02-05 05:00:00+00:00,Paul Krugman Op-Ed column on 'creative accounting' of Pres Bush's budgets; says last year's budget used version of 'mark to market' accounting by taking bullish 10-year surplus projection that should have been regarded as no more than guess and tr...
2002-02-05 05:00:00+00:00,"Tyco International shares fall sharply after company loses access to commercial paper market, major source of financing for big companies and Fitch Ratings and Standard & Poor's cut Tyco's bond ratings; chairman L Dennis Kozlowski says Tyco arrang..."
2002-02-05 05:00:00+00:00,
2002-02-05 05:00:00+00:00,Argentine government orders banks to stop dealing in foreign currency and to turn over all dollars to central bank; moves extend its earlier steps to convert all dollar-denominated debts and deposits to pesos at far below open-market rates; govern...
2002-02-05 05:00:00+00:00,"Dow Jones industrial average drops 220.17 points, or 2.2 percent, to 9,687.09; Nasdaq composite index falls 55.71 points, or 2.9 percent, to 1855.53; Standard & Poor's 500-stock index falls 27.76 points, or 2.5 percent, to 1,094.44; graph; Treasur..."
2002-02-05 05:00:00+00:00,Market Place column on plunge in Tyco International stock on concerns about its accounting practices; notes short-sellers question whether some of hundreds of companies Tyco acquired in recent years took steps to depress profits just before deals ...
2002-02-06 05:00:00+00:00,"People who knew and worked with Andrew S Fastow, former chief financial officer at Enron, and Enron's internal report on company's downfall portray him as brilliant, ambitious and hard-charging executive who grew obsessed with using complex financ..."
2002-02-06 05:00:00+00:00,"Adam Cohen Editorial Observer column on signs of life in dot.com world, including coming initial public offering of PayPal, which has come to dominate fast-growing online payments business; says worst excesses of dot-com era are gone (M)"
2002-02-06 05:00:00+00:00,"Deloitte Touche Tohmatsu says it will separate its accounting business from its consulting business in response to growing pressure from investors, regulators and clients in wake of Enron Corp collapse; firm will also not handle both internal and ..."
2002-02-06 05:00:00+00:00,"Article on whether automobiles will be part of future of Italian conglomerate Fiat SpA; says speculation got boost from news reports that members of Angelli family, Fiat's principal shareholders, were complaining that losses at car division were d..."
2002-02-06 05:00:00+00:00,"Finns acknowledge Nokia's great contribution to national economy over last decade, but are becoming anxious about size of country's dependence on cellphone giant, especially after Jorma Ollila, chairman and chief executive, wonders aloud about low..."
2002-02-06 05:00:00+00:00,Verizon and SBC Communications have backed out of bidding for Worldcom Inc amid concerns that WorldCom's core long-distance businesses face continued difficulties; telecommunications experts say Verizon and SBC may have also been scared by WorldCo...
2002-02-06 05:00:00+00:00,JetBlue Airways has revied its plans for public stock offering; airline could announce as early as next week that it intends to raise about $125 million; lead underwriter is expected to be Morgan Stanley Dean Witter (M)
2002-02-06 05:00:00+00:00,Tyco International Ltd moves quickly to sell or spin off finance unit CIT Group to stem crisis of confidence that has caused its stock to fall by more than half in last month; restoring confidence in CIT is crucial for Tyco because unit depends on...
2002-02-06 05:00:00+00:00,"Shareholders of Elan Corp, Dublin-based specialty drug maker, have beaten down company's share price by two-thirds in week on concern about company's finances; Elan says its sales rose 22 percent in 2001, to $1.9 billion, but warns that profits wi..."
2002-02-07 05:00:00+00:00,Alan B Krueger Economic Scene column on Pres Bush's call for Americans to volunteer to pick up slack in social services; says Harvard University economist Richard Freeman believes that voluntary labor is best thought of as 'conscience good or acti...
2002-02-07 05:00:00+00:00,"Internal Revenue Service data shows that number of Americans with million-dollar incomes more than doubled from 1995 through 1999, from 87,000 to 205,000, while percentage of their income that went to federal income taxes fell from 31.4 percent to..."
2002-02-07 05:00:00+00:00,"Interview with Candice Olson, co-founder and former chief executive of iVillage.com, women's Web site, on her book, Chapters: Create a Life of Exhilaration and Accomplishment in the Face of Change, which instructs the newly unemployed in fine art ..."
2002-02-07 05:00:00+00:00,PepsiCo Inc posts 4.4 percent decline in fourth-quarter earnings; net income fell to $667 million compared with $698 million year earlier; revenue rose to $7.99 billion from $7.87 billion; chairman Steven S Reinemund comments (M)
2002-02-07 05:00:00+00:00,"NTL chief executive Barclay Knapp risks losing control of European cable company he built with company mired in $17.3 billion in debt; equity investors are likely to wind up with nothing, and bondholders will probably agree to forgive some debt in..."
2002-02-07 05:00:00+00:00,
2002-02-07 05:00:00+00:00,"Bristol-Myers Squibb is trying to restructure deal with ImClone Systems Inc, biotechnology company developing new type of cancer drug called Erbitux, after Food and Drug Administration refused to accept studies that ImClone had filed to gain appro..."
2002-02-07 05:00:00+00:00,"Tyco International Ltd says its earnings will fall short of its previous forecasts and that it will not complete takeover of C R Bard Inc, medical supplies company; Tyco had agreed in May to buy Bard for $3.2 billion, but Bard grew skittish about ..."
2002-02-07 05:00:00+00:00,The following is the text of the morning session of a hearing of the oversight and investigations subcommittee of the House Energy and Commerce Committee on the findings of Enron’s special investigative committee as recorded by the Federal News Se...
2002-02-07 05:00:00+00:00,Allfirst Financial says currency trader John Rusnak working in Baltimore for its bank ran up $750 million in losses over last year that were hidden with bogus offsetting trades and not discovered until recently; bank says Rusnak cannot be found an...
2002-02-07 05:00:00+00:00,"Dow Jones industrial average drops 32.04 points, or 0.3 percent, to 9,653.39; Standard & Poor's 500-stock index falls 6.51 points, or 0.6 percent, to 1,083.51; Nasdaq composite index loses 25.81 points, or 1.4 percent, to 1,812.71; graph (M)"
2002-02-07 05:00:00+00:00,"Decline in number of business mergers and acquisitions is linked to Enron Corp collapse; merger activity in January had its slowest start in US since 1998, and deal makers, already contending with shaky market, do not expect first half of year to ..."
