pub_date,snippet
2001-08-26 05:00:00+00:00,"William J Holstein reviews The Business of America, by John Steele Gordon; photo (M)"
2001-08-26 05:00:00+00:00,Article discusses new type of electronic advertising patented by Eyal Cohen that is being used by New York City taxis; devices are affixed to roof of cab and are easily programmable for local advertising depending upon location of cab; photos (M)
2001-08-27 05:00:00+00:00,"Article in series on major media empires profiles Vivendi Universal of France; chairman Jean-Marie Messier cites Vivendi's stress on building direct customer relationships, interview; tables and graphs compare Vivendi with other media conglomerate..."
2001-08-27 05:00:00+00:00,"LAST WEEK, a mutual fund manager named James McCall had the misfortune of being featured on the front pages of The New York Times and the International Herald Tribune. The article told how the growth-and-technology investing strategy that he stuck..."
2001-08-27 05:00:00+00:00,"Electronic Arts: It is hard to find enthusiastic technology stock recommendations in this period of record losses, layoffs and bankruptcies. But amid all the gloom, analysts at J.P. Morgan Securities Inc. recommend fun and games — more specificall..."
2001-08-27 05:00:00+00:00,Financially ailing National Association of Black Journalists approves compromise plan to create advisory committee dominated by professionals with expertise in finance and management; votes to end all curbs on seeking financing from alcoholic beve...
2001-08-28 05:00:00+00:00,"Independent analysts say Computer Associates will probably defeat Sam Wyly's attempt to replace four members of its board, but Wyly's bid has already encouraged change at Computer Associates; since Ranger Governance, Wyly's investment company, beg..."
2001-08-28 05:00:00+00:00,"William Wrigley Jr, 37-year-old head of Wm Wrigley Jr Co, is being applauded for aggressively pushing company to reinvent itself with host of new products and marketing initiatives; years of stagnant volume growth in US give way to brisk sales of ..."
2001-08-28 05:00:00+00:00,"EUROPE CHINA: PROFIT FALLS AT OIL COMPANY The Chinese offshore oil company CNOOC reported a 4.2 percent drop in net profit in the first half of the year as it began paying higher taxes, and said it planned an acquisition this year to reinforce its..."
2001-08-28 05:00:00+00:00,Stocks closed sharply lower today after a new report showed that consumer confidence slid unexpectedly this month
2001-08-28 05:00:00+00:00,"PEOPLEAT&T EXECUTIVE JOINS PALM Palm Inc. has appointed David C. Nagel president and chief executive officer of a new software subsidiary. Mr. Nagel, 56, has served as AT&T's chief technology officer since 1996 and is already a member of the board..."
2001-08-28 05:00:00+00:00,South Korea's Hynix Semiconductor opens public battle with foreign creditors who have threatened to declare it in default of its loan agreement if it fails to repay $46 million debt ahead of schedule; Societe Generale contends Hynix broke its loan...
2001-08-28 05:00:00+00:00,Kroll-O'Gara Co changes its name to Kroll Inc and its ticker symbol to KROL (S)
2001-08-28 05:00:00+00:00,"Staples Inc's shareholders approve plan to buy back shares of Staples.com held by venture capitalists and employees, ignoring opponents who complained that price is too high; investors and employees will receive equivalent of $7 worth of Staples s..."
2001-08-28 05:00:00+00:00,"Biopure says its manufactured substitute for human blood has met major safety targets set by Food and Drug Administration in crucial clinical trial; reports detailed data confirming its preliminary report in May that blood substitute, which is der..."
2001-08-28 05:00:00+00:00,"From the best baked beans to what to look for in a good tequila, readers share their insights and answer fellow readers' questions."
2001-08-28 05:00:00+00:00,Dutch telecommunications group Royal KPN appears to be in no rush to make deal with Belgian government-controlled Belgacom; Belgian government together with consortium of main minority shareholders wrote to KPN in bid to speed process; KPN has not...
2001-08-28 05:00:00+00:00,"Deere & Co will eliminate nearly 2,000 jobs by restructuring its construction and forestry divisions and shedding unit that makes Homelite leaf blowers, weed trimmers and chain saws (M)"
2001-08-29 05:00:00+00:00,"With his company's stock down a breathtaking 30 percent in less than a month, the chief executive of Deutsche Telekom AG, Ron Sommer, moved Tuesday to reassure shareholders that he would defend the share price from further sharp declines next mont..."
2001-08-29 05:00:00+00:00,Lawyers representing shareholders in securities class-action lawsuit against Cendant Corp are dealt blow when US Appeals Court upholds $3.2 billion settlement but tosses out $262 million in legal fees; court's decision appears to raise concerns ab...
2001-08-29 05:00:00+00:00,"Greg Whalley is named president and chief operating officer of Enron Corp; Mark A Frevert is promoted to vice chairman; they will join Kenneth L Lay, chairman and chief executive, in office of chairman; photo (M)"
2001-08-29 05:00:00+00:00,"Gateway Corp will lay off about 5,000 workers, or 25 percent of its work force, and eliminate most overseas operations in effort to return to profitability by last quarter of year; projects that restructuring, which will include closing of its Sal..."
2001-08-29 05:00:00+00:00,Roche Holding AG denies Reuters report that it has bid for pharmaceutical operations of Bayer AG (S)
2001-08-29 05:00:00+00:00,
2001-08-29 05:00:00+00:00,Stocks fell today in a broad-based decline after the government said that United States economic growth for the second quarter remained weak.
2001-08-29 05:00:00+00:00,Article discusses long history of relations between Yale University and mainland China; photo (M)
2001-08-29 05:00:00+00:00,"Longtime employees of Lucent Technologies and onetime parent AT&T have not only lost jobs to layoffs but have also seen savings stashed in company stock largely evaporate with 90 percent plunge in stock price since end of 1999; Stephen J Gilligan,..."
2001-08-29 05:00:00+00:00,"Article on so-called Harlem Five: barbershop, bar, bodega, pizza place and Chinese takeout who together have some 100 years in business at corner of Adam Clayton Powell Boulevard and 148th Street in Harlem; businesses are facing eviction from land..."
2001-08-30 05:00:00+00:00,"Prof Mohammed El Faiz, author of book on gardens of Marrakesh, Morocco, leads drive to restore greenery to inner city medina and safeguard remains of 12th-century green belt around city; has been taking inventory with Dr Gary Martin of existing pl..."
2001-08-30 05:00:00+00:00,"Credit Suisse Group says profit fell 23 percent in second quarter from year earlier; income fell 24 percent, to $1.6 billion, in first half of year; photo (M)"
2001-08-30 05:00:00+00:00,Stocks slumped to close at their lowest levels in nearly five months today after some key technology companies released a wave of dour outlooks
2001-08-30 05:00:00+00:00,"Op-Ed article by Ian C Shepherdson says many people fear that growing number of layoffs will cause further slowdown in consumer spending; says this is not necessarily true; holds that rising unemployment is consequence, not cause, of economic slow..."
2001-08-30 05:00:00+00:00,"Computer Associates International soundly defeats effort by dissident investor Sam Wyly to replace four directors, including founder and chairman, Charles Wang; at least 60 percent of shares are voted in favor of current board, while fewer than 20..."
2001-08-30 05:00:00+00:00,"Dow Jones industrial average falls 131.13 points, to 10,090.90; Nasdaq composite index drops 21.81 points, to 1,843.17, while Standard & Poor's 500-stock index declines 12.91 points, to 1,148.60; graph; chart (M)"
2001-08-30 05:00:00+00:00,"Metalurgica Gerdau SA, 100-year-old family-owned steel company based in Porto Alegre, Brazil, has transformed itself into global business, demonstrating how once-obscure company from emerging nations like Brazil are becoming increasingly important..."
2001-08-30 05:00:00+00:00,Swissair Group announced that it will sell major stakes in two profit-making units
2001-08-30 05:00:00+00:00,Commerce Dept reports American economy grew more slowly in second quarter than at any time in eight years; many economists say new numbers suggest that nation could avoid recession if consumers continue to spend at their present level; nation's ou...
2001-08-30 05:00:00+00:00,
2001-08-31 05:00:00+00:00,Shares of medical device maker Sulzer Medica rise about 19 percent after Federal Judge Kathleen O'Malley gives preliminary approval to company's $780 million settlement offer for class-action lawsuits over defective hip implants (M)
2001-08-31 05:00:00+00:00,"DrKoop.com Inc., the health-care information Web site named after the former U.S. surgeon general, completed a private placement of $5 million in stock and said it would to change its name to Dr. Koop LifeCare Corp. The company, whose market value..."
2001-08-31 05:00:00+00:00,
2001-08-31 05:00:00+00:00,"New York State takes over Frontier Insurance Company in effort to salvage it from financial decline; company is based in Rock Hill, NY, in Sullivan County, which has been struggling to recover from hard times since Borscht Belt resorts shut down; ..."
2001-08-31 05:00:00+00:00,"France Telecom rushes out part of its earnings report for first half of 2001, one week ahead of schedule; reports income increased 14 percent, to 6.07 billion euros ($5.52 billion) for period; company still plans to report its net income on Sept 5..."
2001-08-31 05:00:00+00:00,"EARNINGS ALLOY POSTS 2ND-QUARTER LOSS Alloy Online Inc., a New York Internet company and retailer focused on the teenage market, announced pro forma losses of $2.3 million, or 10 cents a share, yesterday for its fiscal second quarter, ended on Jul..."
2001-08-31 05:00:00+00:00,"Charles Schwab Corp will cut as many as 2,400 jobs by end of October; company has already laid off 3,400 people this year; chief financial officer Christopher Dodds says there is no rebound in sight for stock trading (M)"
2001-08-31 05:00:00+00:00,"Shares of AremisSoft Corp resume trading after monthlong halt caused by Securities and Exchange Commission investigation; shares immediately fall in value 91 percent, closing at $1 from $10.19 (S)"
2001-08-31 05:00:00+00:00,"Swissair Group closes book on its ambitions to become major airline competitor, saying it will sell big stakes in two profitable units to reduce its $9 billion debt; will also eliminate 1,250 jobs to cut costs; will sell Nuance, which runs airport..."
2001-08-31 05:00:00+00:00,"Global technology bust sends Japan's manufacturing sector into precipitous decline that may lead its chronically sick economy into another recession; giant manufacturers of chips, home electronics and other goods announce plans for sharp cuts in e..."
2001-08-31 05:00:00+00:00,"Nasdaq composite index drops 51.40 points, or 2.79 percent, to 1,791.68; Dow Jones industrial average loses 171.32 points, or 1.70 percent, to 9,919.58, while Standard & Poor's 500-stock index declines 19.57 points, or 1.70 percent, to 1,129.03; D..."
2001-08-31 05:00:00+00:00,"Alloy Online Inc reports pro forma losses of $2.3 million for its fiscal second quarter ended July 31; revenue was $28.7 million, up from $12.3 million year earlier; graph (S)"
2001-08-31 05:00:00+00:00,"Antiques column on lively market in vintage travel posters, expecially in Britain; photo; upcoming auctions at Christie's London and Swann Galleries noted (S)"
2001-08-31 05:00:00+00:00,"Alan Greenspan, chairman of the Federal Reserve, said policymakers were struggling to understand how the volatile stock market and the value of homes are affecting the economy"
2001-09-01 05:00:00+00:00,"Hitachi Ltd, Japan's largest private employer, will cut 4 percent of its work force, or 14,700 jobs, by March--10,200 in Japan and remaining 4,500 overseas; says need for staff reductions stems from slump in high technology and from company's expe..."
2001-09-01 05:00:00+00:00,
2001-09-01 05:00:00+00:00,"Public Lives column profile of Ed Thompson, former Wisconsin Gov Tommy Thompson's brother, who plans to run for governor as Libertarian; photo (M)"
2001-09-01 05:00:00+00:00,"Selling short, where the investor hopes to profit by borrowing a stock and selling it, then buying the shares back at a lower price before returning it, is a risky proposition. But the collapse in technology stocks has proved to be unusually ferti..."
2001-09-01 05:00:00+00:00,"Alan Greenspan, chairman of Federal Reserve, says Fed is trying to sort out ways in which different assets, such as stocks or homes, affect consumer spending; rule of thumb used by many economists is that for every one dollar increase in household..."
2001-09-01 05:00:00+00:00,FINANCIAL journalists have a tough job. They must analyze stock-market gyrations. They are barraged by streams of economic data in need of interpretation. And they sift through a clutter of corporate news announcements to discover whether the fina...
2001-09-01 05:00:00+00:00,"MANY big European companies, by tradition and managerial temperament, hide their assets in plain sight. Onerous tax regimes, statist labor practices and executive hubris have left the Continent littered with inefficiently run and organized conglom..."
2001-09-01 05:00:00+00:00,"AN INVESTOR searching for value investments will find a rich trove of targets in Japan, where listed shares valued far below par, or even below liquid asset value, are plentiful.. The problem is, many such companies remain undervalued forever. . I..."
2001-09-01 05:00:00+00:00,
2001-09-01 05:00:00+00:00,
2001-09-01 05:00:00+00:00,"Schroders, leading pension fund manager in Europe, ousts its chief executive, David Salisbury, after big clients move their accounts elsewhere and first-half profit plummets by greater than two-thirds; funds under management fall to $178.3 billion..."
2001-09-01 05:00:00+00:00,"IHT INSIGHT / First of three parts.Is Damocles' sword going to hang indefinitely over the necks of all art buyers, from museums to dealers? Two cases, one publicized in part, the other never made public, raise that threat..The first affair came to..."
2001-09-01 05:00:00+00:00,"Yoshiaki Murakami, the head of M&A Consulting Inc. of Tokyo, stunned corporate Japan early last year when he announced a hostile takeover bid for Shoei Co., an electronics component manufacturer, claiming that the company had not done enough to ra..."
2001-09-01 05:00:00+00:00,"THE ASSETS of mining companies are buried but seldom hidden. An exception is Johnson Matthey PLC, a British producer of precious metals..Personal Finance, an American advisory newsletter, recently recommended the stock for investors who can tolera..."
2001-09-01 05:00:00+00:00,"INNOGY Holdings PLC is an uncovered asset of an erstwhile British state asset. Innogy is the domestic power-generation entity spun off in the reorganization of National Power PLC, one of the two large, privatized English generators..After those su..."
2001-09-01 05:00:00+00:00,"Merrill Lynch & Co. used to run ads proclaiming itself ""bullish on America."" The results of Merrill's latest international survey of fund managers indicates that the same sentiment applies to investors around the world..Bullish they certa"
2001-09-02 05:00:00+00:00,"Economists Robert J Shiller and Jeremy J Siegel are intellectual combatants and longtime friends; their books -- Shiller's Irrational Exuberance and Siegel's Stocks for the Long Run -- argue opposite views of current stock market valuations, as do..."
2001-09-02 05:00:00+00:00,"Article on obscure novelist Jonathan Franzen who took five years to write Corrections, novel about dysfunctional five-member family named Lambert; Franzen promised, in 1996 essay in Harper's magazine, that he would write novel that is intimate, so..."
2001-09-02 05:00:00+00:00,Tom Redburn Economic View column on studies indicating that current Social Security cannot long be sustained and that privatizing it will not make any difference; cites work by Prof Jeffrey A Miron and David Levine; says fairest answer is to raise...
2001-09-02 05:00:00+00:00,"Carole Gould column profiles Thompson Plumb Growth fund and its co-managers, John W and John C Thompson, a father-son team; photo; table; chart (M)"
2001-09-02 05:00:00+00:00,"Article discusses effect of nature on art, as depicted in paintings by Thomas Cole and other artists of Hudson River School; suggests places people might go to see views Cole saw and turned into spectacular paintings; also describes influence of n..."
2001-09-02 05:00:00+00:00,"Article profiles John Voelker, who wrote books about fly-fishing for trout at Frenchman's Pond in Michigan; photo (M)"
2001-09-02 05:00:00+00:00,"Home building has generated strong profits this year, and some investors worry that it is due for a fall after multiple strong years; analysts offer their predictions for industry and individual stocks; graph (M)"
2001-09-02 05:00:00+00:00,Summary of week's financial markets; graphs; table of rates and yields (S)
2001-09-02 05:00:00+00:00,Conflicting investment advice is offered by the economists Robert J Shiller and Jeremy J Siegel (S)
2001-09-02 05:00:00+00:00,"Ian Buruma article on whether China, which has focused on economic reforms, would have fared better if it had concentrated first on political changes, as Russia has done; drawings (M)"
2001-09-02 05:00:00+00:00,Gretchen Morgenson column says one factor weighing down stock market is growing investor skepticism about earnings reported by companies and their projections for future earnings; graph (M)
2001-09-02 05:00:00+00:00,
2001-09-02 05:00:00+00:00,"Conventional office layout is outmoded, and new styles of office furniture accommodate current workers' needs; large furniture companies like Knoll Inc and Herman Miller respond to new work attitudes with designs that embrace, rather than alienate..."
2001-09-02 05:00:00+00:00,"Comverse Technology, citing global economic slowdown, reports 20 percent decline in second-quarter profits, to $50 million, and 18 percent rise in quarterly sales, to $345 million (S)"
2001-09-02 05:00:00+00:00,"DIARYAnnual Reports, 2001: Scissors Not Required  With many companies slashing costs, the number of free samples, coupons and other discount offers inserted in annual reports is expected to decline this year."
2001-09-02 05:00:00+00:00,"Manufacturers of newer food products find it extremely difficult to gain access to supermarket shelves if they are not represented by food brokers; food brokerage industry has consolidated markedly in last few years, and only three brokers cover e..."
2001-09-02 05:00:00+00:00,"Daniel Akst column says that there may now be glut of long-haul fiber optic lines in US, but that if history is any indicator, new applications will emerge to make use of them (M)"
2001-09-02 05:00:00+00:00,"Anti-American feeling in Greece may at last be changing, nearly 30 years after demise of American-supported military dictatorship there; most popular politician in country is Foreign Min George A Papandreou, who is American born, American educated..."
2001-09-02 05:00:00+00:00,"Article on former Remington Arms Co factory in Bridgeport, Conn, 17 interconnected buildings that have been converted into International Enterprise Park; tenants include Habitat for Humanity; photos (M)"
2001-09-02 05:00:00+00:00,"Interview with Bear Stearns investment strategist Elizabeth MacKay, who comments on why she left job to enroll in law school; photo (M)"
2001-09-02 05:00:00+00:00,"Profile of Patti S Hart, chief executive of financial beleagued ExciteAtHome; photo (M)"
2001-09-02 05:00:00+00:00,"Richard C Pell, co-manager of Julius Baer International Equity fund, answers questions on opportunities abroad for US investors; focuses on Europe, including Eastern Europe; photo (M)"
2001-09-02 05:00:00+00:00,Mark Hulbert column says investment advisory newsletters and options market provide evidence to support contrarian view that this bear market is not yet over; graph (M)
2001-09-02 05:00:00+00:00,"Hedge funds that invest in convertible bonds have attracted capital from many wealthy investors fleeing current declining stock market, but investors who put money into these funds now may too late; decline in stock market volatility is giving sho..."
2001-09-02 05:00:00+00:00,"Article on Combe Inc, privately held, family-owned company based in White Plains, NY, that, rather than competing against health and beauty aid giants, makes niche products; photos (M)"
2001-09-02 05:00:00+00:00,Felicia Lee Coping column on Traded to Trading: Portraits of Wall Street in the Black; documentary being made by Robyn Greene and Fernanda Rossi is about African-Americans on Wall Street; drawing (M)
2001-09-02 05:00:00+00:00,Paul Krugman Op-Ed column assesses economic consequences of bursting of stock-market bubble (M)1
2001-09-02 05:00:00+00:00,Datek Online Financial Services reports that 65 percent of its account holders anticipate major stock market rally within a year (S)
2001-09-03 05:00:00+00:00,"A Dollar, a Dream and That's All To the Editor:"
2001-09-03 05:00:00+00:00,"IF YOU THINK investing is easy, just check out the title of a lecture given this year by one of America's most distinguished economists, Robert Hall: ""Struggling to Understand the Stock Market."" .""Economists are as perplexed as anyone by"
2001-09-03 05:00:00+00:00,"Profile of BellSouth; among seven regional Bell companies that emerged from 1984 breakup of AT&T, only BellSouth is still, primarily, regional phone company; by forgoing national expansion to focus on local service in same nine states where it has..."
2001-09-03 05:00:00+00:00,"Irvin Meyer, who won Tony Award in 1977 for co-producing Broadway musical Annie, and who also served time in prison for tax fraud, has reinvented himself as Internet entrepreneur; in 1999 he discovered a technology that could scour Internet chat r..."
2001-09-03 05:00:00+00:00,
2001-09-03 05:00:00+00:00,"Nation's economic boom has collapsed despite faith of Fed chairman Alan Greenspan that ever-greater efficiencies of information age would keep raising profits, incomes and employment at healthy pace; nation instead is barely skirting recession, st..."
2001-09-04 05:00:00+00:00,"Many employees, particularly managers, will probably receives drastically lower bonuses at end of year or early 2002 because of economic downturn and poor performance of stock markets; companies are now deciding whether to tell employees and their..."
2001-09-04 05:00:00+00:00,"Global Marine and Santa Fe International merge in $3 billion stock swap; combined company, to be called Global-SantaFe, will be second-largest offshore drilling contractor in world; Santa Fe will also assume about $900 million in debt; Devon Energ..."
2001-09-04 05:00:00+00:00,"Fixed rates on home mortgages are nearing low of early 1999; Freddie Mac says that in last three weeks, average interest rate on 30-year mortgages nationwide has been below 7 percent for first time since March, to 6.92 percent; on adjustable mortg..."
2001-09-04 05:00:00+00:00,
2001-09-04 05:00:00+00:00,"Alliance Atlantis Communications has had great successs with its television movies and series, but some investors are concerned about company's debt levels and recent stock offering that diluted shareholders' value; Toronto-based company produces ..."
2001-09-04 05:00:00+00:00,Hewlett-Packard will acquire Compaq Computer for $25 billion in stock in bold move to grow as computer industry struggles with shrinking sales; merger would produce company with total revenues only slightly less than that of IBM; would create stro...
2001-09-04 05:00:00+00:00,"First article in three-part series Tracks in Cyberspace, on online privacy; focuses on growing concern over use of 'cookie' data files to help computers running Web sites identify persons visiting them; use has fundamentally altered nature of surf..."
2001-09-04 05:00:00+00:00,"Blue-chip stocks attempted to stage a robust rally today, but the market lost momentum in the last hour of trading and the gains dwindled"
2001-09-04 05:00:00+00:00,
2001-09-05 05:00:00+00:00,
2001-09-05 05:00:00+00:00,"US Army reports its most successful recruiting year since 1997, after struggling in late 1990's to overcome roaring economy and stodgy image; other three services report they are also on track to meet goals for fiscal year ending September 30; Air..."
2001-09-05 05:00:00+00:00,"HARDWARE SANMINA ISSUES EARNINGS WARNING The San- mina Corporation, which builds electronic equipment for other companies, said yesterday that sales and earnings this quarter would be less than forecast as customers reduce spending. Sales will be ..."
2001-09-05 05:00:00+00:00,"Executives from Hewlett-Packard, company synonymous with printers, and Compaq Computer, known for personal computers, defend their plans to merge into world's largest computer maker on ground that they would like to be known not for selling hardwa..."
2001-09-05 05:00:00+00:00,"Editorial says Hewlett-Packard remains icon of American entrepreneurial spirit, with record of reinventing itself every so often since its 1938 creation by William Hewlett and David Packard in now fabled Palo Alto, Calif, garage; says company will..."
2001-09-05 05:00:00+00:00,"Dow Jones industrial average gains 47.74 points, to 9,997.56; Nasdaq composite index drops 34.65 points, to 1,770.78; Standard & Poor's 500-stock index falls 0.64 of point, to 1,132.94; graph; chart (M)"
2001-09-05 05:00:00+00:00,"Russian oil companies, eager to live down their poor reputations, are paying shareholders rich dividend; dividends are tool of choice to woo investors; oil companies that pay hefty dividends include Sibneft and Yukos (M)"
