pub_date,snippet
2002-03-07 05:00:00+00:00,Prospects for Conseco Inc dim as chief financial officer Chuck Chokel abruptly resigns and Moody's Investors Service warns that company might not be generating enough cash to meet its obligations; president Bill Shea will be chief financial office...
2002-03-07 05:00:00+00:00,"Congressional proposal to increase amount of bank deposits protected by government insurance is facing opposition from Bush administration and Federal Reserve; level has remained unchanged, at $100,000 per depositors, for more than 20 years, and i..."
2002-03-07 05:00:00+00:00,"Commerce Department releases figures showing pickup of 1.6 percent in orders for manufactured goods in January, after increase of 0.7 percent in December; Federal Reserve's 'beige book' of reports of 12 districts describes more signs of improvemen..."
2002-03-07 05:00:00+00:00,"U.S. trading partners Tuesday denounced President George W. Bush's decision to impose steep tariffs on imported steel, stopping short of tit-for-tat retaliation but warning that the American action had undermined the global free-trade agenda..Whil..."
2002-03-07 05:00:00+00:00,"Pres Bush will unveil proposals to protect investors better through faster and more complete disclosure of important financial information, improved auditing standards and new requirements for executives as Congress considers legislattive response..."
2002-03-07 05:00:00+00:00,"Somebody is going to wind up red-faced..Two well-respected experts on opposite sides of the globe have made currency predictions that can only be described as worlds apart..Independent Strategy, an investment advisory company in London led by Davi..."
2002-03-07 05:00:00+00:00,"Market Place column on prospects of Sabre Holdings acquiring 30 percent of Travelocity.com it does not own; says Travelocity's independent directors want more than $23 per share offered, and some speculators are betting that they will get it (M)"
2002-03-07 05:00:00+00:00,"Cruising apartment open-houses has become popular weekend ritual for New York City home- and apartment-buyers, and even attracts people who are just curious about other peoples' homes; photos of apartment-hoppers on West Side (M)"
2002-03-07 05:00:00+00:00,"South Korean government unveils far-reaching plan to sell back to private sector most of controlling stakes in banks that it acquired at climax of 1997-98 economic crisis, when they were threatened with bankruptcy; Korea Deposit Insurance Corp des..."
2002-03-07 05:00:00+00:00,"Comment on Sherwood Cafe/Robin des Bois, cafe-antiques shop in Boerum Hill, Brooklyn; photo (S)"
2002-03-07 05:00:00+00:00,"New York Stock Exchange says it has been asked to look at books of American Stock Exchange, whose owner, National Association of Securities Dealers, is looking for buyer; NYSE spokesman Robert Zito says Big Board has not yet seen any books and tha..."
2002-03-08 05:00:00+00:00,"Residential Real Estate column on transformation of old Daily news printing plant in Prospect Heights, Brooklyn, into high-end condominium; photo (S)"
2002-03-08 05:00:00+00:00,"Future mergers in advertising industry may not be easy because there are only handful of independent, medium-size agencies left, and most of those would present obstacles, both financial and regulatory, for any potential buyer; Publicis Groupe's a..."
2002-03-08 05:00:00+00:00,Pres Bush's budget advisers refuse to give Securities and Exchange Commission chairman Harvey L Pitt funds he requested to police markets as Bush announces his plan to protect investors from fraud; Pitt asks Congress for $91 million more to increa...
2002-03-08 05:00:00+00:00,"Intel Corp says it is on track to report revenue of $6.6 billion to $6.9 billion in first quarter, compared with $6.4 billion to $7 billion it projected on Jan 15; chief financial Andy D Bryant comments; National Semiconductor reports loss of $37...."
2002-03-08 05:00:00+00:00,
2002-03-08 05:00:00+00:00,"News analysis: Federal Reserve Chairman Alan Greenspan's assertion to Senate Banking Committee that economic recovery is well underway, in contrast to his guarded optimism only week ago, takes stock and bond traders by surprise; market participant..."
2002-03-08 05:00:00+00:00,"""In the short run, the market is a voting machine, but in the long run it is a weighing machine."" . That 1934 observation comes from Benjamin Graham, the Columbia University business professor who is considered the father of value investing, whi"
2002-03-08 05:00:00+00:00,"The Federal Reserve chairman, Alan Greenspan, on Thursday offered his most upbeat assessment for a recovery in the United States since the Sept. 11 attacks, saying an expansion was already ""well under way."". In remarks to Congress, Greenspan pai"
2002-03-08 05:00:00+00:00,"Sepracor Inc says Food and Drug Administration will not approve its new allergy drug Soltara because company failed to provide enough evidence that drug will not cause heart problems; Sepracor's shares plunge $27.63, or 58 percent, to $19.64; chai..."
2002-03-08 05:00:00+00:00,"Advertising agencies Bcom3 Group of US, Dentsu of Japan and Publicis Groupe of France will merge, creating world's fourth-largest advertising corporation under Publicis name; three agency companies will account for estimated 40 percent of worldwid..."
2002-03-08 05:00:00+00:00,"Japan's economy contracted sharply in fourth quarter of 2001, by 1.2 percent; for all of 2001, economy contracted 0.5 percent; most economists expect Japan's economy to go on shrinking in 2002, though not so rapidly, and for growth not to resume u..."
2002-03-09 05:00:00+00:00,"Hormel Foods Corp. was less than enthusiastic when it became aware in the mid-1990s that Spam, the canned luncheon meat that is its most famous product, was being used to describe unsolicited electronic junk mail. .But in the end, the meatpacking ..."
2002-03-09 05:00:00+00:00,"Stocks rise to end week higher, second consecutive strong week for markets; S&P 500 rises 6.77 points, to 1,164.31, while Nasdaq composite index jumps 48.04 points, to 1,929.67; Dow Jones industrial average climbs 47.12 points, to 10,572.49; rally..."
2002-03-09 05:00:00+00:00,Serono AG rÿ
2002-03-09 05:00:00+00:00,"The Federal Reserve chairman, Alan Greenspan, has offered his most upbeat assessment for a recovery in the United States since the Sept. 11 attacks, saying an expansion was already ""well under way."". In remarks to Congress on Thursday, Greenspan"
2002-03-09 05:00:00+00:00,"The market has risen smartly in recent weeks, but the average stock is still down by more than one-fifth from its high of two years ago. Does that mean shares are still cheap? On the contrary, say analysts like James Grant, They're dangerously exp..."
2002-03-09 05:00:00+00:00,"Not long after Sept. 11, a 24-year-old broker from a small financial firm that had offices in the World Trade Center donned yellow boots and a yellow hard hat and marched through Ground Zero, calling out to anyone who would listen, ""Hugs and kisse..."
2002-03-09 05:00:00+00:00,Former Enron Corp say company might have been able to avoid bankruptcy if it had completed deal in summer of 2000 to sell bulk of its international energy holdings for about $7 billion to group composed primarily of wealthy Middle Eastern investor...
2002-03-09 05:00:00+00:00,"Are you a proactive, savvy investor, hungry for small-capitalization stocks? Then you might have enjoyed an unsolicited e-mail from an outfit called SmallCap Central, drumming up interest in Baltia Air Lines Inc. . The e-mail, flashy and colorful,..."
2002-03-10 05:00:00+00:00,"Pres Bush's decision to resort to tariffs to protect what is left of Big Steel in its struggle against foreign competition may produce political hybrid in bitterly depressed Ohio: Bush Democrats; Bernie Ravasio, president of United Steelworkers of..."
2002-03-10 05:00:00+00:00,Usually sleepy Irish stock exchange has been rocked by accounting questions at Elan Corp and currency trading woes at Allied Irish Banks that have dragged down exchange's benchmark index nearly 12 percent since Jan; two company's market capitaliza...
2002-03-10 05:00:00+00:00,market insight: builders
2002-03-10 05:00:00+00:00,Prof Leslie S Hiraoka lette
2002-03-10 05:00:00+00:00,"Correction of Mar 3 article: Lehman Brothers report on Alloy Inc stock did not say any analyst who contributed to report, or any member of such analyst's household, owned Alloy stock"
2002-03-10 05:00:00+00:00,Burke Stinson letter on James Schembari's Feb 24 article recalls how he handled own inheritance9
2002-03-10 05:00:00+00:00,Growth and safety of asset-backed securities discussed in light of Enron collapse; holders of Enron's asset-backed commerical paper collected all $58 million owed them at time when Enron's stock and bonds plummeted; tools of so-called structured f...
2002-03-10 05:00:00+00:00,Analysts are mixed o
2002-03-10 05:00:00+00:00,"Article on popularity among young New York executives of finely tailored, high-priced English shirts; photos (M)"
2002-03-10 05:00:00+00:00,Rob Nixon travel article on trip through Chiricaua Mountains of southeastern Arizona; photos; maps (L)
2002-03-10 05:00:00+00:00,"Article describes changes at Getty Petroleum Marketing headquarters in Jericho, NY, since its acquisition by Lukoil, Russian oil giant, more than year ago; takeover has generally been employee-friendly, with no wholesale layoffs or disruptions; co..."
2002-03-10 05:00:00+00:00,day trading takes a co
2002-03-10 05:00:00+00:00,"David Kehr article on movie The Man Who Wasn't There, black and white film directed by brothers Ethan and Joel Coen that has been nominated for Academy Award for best cinematography; photo (Special supplment on the Oscars) (Section 2A) (M)"
2002-03-10 05:00:00+00:00,Jonathan Fuerbringer column discusses bigger than normal spread in commercial paper market between interest rates on top-rated paper and those for second tier as sign of continuing economic concern; graph (M)
2002-03-10 05:00:00+00:00,"Seth Stevenson on Coca Cola's efforts to develop and market soft drink to appeal to fickle young consumers in Japan, where beverage landscape changes almost daily and consumer demand drives Coke to invent new products and scrap old ones at mind-bo..."
2002-03-10 05:00:00+00:00,Gretchen Morgenson column on significant and deleterious share inflation at largest corporations that could lead to disappointing per-share earnings growth; notes stock splits were major force behind big increase in share counts; graph of growth i...
2002-03-10 05:00:00+00:00,"Article on problems Suffolk County, NY, faces as homeless population continues to grow; county, as of March 1, was providing shelter to record 496 homeless families, 150 in motels, some, in Hamptons, at cost of $9,900 a month; lack of affordable h..."
2002-03-10 05:00:00+00:00,Royce Low-Price Stock
2002-03-10 05:00:00+00:00,"North Korea is cultivating Europe and Southeast Asia as alternatives for aid and foreign investment, as relations with United States, Japan and South Korea grow cold or colder; impoverished Communist nation has $12 billion in foreign debt and per ..."
2002-03-11 05:00:00+00:00,"Article in The Media Giants series profiles Rupert Murdoch's empire, which encompasses broadcast, cable and satellite television, movies, books and newspapers; Murdoch says his focus today is not on further acquisitions but on improving operationa..."
2002-03-11 05:00:00+00:00,"If you believe the stock market, the sick man of Europe is out of bed and pumping iron. .In the past two weeks, the German stock market has suddenly transformed into a muscleman on steroids, shooting up 13 percent since Feb. 22. The benchmark DAX ..."
2002-03-11 05:00:00+00:00,"Warren E Buffett, in his annual report to Berkshire Hathaway shareholders, says company's net work fell $3.7 billion in 2001, to 57.9 billion, first such decline in 37 years; takes blame for decline; reports operating losses of $4.3 billion, inclu..."
2002-03-11 05:00:00+00:00,Warren E Buffett uses Berkshire Hathaway annual report to renew attack on widespread use of stock options and at ways corporations assure that executives will profit from options even if company's share price declines; argues that stock options of...
2002-03-11 05:00:00+00:00,"These days, photographers who are thinking about setting aside their 35mm film cameras to check out the digital ones face store shelves stocked with a variety of models, with evocative names like Powershot and Cybershot. They are capable of taking..."
2002-03-11 05:00:00+00:00,"Intersil Corp, developer of microchips that power high-speed wireless networks, agrees to buy Elantec Semiconductor, which makes microchips for video and optical storage market, for $1.43 billion in cash and stock (M)"
2002-03-11 05:00:00+00:00,E-commerce businesses seek to raise online spending by college students in hopes that they will become lifetime customers; only $1.4 billion of $100 billion in discretionary cash at disposal of college students is spent online each year; vastly di...
2002-03-11 05:00:00+00:00,Perhaps best chance for Democrats to dent Pres Bush's wartime popularity and put Republicans on defensive for Congressional elections in November is fading away along with recession; improving outlook suggests economy is less likely to be big issu...
2002-03-12 05:00:00+00:00,Many Americans nearing retirement age will not be able to stop working because they are deeply in debt; credit counselors confirm that they are seeing large numbers of older consumers; couples having children later in life are likely to have more ...
2002-03-12 05:00:00+00:00,"Kmart Corp announces chief executive Charles C Conaway's departure after board vote; James B Adamson, board member who took Conaway's spot as company chairman on Jan 18, four days before Kmart filed for bankruptcy, will replace Conaway; Julian C D..."
2002-03-12 05:00:00+00:00,"In 1914, moviegoers were first treated to ""The Perils of Pauline,"" a silent serial drama in which an heiress was beset by one crisis after another. . Do you notice a similarity to the world's financial markets? Henry Kaufman does. . Now a privat"
2002-03-12 05:00:00+00:00,"Weak stock market hurts endowments of New Jersey colleges and universities, including Drew University, Rutgers and Princeton (S)"
2002-03-12 05:00:00+00:00,NEW YORK: The irrepressible inventor is again causing trouble in the stock market. It will be remembered what a flutter the introduction of electric lighting created years ago in gas stocks. Something of the same sort but in a milder form has been...
2002-03-12 05:00:00+00:00,"Large infusion of cash by real estate investors, primarily Latin American buyers, allows South Florida to skirt national economic downturn; National Association of Home Builders reports Florida led country in 2001 in permits for new homes, with 16..."
2002-03-12 05:00:00+00:00,
2002-03-12 05:00:00+00:00,"New York Times poll finds people continue to invest in 401(k)'s and IRA's, even as stock market volatility affects their retirement savings; some are changing allocations of savings and many try to save more in uncertain economy; photo; (special s..."
2002-03-12 05:00:00+00:00,"Six months after Sept 11 terrorist attacks individuals have emerged newly optimistic about stock market, with many believing that any fall in prices will be temporary and that market is fairly valued or even undervalued; institutional investors ha..."
2002-03-12 05:00:00+00:00,"Cisco Systems file statement with Securities and Exchange Commission that includes new disclosures about its financial positions, development Cisco officials attribute to heightened calls for openness by public companies; Cisco says it reached dea..."
2002-03-12 05:00:00+00:00,South Africa's Old Mutual is discussing sale of its Old Mutual Securities unit to investment bank Beeson Gregory (S)
2002-03-13 05:00:00+00:00,"Dr James Tobin, economist who was top adviser in Kennedy administration, dies at age 84; photo (M)"
2002-03-13 05:00:00+00:00,"Telecommunications industry's long-simmering financial problems and accounting turmoil have boiled over, reaching WorldCom, nation's second-largest long-distance company and world's leading carrier of Internet traffic; Securities and Exchange Comm..."
2002-03-13 05:00:00+00:00,"When communism collapsed, so did East Germany's existing computer industry. Legions of microelectronic engineers in this city, who had spent their Soviet-era careers pirating Western technology, found themselves driving taxicabs or pumping gas..Ba..."
2002-03-13 05:00:00+00:00,"Tobias Lefkovich, analyst at Salomon Smith Barney, Wall Street firm that helped Bernard J Ebbers create WorldCom, drops stock from his closely watched list of stocks recommended to institutional investors; Jack Grubman, firm's top telecommunicatio..."
2002-03-13 05:00:00+00:00,"Co-op and condominium sales in Manhattan have rebounded strongly in last two months, despite predictions of real estate recession in aftermath of Sept 11; agents say they are awash with bids and bidding wars, and that prices are gradually rising, ..."
2002-03-13 05:00:00+00:00,Florence Fabricant column on using colorful new varieties of swiss chard; recipes; photo (M)
2002-03-13 05:00:00+00:00,"If you think investors are scared off of steel stocks now that President George W. Bush has whacked the world's steelmakers with steep tariffs, you had better think again. .Consider Arcelor, the European steelmaker. Investors initially stampeded o..."
2002-03-13 05:00:00+00:00,"Nokia says it expects its sales in first quarter to contract more sharply than its prior forecast of 10 percent fall; says sales of network equipment to builders of mobile phone networks, less than one-third of Nokia's overall business, appear lik..."
2002-03-13 05:00:00+00:00,"Japanese government-led turnaround has catapulted benchmark Nikkei 225-stock index up 23 percent from 18-year low on Feb 6, even as it slips 2.6 percent, to 11,607.33, largely on profit taking; Nikkei's rally has some investors crying foul and man..."
2002-03-13 05:00:00+00:00,"Regina Schrambling samples fare from new restaurants in Philadelphia, Pa; recipes from Django and Standard Tap; photo (L)"
2002-03-13 05:00:00+00:00,"Article on white-collar criminal career of Lionel Reifler, who pleads guilty to conspiring to rig price of FinancialWeb.com stock traded on over-the-counter bulletin board (Market Place column) (M)"
2002-03-13 05:00:00+00:00,
2002-03-13 05:00:00+00:00,"Lucent Technologies warns Wall Street that its revenue in current quarter will fall short of projections company made as recently as three weeks ago; Lucent moves to shore up its shaky finances, announcing plans to raise $1.5 billion in private sa..."
2002-03-13 05:00:00+00:00,"Tens of thousands of Nigerians flock to huge Christian Winners' Church in Otta, one of many places in Africa that symbolize American-influenced Pentecostal culture of giant churches and lucre-minded television preachers; walled campus of showy fac..."
2002-03-14 05:00:00+00:00,"Securities and Exchange Commission filing shows Aliza Waksal, daughter of ImClone Systems' chief executive Samuel D Waksal, sold nearly $2.5 million of company stock day before Food and Drug Administration rejected ImClone's application to market ..."
2002-03-14 05:00:00+00:00,Use of stock to finance deals in 1990's is haunting telecommunications companies in Europe; companies used stock options to finance many acquisitions at what now appear to be inflated valuations; companies issued options giving stockholder right t...
2002-03-14 05:00:00+00:00,"Article on remarkable community effort to keep Apple Book Center, independent book store in predominantly black neighborhood owned by Sherry McGee, from closing; community comittee has been formed and store has started selling memberships for stor..."
2002-03-14 05:00:00+00:00,
2002-03-14 05:00:00+00:00,"Corixa Corp says Bexxar, its drug for non-Hodgkin's lymphoma, will not win approval anytime soon; company says it has been told by Food and Drug Administration that it has not adequately demonstrated safety and clinical benefit of drug and that ne..."
2002-03-14 05:00:00+00:00,"With the Enron debacle still stinging, investors rightly are worried about nasty surprises from other companies. They are groping to understand a key element in the assessment of a stock price: a company's earnings. But earnings — like many things..."
2002-03-14 05:00:00+00:00,"When the Chemistry Club, a networking group for people in the technology industry, met several weeks ago in London, the list of attendees read more like a Who's Who of the old economy than the new one. John Browett, chief executive of Tesco.com, t..."
2002-03-14 05:00:00+00:00,"Small but growing number of Japanese investors are preparing for worse economic times and hoarding gold; World Gold Council says with limits looming on bank deposit insurance, banks tottering under bad debts and government printing money in effort..."
2002-03-14 05:00:00+00:00,"The latest book by George Soros, the billionaire financier and philanthropist, is an analytical essay about globalization in which he calls for greater regulation of the financial system and a stronger political hand to match the money side of the..."
2002-03-14 05:00:00+00:00,Hal R Varian 'Economic Scene' column holds Enron Corp's greatest contribution to American economy may be reform of accounting rules and clearer reporting of corporate finances; says Treasury Sec Paul H O'Neill was right when he said in January tha...
2002-03-14 05:00:00+00:00,"WorldCom Inc's financial problems, including Securities and Exchange Commission's request about its accounting practices, has not shaken faith of some of its biggest investors, including Charles Freeman, who manages $15.3 billion Vanguard Windsor ..."
2002-03-14 05:00:00+00:00,"Internet software maker and consultant divine Inc is acquiring marketing company, Delano Technology Corp, for about $31.4 million in stock (S)"
2002-03-15 05:00:00+00:00,"Members of Congress investigating Enron Corp's collapse say Vinson & Elkins, lawyers for Enron Corp, failed to recognize serious conflicts of interests and did not act on information that clearly should have raised concerns about company's account..."
2002-03-15 05:00:00+00:00,"Securities and Exchange Commission, in move to keep rapidly growing problems of Arthur Andersen from spilling over into nation's financial markets, relaxes rules for more than 2,000 publicly traded corporate clients of firm; SEC takes extraordinar..."
2002-03-15 05:00:00+00:00,"Floyd Norris comment on how many employees at WorldCom Inc and Qwest Communications who are issued stock options hope their share prices fall further; says employees of both companies are being offered opportunity to cancel their old, out-of-the-m..."
2002-03-15 05:00:00+00:00,"For Societe Generale, the sky suddenly darkened Thursday — or did it?.A long-standing investigation into the French bank, whose top executives have been under scrutiny for suspected money-laundering, widened Thursday to encompass the entire insti"
2002-03-15 05:00:00+00:00,"Psion PLC, the British company that pioneered the handheld digital organizer in the mid 1980s, posted a pretax loss on Thursday of £149.5 million ($212 million) and said its chief executive, David Levin, would step down. .Levin is leaving Psion on"
2002-03-15 05:00:00+00:00,Salomon Smith Barney is under investigation by New York Stock Exchange for possible violations surrounding firm's handling of number of accounts opened by WorldCom employees to exercise stock options in 1999 and 2000; investigation centers on firm...
2002-03-16 05:00:00+00:00,This week marked the six-month anniversary of the Sept. 11 terrorist hijack attacks. The Money Report took the opportunity to look back at its November story on investing in the cruise lines and travel companies that were struggling to deal with u...
2002-03-16 05:00:00+00:00,"For global media moguls, Europe has become a land of broken dreams..Some of the biggest names in the industry bet billions of dollars on efforts to string together the region with giant cable systems that would combine cable television, telephone ..."
2002-03-16 05:00:00+00:00,". When people ask me what stocks to buy, my answer sounds flippant, but I'm dead serious: Buy the stocks of the best companies. Or, to put it simply, buy the best businesses. . As simple as that exhortation sounds, many investors ignore it. They b..."
2002-03-17 05:00:00+00:00,"Value of seats on nation's option exchanges has fallen sharply, hurting investors who bought them on expectation of appreciation; there is still no consensus on whether options make sense as financial tool for ordinary people; graphs; photos (M)"
2002-03-17 05:00:00+00:00,"Computer programmers, who were in great demand only three years ago, now face grim job market; recruiters suggest that market is starting to turn around, with slight increase in job postings and new hires over past couple of months; warn that empl..."
2002-03-17 05:00:00+00:00,"Carole Gould profile of Jeremy J Hosking, director of Marathon Asset Management, adviser to $145 million Vanguard Global Equity fund, who believes that biggest investment bargains in world are now in Southeast Asia; photo; graph (M)"
2002-03-17 05:00:00+00:00,"Bankruptcy filing offers Kmart Corp chance to rid itself of unprofitable stores, shrink payroll and reinvent self; company's repeated management missteps recalled; graphs; photos (M)"
2002-03-17 05:00:00+00:00,"Tenants living at Norwich Gate complex in East Norwich, Long Island, fear that they will be forced out of their government subsidized apartments now that landlord, Norwich Gate Co, has decided against renewing Section 8 contract with Housing and U..."
