pub_date,snippet
2002-04-23 05:00:00+00:00,"function pop_me_up(pURL, features){new_window = window.open(pURL, ""popup_window"", features);new_window.focus();}  function changeImage(image_name,image_src) {document.images[image_name].src = image_src;}  function MM_jumpMenu(targ,selObj,restore){..."
2002-04-23 05:00:00+00:00,"National Grid Group confirms it has agreed to acquire Lattice Group, former unit of British Gas that owns gas pipelines that crisscross Britain, for about $9 billion in stock; company plans to use its newly strengthened position in electric and na..."
2002-04-23 05:00:00+00:00,"Dow Jones industrial average loses 120.68 points, or 1.2 percent, to 10,136.43; Nasdaq composite index drops 38.15 points, or 2.1 percent, to 1,758.68; Standard & Poor's 500-stock index falls 17.34 points, or 1.5 percent, to 1,107.83; graph; chart..."
2002-04-23 05:00:00+00:00,"Lucent Technologies plans to cut 6,000 more jobs--reducing company to less than half its peak size--and might need to take additional steps to return to profitability; says it lost $495 million in second quarter of its fiscal year, on revenue of $..."
2002-04-23 05:00:00+00:00,"function pop_me_up(pURL, features){new_window = window.open(pURL, ""popup_window"", features);new_window.focus();}  function changeImage(image_name,image_src) {document.images[image_name].src = image_src;}  function MM_jumpMenu(targ,selObj,restore){..."
2002-04-23 05:00:00+00:00,"In Jean-Marie Le Pen's fulminations against immigrants, one border-crosser is the subject of particular bile: the euro, which the French far-right leader calls a ""currency of occupation."" So it was perhaps no surprise that the euro — which"
2002-04-23 05:00:00+00:00,Shares of Zurich Financial Services Group rise 5 percent after chairman-chief executive Rolf Huppi says he will resign after 39 years at company; graph (S)
2002-04-23 05:00:00+00:00,"function pop_me_up(pURL, features){new_window = window.open(pURL, ""popup_window"", features);new_window.focus();}  function changeImage(image_name,image_src) {document.images[image_name].src = image_src;}  function MM_jumpMenu(targ,selObj,restore){..."
2002-04-23 05:00:00+00:00,"In December 1999, David Webb, Hong Kong's best-known crusader for shareholders' rights, paid Boto International Holdings Ltd. the ultimate compliment: He urged investors to buy stock in the maker of artificial Christmas trees for its growth prospe..."
2002-04-23 05:00:00+00:00,"function pop_me_up(pURL, features){new_window = window.open(pURL, ""popup_window"", features);new_window.focus();}  function changeImage(image_name,image_src) {document.images[image_name].src = image_src;}  function MM_jumpMenu(targ,selObj,restore){..."
2002-04-23 05:00:00+00:00,"L M Ericsson, leading maker of wireless network equipment, says it will cut its work force by additional 20 percent, that it will probably lose money this year and that it will ask its shareholders for almost $3 billion in new investment; news sen..."
2002-04-23 05:00:00+00:00,"Ryan, Beck & Co will acquire Gruntal Financial brokerage firm's brokerage businesses and some parts of its investment banking operation in exchange for assuming some of Gruntal's liabilities; no details disclosed; price is presumably lower than $2..."
2002-04-23 05:00:00+00:00,"The New York Times: Business Text Version         function pop_me_up(pURL, features){new_window = window.open(pURL, ""popup_window"", features);new_window.focus();}  function changeImage(image_name,image_src) {document.images[image_name].src = image..."
2002-04-23 05:00:00+00:00,"Russia's Lukoil, stung by lagging share price and waning investor interest, announces program of cost-cutting and revamping that it says will bring savings of $500 million annually; central part of program is plan to sell its oil services operatio..."
2002-04-23 05:00:00+00:00,"Article in series, Medicine's Middleman,' focuses on medical groups that make money from endorsing medical products; notes that Child Health Corp of America has 38 pediatric hospital members that purchased nearly $1 billion of supplies last year; ..."
2002-04-23 05:00:00+00:00,By Bloomberg News.
2002-04-23 05:00:00+00:00,"The New York Times: ReutersTechnology         function pop_me_up(pURL, features){new_window = window.open(pURL, ""popup_window"", features);new_window.focus();}  function changeImage(image_name,image_src) {document.images[image_name].src = image_src..."
2002-04-24 05:00:00+00:00,"function pop_me_up(pURL, features){new_window = window.open(pURL, ""popup_window"", features);new_window.focus();}  function changeImage(image_name,image_src) {document.images[image_name].src = image_src;}  function MM_jumpMenu(targ,selObj,restore){..."
2002-04-24 05:00:00+00:00,"function pop_me_up(pURL, features){new_window = window.open(pURL, ""popup_window"", features);new_window.focus();}  function changeImage(image_name,image_src) {document.images[image_name].src = image_src;}  function MM_jumpMenu(targ,selObj,restore){..."
2002-04-24 05:00:00+00:00,"Online broker E*Trade acquires additional 7 percent of its Japanese subsidiary, E*Trade Japan, for $30.7 million to raise its stake to 36.1 percent; E*Trade Japan says its net profit fell 58 percent, to 415 million yen ($3.2 million), in fiscal ye..."
2002-04-24 05:00:00+00:00,JAPAN:; INDIA: Petroleum Profits; South KOREA: Opposition To Hynix Purchase; JAPAN: A Call For Inflation.
2002-04-24 05:00:00+00:00,"function pop_me_up(pURL, features){new_window = window.open(pURL, ""popup_window"", features);new_window.focus();}  function changeImage(image_name,image_src) {document.images[image_name].src = image_src;}  function MM_jumpMenu(targ,selObj,restore){..."
2002-04-24 05:00:00+00:00,"function pop_me_up(pURL, features){new_window = window.open(pURL, ""popup_window"", features);new_window.focus();}  function changeImage(image_name,image_src) {document.images[image_name].src = image_src;}  function MM_jumpMenu(targ,selObj,restore){..."
2002-04-24 05:00:00+00:00,"The New York Times: Business Paper Version         function pop_me_up(pURL, features){new_window = window.open(pURL, ""popup_window"", features);new_window.focus();}  function changeImage(image_name,image_src) {document.images[image_name].src = imag..."
2002-04-24 05:00:00+00:00,"Amazon.com says sales in first quarter grew faster than expected and that its loss was less than expected; says sales were $847 million, up 21 percent, but company lost $23 million, down from loss of $217 million year ago; founder-chief executive ..."
2002-04-24 05:00:00+00:00,"The New York Times: APBusiness         function pop_me_up(pURL, features){new_window = window.open(pURL, ""popup_window"", features);new_window.focus();}  function changeImage(image_name,image_src) {document.images[image_name].src = image_src;}  fun..."
2002-04-24 05:00:00+00:00,"Most American museums are pressing on with building projects despite decline in attendance that followed Sept 11 terrorist attacks; photo (M) (Special section, Museums)"
2002-04-24 05:00:00+00:00,"function pop_me_up(pURL, features){new_window = window.open(pURL, ""popup_window"", features);new_window.focus();}  function changeImage(image_name,image_src) {document.images[image_name].src = image_src;}  function MM_jumpMenu(targ,selObj,restore){..."
2002-04-24 05:00:00+00:00,"In countries that rely on pay-as-you-go state pensions, it is well known that the current Ponzi-scheme structures will collapse in the coming half-century as the ranks of retirees grow while the percentage of working-age people decreases. . People..."
2002-04-24 05:00:00+00:00,"The New York Times: APTechnology         function pop_me_up(pURL, features){new_window = window.open(pURL, ""popup_window"", features);new_window.focus();}  function changeImage(image_name,image_src) {document.images[image_name].src = image_src;}  f..."
2002-04-24 05:00:00+00:00,"The New York Times: Business Text Version         function pop_me_up(pURL, features){new_window = window.open(pURL, ""popup_window"", features);new_window.focus();}  function changeImage(image_name,image_src) {document.images[image_name].src = image..."
2002-04-24 05:00:00+00:00,"The New York Times: ReutersBusiness         function pop_me_up(pURL, features){new_window = window.open(pURL, ""popup_window"", features);new_window.focus();}  function changeImage(image_name,image_src) {document.images[image_name].src = image_src;}..."
2002-04-24 05:00:00+00:00,
2002-04-24 05:00:00+00:00,"function pop_me_up(pURL, features){new_window = window.open(pURL, ""popup_window"", features);new_window.focus();}  function changeImage(image_name,image_src) {document.images[image_name].src = image_src;}  function MM_jumpMenu(targ,selObj,restore){..."
2002-04-24 05:00:00+00:00,"Japanese consumer confidence rose in the first quarter at its fastest rate in three years, the government said Tuesday, as stopgap measures to head off a financial crisis eased fears of a full-scale meltdown in the world's second-largest economy....."
2002-04-24 05:00:00+00:00,Shares of Amazon.com surged more than 19 percent today after the online retailer said that its sales in the first quarter had grown faster than expected.
2002-04-24 05:00:00+00:00,"The New York Times: World Business Text Version         function pop_me_up(pURL, features){new_window = window.open(pURL, ""popup_window"", features);new_window.focus();}  function changeImage(image_name,image_src) {document.images[image_name].src =..."
2002-04-24 05:00:00+00:00,"The New York Times: Your Money Text Version         function pop_me_up(pURL, features){new_window = window.open(pURL, ""popup_window"", features);new_window.focus();}  function changeImage(image_name,image_src) {document.images[image_name].src = ima..."
2002-04-24 05:00:00+00:00,"Several New York chefs are between jobs -- some by choice and some not -- and they are using their time away from daily restaurant grind to reconsider their style of cooking, their constricted way of living and even their profession; among them ar..."
2002-04-24 05:00:00+00:00,"function pop_me_up(pURL, features){new_window = window.open(pURL, ""popup_window"", features);new_window.focus();}  function changeImage(image_name,image_src) {document.images[image_name].src = image_src;}  function MM_jumpMenu(targ,selObj,restore){..."
2002-04-24 05:00:00+00:00,"Challenging skeptics who said that its business had stagnated, Amazon.com said that sales in the first quarter had grown faster than expected and that its loss was less than expected."
2002-04-24 05:00:00+00:00,"function pop_me_up(pURL, features){new_window = window.open(pURL, ""popup_window"", features);new_window.focus();}  function changeImage(image_name,image_src) {document.images[image_name].src = image_src;}  function MM_jumpMenu(targ,selObj,restore){..."
2002-04-24 05:00:00+00:00,
2002-04-24 05:00:00+00:00,Tyco International is reconsidering sale of its plastic unit and plans to announce that it may suspend auction for business because no potential buyer has expressed willingness to pay Tyco's asking price (M)
2002-04-24 05:00:00+00:00,"The New York Times: Media & Advertising Text Version         function pop_me_up(pURL, features){new_window = window.open(pURL, ""popup_window"", features);new_window.focus();}  function changeImage(image_name,image_src) {document.images[image_name]...."
2002-04-24 05:00:00+00:00,"function pop_me_up(pURL, features){new_window = window.open(pURL, ""popup_window"", features);new_window.focus();}  function changeImage(image_name,image_src) {document.images[image_name].src = image_src;}  function MM_jumpMenu(targ,selObj,restore){..."
2002-04-25 05:00:00+00:00,"West Elm, new home furnishings company, offers catalog of stylish items that 20- and 30-something city dwellers can afford; catalog-only retailer is Williams-Sonoma offshoot; senior vice president Lisa Versacio comment, interview; photo (M)"
2002-04-25 05:00:00+00:00,"function pop_me_up(pURL, features){new_window = window.open(pURL, ""popup_window"", features);new_window.focus();}  function changeImage(image_name,image_src) {document.images[image_name].src = image_src;}  function MM_jumpMenu(targ,selObj,restore){..."
2002-04-25 05:00:00+00:00,"The New York Times: Your Money Text Version         function pop_me_up(pURL, features){new_window = window.open(pURL, ""popup_window"", features);new_window.focus();}  function changeImage(image_name,image_src) {document.images[image_name].src = ima..."
2002-04-25 05:00:00+00:00,"function pop_me_up(pURL, features){new_window = window.open(pURL, ""popup_window"", features);new_window.focus();}  function changeImage(image_name,image_src) {document.images[image_name].src = image_src;}  function MM_jumpMenu(targ,selObj,restore){..."
2002-04-25 05:00:00+00:00,"function pop_me_up(pURL, features){new_window = window.open(pURL, ""popup_window"", features);new_window.focus();}  function changeImage(image_name,image_src) {document.images[image_name].src = image_src;}  function MM_jumpMenu(targ,selObj,restore){..."
2002-04-25 05:00:00+00:00,"function pop_me_up(pURL, features){new_window = window.open(pURL, ""popup_window"", features);new_window.focus();}  function changeImage(image_name,image_src) {document.images[image_name].src = image_src;}  function MM_jumpMenu(targ,selObj,restore){..."
2002-04-25 05:00:00+00:00,"Despite recession, terrorism and the collapse of the stock market's technology bubble, many investors still prefer to take their chances in America.. Among those investors, a growing number from Japan and China have been sending their money to Mic..."
2002-04-25 05:00:00+00:00,"AOL Time Warner reports $54.2 billion loss in first quarter, among biggest quarterly losses in corporate history; loss was $1.4 billion in quarter year earlier; revenue increased 7.1 percent, to $9.8 billion from $9.1 billion; company says it will..."
2002-04-25 05:00:00+00:00,"Dow Jones industrial average falls 58.81 points, or 0.6 percent, to 10,030.43; Standard & Poor's 500-stock index drops 7.82 points, or 0.7 percent, to 1,093.14; Nasdaq composite index loses 16.95 points, or 1 percent, to 1,713.34; graph; chart (M)"
2002-04-25 05:00:00+00:00,"The New York Times: World Business Text Version         function pop_me_up(pURL, features){new_window = window.open(pURL, ""popup_window"", features);new_window.focus();}  function changeImage(image_name,image_src) {document.images[image_name].src =..."
2002-04-25 05:00:00+00:00,"The New York Times: APBusiness         function pop_me_up(pURL, features){new_window = window.open(pURL, ""popup_window"", features);new_window.focus();}  function changeImage(image_name,image_src) {document.images[image_name].src = image_src;}  fun..."
2002-04-25 05:00:00+00:00,"function pop_me_up(pURL, features){new_window = window.open(pURL, ""popup_window"", features);new_window.focus();}  function changeImage(image_name,image_src) {document.images[image_name].src = image_src;}  function MM_jumpMenu(targ,selObj,restore){..."
2002-04-25 05:00:00+00:00,"The New York Times: Business Paper Version         function pop_me_up(pURL, features){new_window = window.open(pURL, ""popup_window"", features);new_window.focus();}  function changeImage(image_name,image_src) {document.images[image_name].src = imag..."
2002-04-25 05:00:00+00:00,"The New York Times: Media & Advertising Text Version         function pop_me_up(pURL, features){new_window = window.open(pURL, ""popup_window"", features);new_window.focus();}  function changeImage(image_name,image_src) {document.images[image_name]...."
2002-04-25 05:00:00+00:00,"The New York Times: Business Text Version         function pop_me_up(pURL, features){new_window = window.open(pURL, ""popup_window"", features);new_window.focus();}  function changeImage(image_name,image_src) {document.images[image_name].src = image..."
2002-04-25 05:00:00+00:00,"The New York Times: ReutersBusiness         function pop_me_up(pURL, features){new_window = window.open(pURL, ""popup_window"", features);new_window.focus();}  function changeImage(image_name,image_src) {document.images[image_name].src = image_src;}..."
2002-04-25 05:00:00+00:00,"American International Group head Maurice R Greenberg, who has long fended off questions about who will replace him at helm of company, says he will soon announce succession plan; Greenberg, who will be 77 years old next week, is taking steps to e..."
2002-04-25 05:00:00+00:00,National Association of Securities Dealers notifies few investment firms that they may be charged with violations of securities laws for way they handled sales of new stocks in late 1990's; among them are Robertson Stephens unit of FleetBoston Fin...
2002-04-25 05:00:00+00:00,AOL Time Warner said that it would not achieve its original financial goals for 2002 because the online advertising market had deteriorated further than it had expected.
2002-04-25 05:00:00+00:00,"Debate over Fannie Mae and Freddie Mac, government-sponsored companies that help finance home loans, is heating up again, this time over companies' disclosure policies and exemptions from securities rules; banks and some lawmakers have complained ..."
2002-04-25 05:00:00+00:00,"Jean-Marie Messier braved a rowdy shareholders meeting in Paris, defending his stewardship of the conglomerate against an onslaught of heckling."
2002-04-25 05:00:00+00:00,"function pop_me_up(pURL, features){new_window = window.open(pURL, ""popup_window"", features);new_window.focus();}  function changeImage(image_name,image_src) {document.images[image_name].src = image_src;}  function MM_jumpMenu(targ,selObj,restore){..."
2002-04-25 05:00:00+00:00,Online Shopper column reports on buying gardening equipment and tools online; drawing (M)
2002-04-25 05:00:00+00:00,"Vivendi Universal SA chief Jean-Marie Messier reports better-than-expected 15 percent increase in revenue for company's media and telecommunications businesses, compared with last year's first quarter, despite boos and hecking at shareholders meet..."
2002-04-25 05:00:00+00:00,"function pop_me_up(pURL, features){new_window = window.open(pURL, ""popup_window"", features);new_window.focus();}  function changeImage(image_name,image_src) {document.images[image_name].src = image_src;}  function MM_jumpMenu(targ,selObj,restore){..."
2002-04-25 05:00:00+00:00,"Breed of computer specialist called home-support technician is starting to populate cities around country; Computer Troubleshooters USA has franchises in 14 states, including New York and New Jersey; many on-site technicians started out in tech su..."
2002-04-25 05:00:00+00:00,"function pop_me_up(pURL, features){new_window = window.open(pURL, ""popup_window"", features);new_window.focus();}  function changeImage(image_name,image_src) {document.images[image_name].src = image_src;}  function MM_jumpMenu(targ,selObj,restore){..."
2002-04-25 05:00:00+00:00,"function pop_me_up(pURL, features){new_window = window.open(pURL, ""popup_window"", features);new_window.focus();}  function changeImage(image_name,image_src) {document.images[image_name].src = image_src;}  function MM_jumpMenu(targ,selObj,restore){..."
2002-04-26 05:00:00+00:00,"Securities and Exchange Commission begins formal investigation into Wall Street analysts and their potential conflicts of interest; SEC chairman Harvey L Pitt, one day after meeting with New York State Atty Gen Eliot L Spitzer, says commission wil..."
2002-04-26 05:00:00+00:00,"Every cloud may have a silver lining — though even that can be tarnished..This is a vision near and dear to the economist A. Gary Shilling, who predicts that although many stocks will sport increased dividend yields in coming years, that will not"
2002-04-26 05:00:00+00:00,"WorldCom Inc and MCI post first-quarter consolidated net income of $130 million, down 78 percent from $594 million year earlier; revenue fell 7.8 percent, to $8.12 billion; chairman-chief executive Bernard J Ebbers comments (M)"
2002-04-26 05:00:00+00:00,"Senate Judiciary Committee, reacting to document shredding at Arthur Andersen and what many lawmakers say was widespread fraud at Enron Corp, approves bill that would create new criminal statues for securities fraud and destruction of corporate au..."
2002-04-26 05:00:00+00:00,"Real estate brokers around Northeast say sales of second homes in vacation places are strong, spurred by low mortgage rates and sense of real estate as solid investment in uncertain times; photos (M)"
2002-04-26 05:00:00+00:00,"The nation's economy expanded at its fastest rate in more than two years during the first three months of 2002, the government reported today."
2002-04-26 05:00:00+00:00,
2002-04-26 05:00:00+00:00,Tyco International abruptly reverses business strategies for second time this year amid persistent questions about its accounting practices and its management credibility; says plan to split company into four pieces and sell fifth division was mis...
2002-04-26 05:00:00+00:00,"Editorial notes that General Motors is on upswing after years of decline; attributes its success to uncharacteristacally daring designs, tighter cost structure and no apparent accounting tricks; says main reason for GM's comeback is better managem..."
2002-04-27 05:00:00+00:00,"Henning, a financial analyst with a major Austrian bank, is conversant with all the new software and gadgets to keep his work papers organized, yet he admits he regularly misses deadlines on his personal tax returns..Anne, a middle manager in her ..."
2002-04-27 05:00:00+00:00,"At time when many nonprofit hospitals are struggling, large group owned by those hospitals is spending tens of millions of dollars to shore up its investment in for-profit electronic company in which some of group's officials own stock; some hospi..."
2002-04-27 05:00:00+00:00,"Day after Tyco International says that it plans to spin off its financing division, investors and even Tyco's own bankers question whether company will be able to raise as much from sale as it pledged (S)"
2002-04-27 05:00:00+00:00,
2002-04-27 05:00:00+00:00,"What if Alan Greenspan had sprouted a shock of white hair and traded places with Wim Duisenberg, the floppy-maned frontman of the European Central Bank? Would the ECB, accused of inaction during the economic slowdown last year, have moved with the..."
2002-04-27 05:00:00+00:00,"A visitor to Tokyo just can't believe that this is what a decade of stagnation looks like. Restaurants are full, shops are bustling, construction cranes are all over the place. Yet on Thursday, a government report showed that Japan's economy had ""..."
2002-04-27 05:00:00+00:00,"Spread between interest rates paid on short-term debt issued by companies with so-so credit ratings and debt issued by companies with high ratings narrows, suggesting that riskier companies are having easier time raising money; Eastman Chemical in..."
2002-04-27 05:00:00+00:00,"Swiss stock exchange says it is investigating Logitech International, a leading computer mouse maker, in connecticut with disclosure of its third-quarter earnings report; exchange is examining whether company broke rules when it published its earn..."
2002-04-27 05:00:00+00:00,"Merrill Lynch chmn and chief exec David Komansky, having seen his firm embarrassed and its stock price pummeled, apologizes for behavior of some of brokerage firm's stock analysts and pledges to punish anybody who violates firm's policies, remarks..."
2002-04-27 05:00:00+00:00,"Signs of improving economy fail to stop share prices from sinking; Dow Jones industrial average falls 2.1 percent, ending week off 3.4 percent, worst weekly performance since stock market reopened after Sept 11 terrorist attacks; all major stock i..."
2002-04-27 05:00:00+00:00,
2002-04-27 05:00:00+00:00,BRITAIN: Big Gain At Unilever; BRITAIN: Economic Growth; SWITZERLAND: Earnings Investigation; FRANCE: Executive Change At Renault; GERMANY: No Recovery At Bayer.
2002-04-27 05:00:00+00:00,US Airways says it will probably apply for loan guarantees from federal government in next several weeks; that would set up biggest test to date of government's offer to shore up embattled airline industry after terror attacks of Sept 11; US Airwa...
2002-04-27 05:00:00+00:00,
2002-04-27 05:00:00+00:00,"Taking a foreign job assignment may seem like a leap into the unknown, but there can be even more unknowns and imponderables than employees realize. They should be as prepared as possible before they leave, and even before they go in to talk it ov..."
2002-04-28 05:00:00+00:00,Scene at section of Madison Square Garden described as rabid fans attend National Football League's annual spring draft of college players; photo (M)
2002-04-28 05:00:00+00:00,"Williamsburg section of Brooklyn is attracting city dwellers looking for proximity to Manhattan; prized for its location, area is filled with conversions of nonresidential buildings to apartments renting for half of what people are paying in Manha..."
2002-04-28 05:00:00+00:00,"Federal Agricultural Mortgage Corp (Farmer Mac), set up by Congress to offer farmers easier credit, has quietly been used by its officers and politically connected directors to enrich themselves with lavish salaries and stock options; insiders now..."
2002-04-28 05:00:00+00:00,Portfolios column examines sharp increase in price of gold that has swung sentiment sharply against hedging by investors; graphs (M)
2002-04-28 05:00:00+00:00,"Economists monitor New York City's economy by watching array of indicators, including jobs, Wall Street, tourism and real estate and retail markets, and while they agree that city has not yet emerged from recession, there is disagreement over when..."
2002-04-28 05:00:00+00:00,"Interview with Ronald Baron, manager of $948 million Baron Growth Fund who says he invests for long term and pays little heed to brokerage firm's research when making stock picks; chart; photo (M)"
